{
  "address": "0xA500b0e1360462eF777804BCAe6CE2BfB524dD2e",
  "abi": [
    {
      "anonymous": false,
      "inputs": [
        {
          "indexed": true,
          "internalType": "address",
          "name": "provider",
          "type": "address"
        },
        {
          "indexed": false,
          "internalType": "uint256[]",
          "name": "tokenAmounts",
          "type": "uint256[]"
        },
        {
          "indexed": false,
          "internalType": "uint256[]",
          "name": "fees",
          "type": "uint256[]"
        },
        {
          "indexed": false,
          "internalType": "uint256",
          "name": "invariant",
          "type": "uint256"
        },
        {
          "indexed": false,
          "internalType": "uint256",
          "name": "lpTokenSupply",
          "type": "uint256"
        }
      ],
      "name": "AddLiquidity",
      "type": "event"
    },
    {
      "anonymous": false,
      "inputs": [
        {
          "indexed": false,
          "internalType": "uint256",
          "name": "newAdminFee",
          "type": "uint256"
        }
      ],
      "name": "NewAdminFee",
      "type": "event"
    },
    {
      "anonymous": false,
      "inputs": [
        {
          "indexed": false,
          "internalType": "uint256",
          "name": "newSwapFee",
          "type": "uint256"
        }
      ],
      "name": "NewSwapFee",
      "type": "event"
    },
    {
      "anonymous": false,
      "inputs": [
        {
          "indexed": false,
          "internalType": "uint256",
          "name": "newWithdrawFee",
          "type": "uint256"
        }
      ],
      "name": "NewWithdrawFee",
      "type": "event"
    },
    {
      "anonymous": false,
      "inputs": [
        {
          "indexed": true,
          "internalType": "address",
          "name": "provider",
          "type": "address"
        },
        {
          "indexed": false,
          "internalType": "uint256[]",
          "name": "tokenAmounts",
          "type": "uint256[]"
        },
        {
          "indexed": false,
          "internalType": "uint256[]",
          "name": "fees",
          "type": "uint256[]"
        },
        {
          "indexed": false,
          "internalType": "uint256",
          "name": "invariant",
          "type": "uint256"
        },
        {
          "indexed": false,
          "internalType": "uint256",
          "name": "lpTokenSupply",
          "type": "uint256"
        }
      ],
      "name": "RemoveLiquidityImbalance",
      "type": "event"
    },
    {
      "anonymous": false,
      "inputs": [
        {
          "indexed": true,
          "internalType": "address",
          "name": "provider",
          "type": "address"
        },
        {
          "indexed": false,
          "internalType": "uint256",
          "name": "lpTokenAmount",
          "type": "uint256"
        },
        {
          "indexed": false,
          "internalType": "uint256",
          "name": "lpTokenSupply",
          "type": "uint256"
        },
        {
          "indexed": false,
          "internalType": "uint256",
          "name": "boughtId",
          "type": "uint256"
        },
        {
          "indexed": false,
          "internalType": "uint256",
          "name": "tokensBought",
          "type": "uint256"
        }
      ],
      "name": "RemoveLiquidityOne",
      "type": "event"
    },
    {
      "anonymous": false,
      "inputs": [
        {
          "indexed": true,
          "internalType": "address",
          "name": "buyer",
          "type": "address"
        },
        {
          "indexed": false,
          "internalType": "uint256",
          "name": "tokensSold",
          "type": "uint256"
        },
        {
          "indexed": false,
          "internalType": "uint256",
          "name": "tokensBought",
          "type": "uint256"
        },
        {
          "indexed": false,
          "internalType": "uint128",
          "name": "soldId",
          "type": "uint128"
        },
        {
          "indexed": false,
          "internalType": "uint128",
          "name": "boughtId",
          "type": "uint128"
        }
      ],
      "name": "TokenSwap",
      "type": "event"
    },
    {
      "anonymous": false,
      "inputs": [
        {
          "indexed": true,
          "internalType": "address",
          "name": "buyer",
          "type": "address"
        },
        {
          "indexed": false,
          "internalType": "uint256",
          "name": "tokensSold",
          "type": "uint256"
        },
        {
          "indexed": false,
          "internalType": "uint256",
          "name": "tokensBought",
          "type": "uint256"
        },
        {
          "indexed": false,
          "internalType": "uint128",
          "name": "soldId",
          "type": "uint128"
        },
        {
          "indexed": false,
          "internalType": "uint128",
          "name": "boughtId",
          "type": "uint128"
        }
      ],
      "name": "TokenSwapUnderlying",
      "type": "event"
    },
    {
      "inputs": [],
      "name": "BASE_CACHE_EXPIRE_TIME",
      "outputs": [
        {
          "internalType": "uint256",
          "name": "",
          "type": "uint256"
        }
      ],
      "stateMutability": "view",
      "type": "function"
    },
    {
      "inputs": [],
      "name": "BASE_VIRTUAL_PRICE_PRECISION",
      "outputs": [
        {
          "internalType": "uint256",
          "name": "",
          "type": "uint256"
        }
      ],
      "stateMutability": "view",
      "type": "function"
    }
  ],
  "transactionHash": "0x2b45d415c833a983378c9457bb9a9014eca7716775b045612aedd8c646462da2",
  "receipt": {
    "to": null,
    "from": "0x5BDb37d0Ddea3A90F233c7B7F6b9394B6b2eef34",
    "contractAddress": "0xA500b0e1360462eF777804BCAe6CE2BfB524dD2e",
    "transactionIndex": 0,
    "gasUsed": "4206736",
    "logsBloom": "0x00000000000000000000000000000000000000000000000000000000000000000000000000000000000000000000000000000000000000000000000000000000000000000000000000000000000000000000000000000000000000000000000000000000000000000000000000000000000000000000000000000000000000000000000000000000000000000000000000000000000000000000000000000000000000000000000000000000000000000000000000000000000000000000000000000000000000000000000000000000000000000000000000000000000000000000000000000000000000000000000000000000000000000000000000000000",
    "blockHash": "0xdd9533e0a14b2e445d6a15e15b64e325f7cdc24a9f95acf058b9ea1251296374",
    "transactionHash": "0x2b45d415c833a983378c9457bb9a9014eca7716775b045612aedd8c646462da2",
    "logs": [],
    "blockNumber": 82360663,
    "cumulativeGasUsed": "0",
    "status": 1,
    "byzantium": true
  },
  "args": [],
  "numDeployments": 1,
  "solcInputHash": "bc3a64a5cffb1e8de0dbf9fb306e4f9f",
  "metadata": "{\"compiler\":{\"version\":\"0.6.12+commit.27d51765\"},\"language\":\"Solidity\",\"output\":{\"abi\":[{\"anonymous\":false,\"inputs\":[{\"indexed\":true,\"internalType\":\"address\",\"name\":\"provider\",\"type\":\"address\"},{\"indexed\":false,\"internalType\":\"uint256[]\",\"name\":\"tokenAmounts\",\"type\":\"uint256[]\"},{\"indexed\":false,\"internalType\":\"uint256[]\",\"name\":\"fees\",\"type\":\"uint256[]\"},{\"indexed\":false,\"internalType\":\"uint256\",\"name\":\"invariant\",\"type\":\"uint256\"},{\"indexed\":false,\"internalType\":\"uint256\",\"name\":\"lpTokenSupply\",\"type\":\"uint256\"}],\"name\":\"AddLiquidity\",\"type\":\"event\"},{\"anonymous\":false,\"inputs\":[{\"indexed\":false,\"internalType\":\"uint256\",\"name\":\"newAdminFee\",\"type\":\"uint256\"}],\"name\":\"NewAdminFee\",\"type\":\"event\"},{\"anonymous\":false,\"inputs\":[{\"indexed\":false,\"internalType\":\"uint256\",\"name\":\"newSwapFee\",\"type\":\"uint256\"}],\"name\":\"NewSwapFee\",\"type\":\"event\"},{\"anonymous\":false,\"inputs\":[{\"indexed\":false,\"internalType\":\"uint256\",\"name\":\"newWithdrawFee\",\"type\":\"uint256\"}],\"name\":\"NewWithdrawFee\",\"type\":\"event\"},{\"anonymous\":false,\"inputs\":[{\"indexed\":true,\"internalType\":\"address\",\"name\":\"provider\",\"type\":\"address\"},{\"indexed\":false,\"internalType\":\"uint256[]\",\"name\":\"tokenAmounts\",\"type\":\"uint256[]\"},{\"indexed\":false,\"internalType\":\"uint256[]\",\"name\":\"fees\",\"type\":\"uint256[]\"},{\"indexed\":false,\"internalType\":\"uint256\",\"name\":\"invariant\",\"type\":\"uint256\"},{\"indexed\":false,\"internalType\":\"uint256\",\"name\":\"lpTokenSupply\",\"type\":\"uint256\"}],\"name\":\"RemoveLiquidityImbalance\",\"type\":\"event\"},{\"anonymous\":false,\"inputs\":[{\"indexed\":true,\"internalType\":\"address\",\"name\":\"provider\",\"type\":\"address\"},{\"indexed\":false,\"internalType\":\"uint256\",\"name\":\"lpTokenAmount\",\"type\":\"uint256\"},{\"indexed\":false,\"internalType\":\"uint256\",\"name\":\"lpTokenSupply\",\"type\":\"uint256\"},{\"indexed\":false,\"internalType\":\"uint256\",\"name\":\"boughtId\",\"type\":\"uint256\"},{\"indexed\":false,\"internalType\":\"uint256\",\"name\":\"tokensBought\",\"type\":\"uint256\"}],\"name\":\"RemoveLiquidityOne\",\"type\":\"event\"},{\"anonymous\":false,\"inputs\":[{\"indexed\":true,\"internalType\":\"address\",\"name\":\"buyer\",\"type\":\"address\"},{\"indexed\":false,\"internalType\":\"uint256\",\"name\":\"tokensSold\",\"type\":\"uint256\"},{\"indexed\":false,\"internalType\":\"uint256\",\"name\":\"tokensBought\",\"type\":\"uint256\"},{\"indexed\":false,\"internalType\":\"uint128\",\"name\":\"soldId\",\"type\":\"uint128\"},{\"indexed\":false,\"internalType\":\"uint128\",\"name\":\"boughtId\",\"type\":\"uint128\"}],\"name\":\"TokenSwap\",\"type\":\"event\"},{\"anonymous\":false,\"inputs\":[{\"indexed\":true,\"internalType\":\"address\",\"name\":\"buyer\",\"type\":\"address\"},{\"indexed\":false,\"internalType\":\"uint256\",\"name\":\"tokensSold\",\"type\":\"uint256\"},{\"indexed\":false,\"internalType\":\"uint256\",\"name\":\"tokensBought\",\"type\":\"uint256\"},{\"indexed\":false,\"internalType\":\"uint128\",\"name\":\"soldId\",\"type\":\"uint128\"},{\"indexed\":false,\"internalType\":\"uint128\",\"name\":\"boughtId\",\"type\":\"uint128\"}],\"name\":\"TokenSwapUnderlying\",\"type\":\"event\"},{\"inputs\":[],\"name\":\"BASE_CACHE_EXPIRE_TIME\",\"outputs\":[{\"internalType\":\"uint256\",\"name\":\"\",\"type\":\"uint256\"}],\"stateMutability\":\"view\",\"type\":\"function\"},{\"inputs\":[],\"name\":\"BASE_VIRTUAL_PRICE_PRECISION\",\"outputs\":[{\"internalType\":\"uint256\",\"name\":\"\",\"type\":\"uint256\"}],\"stateMutability\":\"view\",\"type\":\"function\"}],\"devdoc\":{\"details\":\"Contracts relying on this library must initialize SwapUtils.Swap struct then use this library for SwapUtils.Swap struct. Note that this library contains both functions called by users and admins. Admin functions should be protected within contracts using this library.\",\"kind\":\"dev\",\"methods\":{\"addLiquidity(SwapUtils.Swap storage,MetaSwapUtils.MetaSwap storage,uint256[],uint256)\":{\"params\":{\"amounts\":\"the amounts of each token to add, in their native precision\",\"metaSwapStorage\":\"MetaSwap struct to read from and write to\",\"minToMint\":\"the minimum LP tokens adding this amount of liquidity should mint, otherwise revert. Handy for front-running mitigation allowed addresses. If the pool is not in the guarded launch phase, this parameter will be ignored.\",\"self\":\"Swap struct to read from and write to\"},\"returns\":{\"_0\":\"amount of LP token user received\"}},\"calculateSwap(SwapUtils.Swap storage,MetaSwapUtils.MetaSwap storage,uint8,uint8,uint256)\":{\"params\":{\"dx\":\"the number of tokens to sell. If the token charges a fee on transfers, use the amount that gets transferred after the fee.\",\"metaSwapStorage\":\"MetaSwap struct from the same contract\",\"self\":\"Swap struct to read from\",\"tokenIndexFrom\":\"the token to sell\",\"tokenIndexTo\":\"the token to buy\"},\"returns\":{\"dy\":\"the number of tokens the user will get\"}},\"calculateSwapUnderlying(SwapUtils.Swap storage,MetaSwapUtils.MetaSwap storage,uint8,uint8,uint256)\":{\"params\":{\"dx\":\"the number of tokens to sell. If the token charges a fee on transfers, use the amount that gets transferred after the fee.\",\"metaSwapStorage\":\"MetaSwap struct from the same contract\",\"self\":\"Swap struct to read from\",\"tokenIndexFrom\":\"the token to sell\",\"tokenIndexTo\":\"the token to buy\"},\"returns\":{\"_0\":\"dy the number of tokens the user will get\"}},\"calculateTokenAmount(SwapUtils.Swap storage,MetaSwapUtils.MetaSwap storage,uint256[],bool)\":{\"details\":\"This shouldn't be used outside frontends for user estimates.\",\"params\":{\"amounts\":\"an array of token amounts to deposit or withdrawal, corresponding to pooledTokens. The amount should be in each pooled token's native precision. If a token charges a fee on transfers, use the amount that gets transferred after the fee.\",\"deposit\":\"whether this is a deposit or a withdrawal\",\"metaSwapStorage\":\"MetaSwap struct to read from\",\"self\":\"Swap struct to read from\"},\"returns\":{\"_0\":\"if deposit was true, total amount of lp token that will be minted and if deposit was false, total amount of lp token that will be burned\"}},\"calculateWithdrawOneToken(SwapUtils.Swap storage,MetaSwapUtils.MetaSwap storage,uint256,uint8)\":{\"params\":{\"metaSwapStorage\":\"MetaSwap struct to read from\",\"self\":\"Swap struct to read from\",\"tokenAmount\":\"the amount to withdraw in the pool's precision\",\"tokenIndex\":\"which token will be withdrawn\"},\"returns\":{\"dy\":\"the amount of token user will receive\"}},\"getVirtualPrice(SwapUtils.Swap storage,MetaSwapUtils.MetaSwap storage)\":{\"params\":{\"metaSwapStorage\":\"MetaSwap struct to read from\",\"self\":\"Swap struct to read from\"},\"returns\":{\"_0\":\"the virtual price, scaled to precision of BASE_VIRTUAL_PRICE_PRECISION\"}},\"removeLiquidityImbalance(SwapUtils.Swap storage,MetaSwapUtils.MetaSwap storage,uint256[],uint256)\":{\"params\":{\"amounts\":\"how much of each token to withdraw\",\"maxBurnAmount\":\"the max LP token provider is willing to pay to remove liquidity. Useful as a front-running mitigation.\",\"metaSwapStorage\":\"MetaSwap struct to read from and write to\",\"self\":\"Swap struct to read from and write to\"},\"returns\":{\"_0\":\"actual amount of LP tokens burned in the withdrawal\"}},\"removeLiquidityOneToken(SwapUtils.Swap storage,MetaSwapUtils.MetaSwap storage,uint256,uint8,uint256)\":{\"params\":{\"metaSwapStorage\":\"MetaSwap struct to read from and write to\",\"minAmount\":\"the minimum amount to withdraw, otherwise revert\",\"self\":\"Swap struct to read from and write to\",\"tokenAmount\":\"the amount of the lp tokens to burn\",\"tokenIndex\":\"the index of the token you want to receive\"},\"returns\":{\"_0\":\"amount chosen token that user received\"}},\"swap(SwapUtils.Swap storage,MetaSwapUtils.MetaSwap storage,uint8,uint8,uint256,uint256)\":{\"params\":{\"dx\":\"the amount of tokens the user wants to sell\",\"metaSwapStorage\":\"MetaSwap struct to read from and write to\",\"minDy\":\"the min amount the user would like to receive, or revert.\",\"self\":\"Swap struct to read from and write to\",\"tokenIndexFrom\":\"the token the user wants to sell\",\"tokenIndexTo\":\"the token the user wants to buy\"},\"returns\":{\"_0\":\"amount of token user received on swap\"}},\"swapUnderlying(SwapUtils.Swap storage,MetaSwapUtils.MetaSwap storage,uint8,uint8,uint256,uint256)\":{\"details\":\"Since this calls multiple external functions during the execution, it is recommended to protect any function that depends on this with reentrancy guards.\",\"params\":{\"dx\":\"the amount of tokens the user wants to sell\",\"metaSwapStorage\":\"MetaSwap struct to read from and write to\",\"minDy\":\"the min amount the user would like to receive, or revert.\",\"self\":\"Swap struct to read from and write to\",\"tokenIndexFrom\":\"the token the user wants to sell\",\"tokenIndexTo\":\"the token the user wants to buy\"},\"returns\":{\"_0\":\"amount of token user received on swap\"}}},\"title\":\"MetaSwapUtils library\",\"version\":1},\"userdoc\":{\"kind\":\"user\",\"methods\":{\"addLiquidity(SwapUtils.Swap storage,MetaSwapUtils.MetaSwap storage,uint256[],uint256)\":{\"notice\":\"Add liquidity to the pool\"},\"calculateSwap(SwapUtils.Swap storage,MetaSwapUtils.MetaSwap storage,uint8,uint8,uint256)\":{\"notice\":\"Externally calculates a swap between two tokens. The SwapUtils.Swap storage and MetaSwap storage should be from the same MetaSwap contract.\"},\"calculateSwapUnderlying(SwapUtils.Swap storage,MetaSwapUtils.MetaSwap storage,uint8,uint8,uint256)\":{\"notice\":\"Calculates the expected return amount from swapping between the pooled tokens and the underlying tokens of the base Swap pool.\"},\"calculateTokenAmount(SwapUtils.Swap storage,MetaSwapUtils.MetaSwap storage,uint256[],bool)\":{\"notice\":\"A simple method to calculate prices from deposits or withdrawals, excluding fees but including slippage. This is helpful as an input into the various \\\"min\\\" parameters on calls to fight front-running\"},\"calculateWithdrawOneToken(SwapUtils.Swap storage,MetaSwapUtils.MetaSwap storage,uint256,uint8)\":{\"notice\":\"Calculate how much the user would receive when withdrawing via single token\"},\"getVirtualPrice(SwapUtils.Swap storage,MetaSwapUtils.MetaSwap storage)\":{\"notice\":\"Get the virtual price, to help calculate profit\"},\"removeLiquidityImbalance(SwapUtils.Swap storage,MetaSwapUtils.MetaSwap storage,uint256[],uint256)\":{\"notice\":\"Remove liquidity from the pool, weighted differently than the pool's current balances.\"},\"removeLiquidityOneToken(SwapUtils.Swap storage,MetaSwapUtils.MetaSwap storage,uint256,uint8,uint256)\":{\"notice\":\"Remove liquidity from the pool all in one token.\"},\"swap(SwapUtils.Swap storage,MetaSwapUtils.MetaSwap storage,uint8,uint8,uint256,uint256)\":{\"notice\":\"swap two tokens in the pool\"},\"swapUnderlying(SwapUtils.Swap storage,MetaSwapUtils.MetaSwap storage,uint8,uint8,uint256,uint256)\":{\"notice\":\"Swaps with the underlying tokens of the base Swap pool. For this function, the token indices are flattened out so that underlying tokens are represented in the indices.\"}},\"notice\":\"A library to be used within MetaSwap.sol. Contains functions responsible for custody and AMM functionalities. MetaSwap is a modified version of Swap that allows Swap's LP token to be utilized in pooling with other tokens. As an example, if there is a Swap pool consisting of [DAI, USDC, USDT]. Then a MetaSwap pool can be created with [sUSD, BaseSwapLPToken] to allow trades between either the LP token or the underlying tokens and sUSD.\",\"version\":1}},\"settings\":{\"compilationTarget\":{\"contracts/meta/MetaSwapUtils.sol\":\"MetaSwapUtils\"},\"evmVersion\":\"istanbul\",\"libraries\":{},\"metadata\":{\"bytecodeHash\":\"ipfs\",\"useLiteralContent\":true},\"optimizer\":{\"enabled\":true,\"runs\":10000},\"remappings\":[]},\"sources\":{\"@openzeppelin/contracts-upgradeable/access/OwnableUpgradeable.sol\":{\"content\":\"// SPDX-License-Identifier: MIT\\n\\npragma solidity >=0.6.0 <0.8.0;\\n\\nimport \\\"../utils/ContextUpgradeable.sol\\\";\\nimport \\\"../proxy/Initializable.sol\\\";\\n/**\\n * @dev Contract module which provides a basic access control mechanism, where\\n * there is an account (an owner) that can be granted exclusive access to\\n * specific functions.\\n *\\n * By default, the owner account will be the one that deploys the contract. This\\n * can later be changed with {transferOwnership}.\\n *\\n * This module is used through inheritance. It will make available the modifier\\n * `onlyOwner`, which can be applied to your functions to restrict their use to\\n * the owner.\\n */\\nabstract contract OwnableUpgradeable is Initializable, ContextUpgradeable {\\n    address private _owner;\\n\\n    event OwnershipTransferred(address indexed previousOwner, address indexed newOwner);\\n\\n    /**\\n     * @dev Initializes the contract setting the deployer as the initial owner.\\n     */\\n    function __Ownable_init() internal initializer {\\n        __Context_init_unchained();\\n        __Ownable_init_unchained();\\n    }\\n\\n    function __Ownable_init_unchained() internal initializer {\\n        address msgSender = _msgSender();\\n        _owner = msgSender;\\n        emit OwnershipTransferred(address(0), msgSender);\\n    }\\n\\n    /**\\n     * @dev Returns the address of the current owner.\\n     */\\n    function owner() public view virtual returns (address) {\\n        return _owner;\\n    }\\n\\n    /**\\n     * @dev Throws if called by any account other than the owner.\\n     */\\n    modifier onlyOwner() {\\n        require(owner() == _msgSender(), \\\"Ownable: caller is not the owner\\\");\\n        _;\\n    }\\n\\n    /**\\n     * @dev Leaves the contract without owner. It will not be possible to call\\n     * `onlyOwner` functions anymore. Can only be called by the current owner.\\n     *\\n     * NOTE: Renouncing ownership will leave the contract without an owner,\\n     * thereby removing any functionality that is only available to the owner.\\n     */\\n    function renounceOwnership() public virtual onlyOwner {\\n        emit OwnershipTransferred(_owner, address(0));\\n        _owner = address(0);\\n    }\\n\\n    /**\\n     * @dev Transfers ownership of the contract to a new account (`newOwner`).\\n     * Can only be called by the current owner.\\n     */\\n    function transferOwnership(address newOwner) public virtual onlyOwner {\\n        require(newOwner != address(0), \\\"Ownable: new owner is the zero address\\\");\\n        emit OwnershipTransferred(_owner, newOwner);\\n        _owner = newOwner;\\n    }\\n    uint256[49] private __gap;\\n}\\n\",\"keccak256\":\"0xb419e68addcb82ecda3ad3974b0d2db76435ce9b08435a04d5b119a0c5d45ea5\",\"license\":\"MIT\"},\"@openzeppelin/contracts-upgradeable/math/SafeMathUpgradeable.sol\":{\"content\":\"// SPDX-License-Identifier: MIT\\n\\npragma solidity >=0.6.0 <0.8.0;\\n\\n/**\\n * @dev Wrappers over Solidity's arithmetic operations with added overflow\\n * checks.\\n *\\n * Arithmetic operations in Solidity wrap on overflow. This can easily result\\n * in bugs, because programmers usually assume that an overflow raises an\\n * error, which is the standard behavior in high level programming languages.\\n * `SafeMath` restores this intuition by reverting the transaction when an\\n * operation overflows.\\n *\\n * Using this library instead of the unchecked operations eliminates an entire\\n * class of bugs, so it's recommended to use it always.\\n */\\nlibrary SafeMathUpgradeable {\\n    /**\\n     * @dev Returns the addition of two unsigned integers, with an overflow flag.\\n     *\\n     * _Available since v3.4._\\n     */\\n    function tryAdd(uint256 a, uint256 b) internal pure returns (bool, uint256) {\\n        uint256 c = a + b;\\n        if (c < a) return (false, 0);\\n        return (true, c);\\n    }\\n\\n    /**\\n     * @dev Returns the substraction of two unsigned integers, with an overflow flag.\\n     *\\n     * _Available since v3.4._\\n     */\\n    function trySub(uint256 a, uint256 b) internal pure returns (bool, uint256) {\\n        if (b > a) return (false, 0);\\n        return (true, a - b);\\n    }\\n\\n    /**\\n     * @dev Returns the multiplication of two unsigned integers, with an overflow flag.\\n     *\\n     * _Available since v3.4._\\n     */\\n    function tryMul(uint256 a, uint256 b) internal pure returns (bool, uint256) {\\n        // Gas optimization: this is cheaper than requiring 'a' not being zero, but the\\n        // benefit is lost if 'b' is also tested.\\n        // See: https://github.com/OpenZeppelin/openzeppelin-contracts/pull/522\\n        if (a == 0) return (true, 0);\\n        uint256 c = a * b;\\n        if (c / a != b) return (false, 0);\\n        return (true, c);\\n    }\\n\\n    /**\\n     * @dev Returns the division of two unsigned integers, with a division by zero flag.\\n     *\\n     * _Available since v3.4._\\n     */\\n    function tryDiv(uint256 a, uint256 b) internal pure returns (bool, uint256) {\\n        if (b == 0) return (false, 0);\\n        return (true, a / b);\\n    }\\n\\n    /**\\n     * @dev Returns the remainder of dividing two unsigned integers, with a division by zero flag.\\n     *\\n     * _Available since v3.4._\\n     */\\n    function tryMod(uint256 a, uint256 b) internal pure returns (bool, uint256) {\\n        if (b == 0) return (false, 0);\\n        return (true, a % b);\\n    }\\n\\n    /**\\n     * @dev Returns the addition of two unsigned integers, reverting on\\n     * overflow.\\n     *\\n     * Counterpart to Solidity's `+` operator.\\n     *\\n     * Requirements:\\n     *\\n     * - Addition cannot overflow.\\n     */\\n    function add(uint256 a, uint256 b) internal pure returns (uint256) {\\n        uint256 c = a + b;\\n        require(c >= a, \\\"SafeMath: addition overflow\\\");\\n        return c;\\n    }\\n\\n    /**\\n     * @dev Returns the subtraction of two unsigned integers, reverting on\\n     * overflow (when the result is negative).\\n     *\\n     * Counterpart to Solidity's `-` operator.\\n     *\\n     * Requirements:\\n     *\\n     * - Subtraction cannot overflow.\\n     */\\n    function sub(uint256 a, uint256 b) internal pure returns (uint256) {\\n        require(b <= a, \\\"SafeMath: subtraction overflow\\\");\\n        return a - b;\\n    }\\n\\n    /**\\n     * @dev Returns the multiplication of two unsigned integers, reverting on\\n     * overflow.\\n     *\\n     * Counterpart to Solidity's `*` operator.\\n     *\\n     * Requirements:\\n     *\\n     * - Multiplication cannot overflow.\\n     */\\n    function mul(uint256 a, uint256 b) internal pure returns (uint256) {\\n        if (a == 0) return 0;\\n        uint256 c = a * b;\\n        require(c / a == b, \\\"SafeMath: multiplication overflow\\\");\\n        return c;\\n    }\\n\\n    /**\\n     * @dev Returns the integer division of two unsigned integers, reverting on\\n     * division by zero. The result is rounded towards zero.\\n     *\\n     * Counterpart to Solidity's `/` operator. Note: this function uses a\\n     * `revert` opcode (which leaves remaining gas untouched) while Solidity\\n     * uses an invalid opcode to revert (consuming all remaining gas).\\n     *\\n     * Requirements:\\n     *\\n     * - The divisor cannot be zero.\\n     */\\n    function div(uint256 a, uint256 b) internal pure returns (uint256) {\\n        require(b > 0, \\\"SafeMath: division by zero\\\");\\n        return a / b;\\n    }\\n\\n    /**\\n     * @dev Returns the remainder of dividing two unsigned integers. (unsigned integer modulo),\\n     * reverting when dividing by zero.\\n     *\\n     * Counterpart to Solidity's `%` operator. This function uses a `revert`\\n     * opcode (which leaves remaining gas untouched) while Solidity uses an\\n     * invalid opcode to revert (consuming all remaining gas).\\n     *\\n     * Requirements:\\n     *\\n     * - The divisor cannot be zero.\\n     */\\n    function mod(uint256 a, uint256 b) internal pure returns (uint256) {\\n        require(b > 0, \\\"SafeMath: modulo by zero\\\");\\n        return a % b;\\n    }\\n\\n    /**\\n     * @dev Returns the subtraction of two unsigned integers, reverting with custom message on\\n     * overflow (when the result is negative).\\n     *\\n     * CAUTION: This function is deprecated because it requires allocating memory for the error\\n     * message unnecessarily. For custom revert reasons use {trySub}.\\n     *\\n     * Counterpart to Solidity's `-` operator.\\n     *\\n     * Requirements:\\n     *\\n     * - Subtraction cannot overflow.\\n     */\\n    function sub(uint256 a, uint256 b, string memory errorMessage) internal pure returns (uint256) {\\n        require(b <= a, errorMessage);\\n        return a - b;\\n    }\\n\\n    /**\\n     * @dev Returns the integer division of two unsigned integers, reverting with custom message on\\n     * division by zero. The result is rounded towards zero.\\n     *\\n     * CAUTION: This function is deprecated because it requires allocating memory for the error\\n     * message unnecessarily. For custom revert reasons use {tryDiv}.\\n     *\\n     * Counterpart to Solidity's `/` operator. Note: this function uses a\\n     * `revert` opcode (which leaves remaining gas untouched) while Solidity\\n     * uses an invalid opcode to revert (consuming all remaining gas).\\n     *\\n     * Requirements:\\n     *\\n     * - The divisor cannot be zero.\\n     */\\n    function div(uint256 a, uint256 b, string memory errorMessage) internal pure returns (uint256) {\\n        require(b > 0, errorMessage);\\n        return a / b;\\n    }\\n\\n    /**\\n     * @dev Returns the remainder of dividing two unsigned integers. (unsigned integer modulo),\\n     * reverting with custom message when dividing by zero.\\n     *\\n     * CAUTION: This function is deprecated because it requires allocating memory for the error\\n     * message unnecessarily. For custom revert reasons use {tryMod}.\\n     *\\n     * Counterpart to Solidity's `%` operator. This function uses a `revert`\\n     * opcode (which leaves remaining gas untouched) while Solidity uses an\\n     * invalid opcode to revert (consuming all remaining gas).\\n     *\\n     * Requirements:\\n     *\\n     * - The divisor cannot be zero.\\n     */\\n    function mod(uint256 a, uint256 b, string memory errorMessage) internal pure returns (uint256) {\\n        require(b > 0, errorMessage);\\n        return a % b;\\n    }\\n}\\n\",\"keccak256\":\"0x0dd1e9b19801e3e7d900fbf4182d81e1afd23ad7be39504e33df6bbcba91d724\",\"license\":\"MIT\"},\"@openzeppelin/contracts-upgradeable/proxy/Initializable.sol\":{\"content\":\"// SPDX-License-Identifier: MIT\\n\\n// solhint-disable-next-line compiler-version\\npragma solidity >=0.4.24 <0.8.0;\\n\\nimport \\\"../utils/AddressUpgradeable.sol\\\";\\n\\n/**\\n * @dev This is a base contract to aid in writing upgradeable contracts, or any kind of contract that will be deployed\\n * behind a proxy. Since a proxied contract can't have a constructor, it's common to move constructor logic to an\\n * external initializer function, usually called `initialize`. It then becomes necessary to protect this initializer\\n * function so it can only be called once. The {initializer} modifier provided by this contract will have this effect.\\n *\\n * TIP: To avoid leaving the proxy in an uninitialized state, the initializer function should be called as early as\\n * possible by providing the encoded function call as the `_data` argument to {UpgradeableProxy-constructor}.\\n *\\n * CAUTION: When used with inheritance, manual care must be taken to not invoke a parent initializer twice, or to ensure\\n * that all initializers are idempotent. This is not verified automatically as constructors are by Solidity.\\n */\\nabstract contract Initializable {\\n\\n    /**\\n     * @dev Indicates that the contract has been initialized.\\n     */\\n    bool private _initialized;\\n\\n    /**\\n     * @dev Indicates that the contract is in the process of being initialized.\\n     */\\n    bool private _initializing;\\n\\n    /**\\n     * @dev Modifier to protect an initializer function from being invoked twice.\\n     */\\n    modifier initializer() {\\n        require(_initializing || _isConstructor() || !_initialized, \\\"Initializable: contract is already initialized\\\");\\n\\n        bool isTopLevelCall = !_initializing;\\n        if (isTopLevelCall) {\\n            _initializing = true;\\n            _initialized = true;\\n        }\\n\\n        _;\\n\\n        if (isTopLevelCall) {\\n            _initializing = false;\\n        }\\n    }\\n\\n    /// @dev Returns true if and only if the function is running in the constructor\\n    function _isConstructor() private view returns (bool) {\\n        return !AddressUpgradeable.isContract(address(this));\\n    }\\n}\\n\",\"keccak256\":\"0xd8e4eb08dcc1d1860fb347ba5ffd595242b9a1b66d49a47f2b4cb51c3f35017e\",\"license\":\"MIT\"},\"@openzeppelin/contracts-upgradeable/token/ERC20/ERC20BurnableUpgradeable.sol\":{\"content\":\"// SPDX-License-Identifier: MIT\\n\\npragma solidity >=0.6.0 <0.8.0;\\n\\nimport \\\"../../utils/ContextUpgradeable.sol\\\";\\nimport \\\"./ERC20Upgradeable.sol\\\";\\nimport \\\"../../proxy/Initializable.sol\\\";\\n\\n/**\\n * @dev Extension of {ERC20} that allows token holders to destroy both their own\\n * tokens and those that they have an allowance for, in a way that can be\\n * recognized off-chain (via event analysis).\\n */\\nabstract contract ERC20BurnableUpgradeable is Initializable, ContextUpgradeable, ERC20Upgradeable {\\n    function __ERC20Burnable_init() internal initializer {\\n        __Context_init_unchained();\\n        __ERC20Burnable_init_unchained();\\n    }\\n\\n    function __ERC20Burnable_init_unchained() internal initializer {\\n    }\\n    using SafeMathUpgradeable for uint256;\\n\\n    /**\\n     * @dev Destroys `amount` tokens from the caller.\\n     *\\n     * See {ERC20-_burn}.\\n     */\\n    function burn(uint256 amount) public virtual {\\n        _burn(_msgSender(), amount);\\n    }\\n\\n    /**\\n     * @dev Destroys `amount` tokens from `account`, deducting from the caller's\\n     * allowance.\\n     *\\n     * See {ERC20-_burn} and {ERC20-allowance}.\\n     *\\n     * Requirements:\\n     *\\n     * - the caller must have allowance for ``accounts``'s tokens of at least\\n     * `amount`.\\n     */\\n    function burnFrom(address account, uint256 amount) public virtual {\\n        uint256 decreasedAllowance = allowance(account, _msgSender()).sub(amount, \\\"ERC20: burn amount exceeds allowance\\\");\\n\\n        _approve(account, _msgSender(), decreasedAllowance);\\n        _burn(account, amount);\\n    }\\n    uint256[50] private __gap;\\n}\\n\",\"keccak256\":\"0xd0359e87fe2618573f49a95e13d9dbc31521ad64526b135618abb2a2dc362fbe\",\"license\":\"MIT\"},\"@openzeppelin/contracts-upgradeable/token/ERC20/ERC20Upgradeable.sol\":{\"content\":\"// SPDX-License-Identifier: MIT\\n\\npragma solidity >=0.6.0 <0.8.0;\\n\\nimport \\\"../../utils/ContextUpgradeable.sol\\\";\\nimport \\\"./IERC20Upgradeable.sol\\\";\\nimport \\\"../../math/SafeMathUpgradeable.sol\\\";\\nimport \\\"../../proxy/Initializable.sol\\\";\\n\\n/**\\n * @dev Implementation of the {IERC20} interface.\\n *\\n * This implementation is agnostic to the way tokens are created. This means\\n * that a supply mechanism has to be added in a derived contract using {_mint}.\\n * For a generic mechanism see {ERC20PresetMinterPauser}.\\n *\\n * TIP: For a detailed writeup see our guide\\n * https://forum.zeppelin.solutions/t/how-to-implement-erc20-supply-mechanisms/226[How\\n * to implement supply mechanisms].\\n *\\n * We have followed general OpenZeppelin guidelines: functions revert instead\\n * of returning `false` on failure. This behavior is nonetheless conventional\\n * and does not conflict with the expectations of ERC20 applications.\\n *\\n * Additionally, an {Approval} event is emitted on calls to {transferFrom}.\\n * This allows applications to reconstruct the allowance for all accounts just\\n * by listening to said events. Other implementations of the EIP may not emit\\n * these events, as it isn't required by the specification.\\n *\\n * Finally, the non-standard {decreaseAllowance} and {increaseAllowance}\\n * functions have been added to mitigate the well-known issues around setting\\n * allowances. See {IERC20-approve}.\\n */\\ncontract ERC20Upgradeable is Initializable, ContextUpgradeable, IERC20Upgradeable {\\n    using SafeMathUpgradeable for uint256;\\n\\n    mapping (address => uint256) private _balances;\\n\\n    mapping (address => mapping (address => uint256)) private _allowances;\\n\\n    uint256 private _totalSupply;\\n\\n    string private _name;\\n    string private _symbol;\\n    uint8 private _decimals;\\n\\n    /**\\n     * @dev Sets the values for {name} and {symbol}, initializes {decimals} with\\n     * a default value of 18.\\n     *\\n     * To select a different value for {decimals}, use {_setupDecimals}.\\n     *\\n     * All three of these values are immutable: they can only be set once during\\n     * construction.\\n     */\\n    function __ERC20_init(string memory name_, string memory symbol_) internal initializer {\\n        __Context_init_unchained();\\n        __ERC20_init_unchained(name_, symbol_);\\n    }\\n\\n    function __ERC20_init_unchained(string memory name_, string memory symbol_) internal initializer {\\n        _name = name_;\\n        _symbol = symbol_;\\n        _decimals = 18;\\n    }\\n\\n    /**\\n     * @dev Returns the name of the token.\\n     */\\n    function name() public view virtual returns (string memory) {\\n        return _name;\\n    }\\n\\n    /**\\n     * @dev Returns the symbol of the token, usually a shorter version of the\\n     * name.\\n     */\\n    function symbol() public view virtual returns (string memory) {\\n        return _symbol;\\n    }\\n\\n    /**\\n     * @dev Returns the number of decimals used to get its user representation.\\n     * For example, if `decimals` equals `2`, a balance of `505` tokens should\\n     * be displayed to a user as `5,05` (`505 / 10 ** 2`).\\n     *\\n     * Tokens usually opt for a value of 18, imitating the relationship between\\n     * Ether and Wei. This is the value {ERC20} uses, unless {_setupDecimals} is\\n     * called.\\n     *\\n     * NOTE: This information is only used for _display_ purposes: it in\\n     * no way affects any of the arithmetic of the contract, including\\n     * {IERC20-balanceOf} and {IERC20-transfer}.\\n     */\\n    function decimals() public view virtual returns (uint8) {\\n        return _decimals;\\n    }\\n\\n    /**\\n     * @dev See {IERC20-totalSupply}.\\n     */\\n    function totalSupply() public view virtual override returns (uint256) {\\n        return _totalSupply;\\n    }\\n\\n    /**\\n     * @dev See {IERC20-balanceOf}.\\n     */\\n    function balanceOf(address account) public view virtual override returns (uint256) {\\n        return _balances[account];\\n    }\\n\\n    /**\\n     * @dev See {IERC20-transfer}.\\n     *\\n     * Requirements:\\n     *\\n     * - `recipient` cannot be the zero address.\\n     * - the caller must have a balance of at least `amount`.\\n     */\\n    function transfer(address recipient, uint256 amount) public virtual override returns (bool) {\\n        _transfer(_msgSender(), recipient, amount);\\n        return true;\\n    }\\n\\n    /**\\n     * @dev See {IERC20-allowance}.\\n     */\\n    function allowance(address owner, address spender) public view virtual override returns (uint256) {\\n        return _allowances[owner][spender];\\n    }\\n\\n    /**\\n     * @dev See {IERC20-approve}.\\n     *\\n     * Requirements:\\n     *\\n     * - `spender` cannot be the zero address.\\n     */\\n    function approve(address spender, uint256 amount) public virtual override returns (bool) {\\n        _approve(_msgSender(), spender, amount);\\n        return true;\\n    }\\n\\n    /**\\n     * @dev See {IERC20-transferFrom}.\\n     *\\n     * Emits an {Approval} event indicating the updated allowance. This is not\\n     * required by the EIP. See the note at the beginning of {ERC20}.\\n     *\\n     * Requirements:\\n     *\\n     * - `sender` and `recipient` cannot be the zero address.\\n     * - `sender` must have a balance of at least `amount`.\\n     * - the caller must have allowance for ``sender``'s tokens of at least\\n     * `amount`.\\n     */\\n    function transferFrom(address sender, address recipient, uint256 amount) public virtual override returns (bool) {\\n        _transfer(sender, recipient, amount);\\n        _approve(sender, _msgSender(), _allowances[sender][_msgSender()].sub(amount, \\\"ERC20: transfer amount exceeds allowance\\\"));\\n        return true;\\n    }\\n\\n    /**\\n     * @dev Atomically increases the allowance granted to `spender` by the caller.\\n     *\\n     * This is an alternative to {approve} that can be used as a mitigation for\\n     * problems described in {IERC20-approve}.\\n     *\\n     * Emits an {Approval} event indicating the updated allowance.\\n     *\\n     * Requirements:\\n     *\\n     * - `spender` cannot be the zero address.\\n     */\\n    function increaseAllowance(address spender, uint256 addedValue) public virtual returns (bool) {\\n        _approve(_msgSender(), spender, _allowances[_msgSender()][spender].add(addedValue));\\n        return true;\\n    }\\n\\n    /**\\n     * @dev Atomically decreases the allowance granted to `spender` by the caller.\\n     *\\n     * This is an alternative to {approve} that can be used as a mitigation for\\n     * problems described in {IERC20-approve}.\\n     *\\n     * Emits an {Approval} event indicating the updated allowance.\\n     *\\n     * Requirements:\\n     *\\n     * - `spender` cannot be the zero address.\\n     * - `spender` must have allowance for the caller of at least\\n     * `subtractedValue`.\\n     */\\n    function decreaseAllowance(address spender, uint256 subtractedValue) public virtual returns (bool) {\\n        _approve(_msgSender(), spender, _allowances[_msgSender()][spender].sub(subtractedValue, \\\"ERC20: decreased allowance below zero\\\"));\\n        return true;\\n    }\\n\\n    /**\\n     * @dev Moves tokens `amount` from `sender` to `recipient`.\\n     *\\n     * This is internal function is equivalent to {transfer}, and can be used to\\n     * e.g. implement automatic token fees, slashing mechanisms, etc.\\n     *\\n     * Emits a {Transfer} event.\\n     *\\n     * Requirements:\\n     *\\n     * - `sender` cannot be the zero address.\\n     * - `recipient` cannot be the zero address.\\n     * - `sender` must have a balance of at least `amount`.\\n     */\\n    function _transfer(address sender, address recipient, uint256 amount) internal virtual {\\n        require(sender != address(0), \\\"ERC20: transfer from the zero address\\\");\\n        require(recipient != address(0), \\\"ERC20: transfer to the zero address\\\");\\n\\n        _beforeTokenTransfer(sender, recipient, amount);\\n\\n        _balances[sender] = _balances[sender].sub(amount, \\\"ERC20: transfer amount exceeds balance\\\");\\n        _balances[recipient] = _balances[recipient].add(amount);\\n        emit Transfer(sender, recipient, amount);\\n    }\\n\\n    /** @dev Creates `amount` tokens and assigns them to `account`, increasing\\n     * the total supply.\\n     *\\n     * Emits a {Transfer} event with `from` set to the zero address.\\n     *\\n     * Requirements:\\n     *\\n     * - `to` cannot be the zero address.\\n     */\\n    function _mint(address account, uint256 amount) internal virtual {\\n        require(account != address(0), \\\"ERC20: mint to the zero address\\\");\\n\\n        _beforeTokenTransfer(address(0), account, amount);\\n\\n        _totalSupply = _totalSupply.add(amount);\\n        _balances[account] = _balances[account].add(amount);\\n        emit Transfer(address(0), account, amount);\\n    }\\n\\n    /**\\n     * @dev Destroys `amount` tokens from `account`, reducing the\\n     * total supply.\\n     *\\n     * Emits a {Transfer} event with `to` set to the zero address.\\n     *\\n     * Requirements:\\n     *\\n     * - `account` cannot be the zero address.\\n     * - `account` must have at least `amount` tokens.\\n     */\\n    function _burn(address account, uint256 amount) internal virtual {\\n        require(account != address(0), \\\"ERC20: burn from the zero address\\\");\\n\\n        _beforeTokenTransfer(account, address(0), amount);\\n\\n        _balances[account] = _balances[account].sub(amount, \\\"ERC20: burn amount exceeds balance\\\");\\n        _totalSupply = _totalSupply.sub(amount);\\n        emit Transfer(account, address(0), amount);\\n    }\\n\\n    /**\\n     * @dev Sets `amount` as the allowance of `spender` over the `owner` s tokens.\\n     *\\n     * This internal function is equivalent to `approve`, and can be used to\\n     * e.g. set automatic allowances for certain subsystems, etc.\\n     *\\n     * Emits an {Approval} event.\\n     *\\n     * Requirements:\\n     *\\n     * - `owner` cannot be the zero address.\\n     * - `spender` cannot be the zero address.\\n     */\\n    function _approve(address owner, address spender, uint256 amount) internal virtual {\\n        require(owner != address(0), \\\"ERC20: approve from the zero address\\\");\\n        require(spender != address(0), \\\"ERC20: approve to the zero address\\\");\\n\\n        _allowances[owner][spender] = amount;\\n        emit Approval(owner, spender, amount);\\n    }\\n\\n    /**\\n     * @dev Sets {decimals} to a value other than the default one of 18.\\n     *\\n     * WARNING: This function should only be called from the constructor. Most\\n     * applications that interact with token contracts will not expect\\n     * {decimals} to ever change, and may work incorrectly if it does.\\n     */\\n    function _setupDecimals(uint8 decimals_) internal virtual {\\n        _decimals = decimals_;\\n    }\\n\\n    /**\\n     * @dev Hook that is called before any transfer of tokens. This includes\\n     * minting and burning.\\n     *\\n     * Calling conditions:\\n     *\\n     * - when `from` and `to` are both non-zero, `amount` of ``from``'s tokens\\n     * will be to transferred to `to`.\\n     * - when `from` is zero, `amount` tokens will be minted for `to`.\\n     * - when `to` is zero, `amount` of ``from``'s tokens will be burned.\\n     * - `from` and `to` are never both zero.\\n     *\\n     * To learn more about hooks, head to xref:ROOT:extending-contracts.adoc#using-hooks[Using Hooks].\\n     */\\n    function _beforeTokenTransfer(address from, address to, uint256 amount) internal virtual { }\\n    uint256[44] private __gap;\\n}\\n\",\"keccak256\":\"0x506dd0718f9ace50588c13848167df5e04ae16abb56341afb10c31ff149bc79b\",\"license\":\"MIT\"},\"@openzeppelin/contracts-upgradeable/token/ERC20/IERC20Upgradeable.sol\":{\"content\":\"// SPDX-License-Identifier: MIT\\n\\npragma solidity >=0.6.0 <0.8.0;\\n\\n/**\\n * @dev Interface of the ERC20 standard as defined in the EIP.\\n */\\ninterface IERC20Upgradeable {\\n    /**\\n     * @dev Returns the amount of tokens in existence.\\n     */\\n    function totalSupply() external view returns (uint256);\\n\\n    /**\\n     * @dev Returns the amount of tokens owned by `account`.\\n     */\\n    function balanceOf(address account) external view returns (uint256);\\n\\n    /**\\n     * @dev Moves `amount` tokens from the caller's account to `recipient`.\\n     *\\n     * Returns a boolean value indicating whether the operation succeeded.\\n     *\\n     * Emits a {Transfer} event.\\n     */\\n    function transfer(address recipient, uint256 amount) external returns (bool);\\n\\n    /**\\n     * @dev Returns the remaining number of tokens that `spender` will be\\n     * allowed to spend on behalf of `owner` through {transferFrom}. This is\\n     * zero by default.\\n     *\\n     * This value changes when {approve} or {transferFrom} are called.\\n     */\\n    function allowance(address owner, address spender) external view returns (uint256);\\n\\n    /**\\n     * @dev Sets `amount` as the allowance of `spender` over the caller's tokens.\\n     *\\n     * Returns a boolean value indicating whether the operation succeeded.\\n     *\\n     * IMPORTANT: Beware that changing an allowance with this method brings the risk\\n     * that someone may use both the old and the new allowance by unfortunate\\n     * transaction ordering. One possible solution to mitigate this race\\n     * condition is to first reduce the spender's allowance to 0 and set the\\n     * desired value afterwards:\\n     * https://github.com/ethereum/EIPs/issues/20#issuecomment-263524729\\n     *\\n     * Emits an {Approval} event.\\n     */\\n    function approve(address spender, uint256 amount) external returns (bool);\\n\\n    /**\\n     * @dev Moves `amount` tokens from `sender` to `recipient` using the\\n     * allowance mechanism. `amount` is then deducted from the caller's\\n     * allowance.\\n     *\\n     * Returns a boolean value indicating whether the operation succeeded.\\n     *\\n     * Emits a {Transfer} event.\\n     */\\n    function transferFrom(address sender, address recipient, uint256 amount) external returns (bool);\\n\\n    /**\\n     * @dev Emitted when `value` tokens are moved from one account (`from`) to\\n     * another (`to`).\\n     *\\n     * Note that `value` may be zero.\\n     */\\n    event Transfer(address indexed from, address indexed to, uint256 value);\\n\\n    /**\\n     * @dev Emitted when the allowance of a `spender` for an `owner` is set by\\n     * a call to {approve}. `value` is the new allowance.\\n     */\\n    event Approval(address indexed owner, address indexed spender, uint256 value);\\n}\\n\",\"keccak256\":\"0xa1931c47a617014f858580db625aa0dcf343796f39acd4b5b51effc092a1f0a9\",\"license\":\"MIT\"},\"@openzeppelin/contracts-upgradeable/utils/AddressUpgradeable.sol\":{\"content\":\"// SPDX-License-Identifier: MIT\\n\\npragma solidity >=0.6.2 <0.8.0;\\n\\n/**\\n * @dev Collection of functions related to the address type\\n */\\nlibrary AddressUpgradeable {\\n    /**\\n     * @dev Returns true if `account` is a contract.\\n     *\\n     * [IMPORTANT]\\n     * ====\\n     * It is unsafe to assume that an address for which this function returns\\n     * false is an externally-owned account (EOA) and not a contract.\\n     *\\n     * Among others, `isContract` will return false for the following\\n     * types of addresses:\\n     *\\n     *  - an externally-owned account\\n     *  - a contract in construction\\n     *  - an address where a contract will be created\\n     *  - an address where a contract lived, but was destroyed\\n     * ====\\n     */\\n    function isContract(address account) internal view returns (bool) {\\n        // This method relies on extcodesize, which returns 0 for contracts in\\n        // construction, since the code is only stored at the end of the\\n        // constructor execution.\\n\\n        uint256 size;\\n        // solhint-disable-next-line no-inline-assembly\\n        assembly { size := extcodesize(account) }\\n        return size > 0;\\n    }\\n\\n    /**\\n     * @dev Replacement for Solidity's `transfer`: sends `amount` wei to\\n     * `recipient`, forwarding all available gas and reverting on errors.\\n     *\\n     * https://eips.ethereum.org/EIPS/eip-1884[EIP1884] increases the gas cost\\n     * of certain opcodes, possibly making contracts go over the 2300 gas limit\\n     * imposed by `transfer`, making them unable to receive funds via\\n     * `transfer`. {sendValue} removes this limitation.\\n     *\\n     * https://diligence.consensys.net/posts/2019/09/stop-using-soliditys-transfer-now/[Learn more].\\n     *\\n     * IMPORTANT: because control is transferred to `recipient`, care must be\\n     * taken to not create reentrancy vulnerabilities. Consider using\\n     * {ReentrancyGuard} or the\\n     * https://solidity.readthedocs.io/en/v0.5.11/security-considerations.html#use-the-checks-effects-interactions-pattern[checks-effects-interactions pattern].\\n     */\\n    function sendValue(address payable recipient, uint256 amount) internal {\\n        require(address(this).balance >= amount, \\\"Address: insufficient balance\\\");\\n\\n        // solhint-disable-next-line avoid-low-level-calls, avoid-call-value\\n        (bool success, ) = recipient.call{ value: amount }(\\\"\\\");\\n        require(success, \\\"Address: unable to send value, recipient may have reverted\\\");\\n    }\\n\\n    /**\\n     * @dev Performs a Solidity function call using a low level `call`. A\\n     * plain`call` is an unsafe replacement for a function call: use this\\n     * function instead.\\n     *\\n     * If `target` reverts with a revert reason, it is bubbled up by this\\n     * function (like regular Solidity function calls).\\n     *\\n     * Returns the raw returned data. To convert to the expected return value,\\n     * use https://solidity.readthedocs.io/en/latest/units-and-global-variables.html?highlight=abi.decode#abi-encoding-and-decoding-functions[`abi.decode`].\\n     *\\n     * Requirements:\\n     *\\n     * - `target` must be a contract.\\n     * - calling `target` with `data` must not revert.\\n     *\\n     * _Available since v3.1._\\n     */\\n    function functionCall(address target, bytes memory data) internal returns (bytes memory) {\\n      return functionCall(target, data, \\\"Address: low-level call failed\\\");\\n    }\\n\\n    /**\\n     * @dev Same as {xref-Address-functionCall-address-bytes-}[`functionCall`], but with\\n     * `errorMessage` as a fallback revert reason when `target` reverts.\\n     *\\n     * _Available since v3.1._\\n     */\\n    function functionCall(address target, bytes memory data, string memory errorMessage) internal returns (bytes memory) {\\n        return functionCallWithValue(target, data, 0, errorMessage);\\n    }\\n\\n    /**\\n     * @dev Same as {xref-Address-functionCall-address-bytes-}[`functionCall`],\\n     * but also transferring `value` wei to `target`.\\n     *\\n     * Requirements:\\n     *\\n     * - the calling contract must have an ETH balance of at least `value`.\\n     * - the called Solidity function must be `payable`.\\n     *\\n     * _Available since v3.1._\\n     */\\n    function functionCallWithValue(address target, bytes memory data, uint256 value) internal returns (bytes memory) {\\n        return functionCallWithValue(target, data, value, \\\"Address: low-level call with value failed\\\");\\n    }\\n\\n    /**\\n     * @dev Same as {xref-Address-functionCallWithValue-address-bytes-uint256-}[`functionCallWithValue`], but\\n     * with `errorMessage` as a fallback revert reason when `target` reverts.\\n     *\\n     * _Available since v3.1._\\n     */\\n    function functionCallWithValue(address target, bytes memory data, uint256 value, string memory errorMessage) internal returns (bytes memory) {\\n        require(address(this).balance >= value, \\\"Address: insufficient balance for call\\\");\\n        require(isContract(target), \\\"Address: call to non-contract\\\");\\n\\n        // solhint-disable-next-line avoid-low-level-calls\\n        (bool success, bytes memory returndata) = target.call{ value: value }(data);\\n        return _verifyCallResult(success, returndata, errorMessage);\\n    }\\n\\n    /**\\n     * @dev Same as {xref-Address-functionCall-address-bytes-}[`functionCall`],\\n     * but performing a static call.\\n     *\\n     * _Available since v3.3._\\n     */\\n    function functionStaticCall(address target, bytes memory data) internal view returns (bytes memory) {\\n        return functionStaticCall(target, data, \\\"Address: low-level static call failed\\\");\\n    }\\n\\n    /**\\n     * @dev Same as {xref-Address-functionCall-address-bytes-string-}[`functionCall`],\\n     * but performing a static call.\\n     *\\n     * _Available since v3.3._\\n     */\\n    function functionStaticCall(address target, bytes memory data, string memory errorMessage) internal view returns (bytes memory) {\\n        require(isContract(target), \\\"Address: static call to non-contract\\\");\\n\\n        // solhint-disable-next-line avoid-low-level-calls\\n        (bool success, bytes memory returndata) = target.staticcall(data);\\n        return _verifyCallResult(success, returndata, errorMessage);\\n    }\\n\\n    function _verifyCallResult(bool success, bytes memory returndata, string memory errorMessage) private pure returns(bytes memory) {\\n        if (success) {\\n            return returndata;\\n        } else {\\n            // Look for revert reason and bubble it up if present\\n            if (returndata.length > 0) {\\n                // The easiest way to bubble the revert reason is using memory via assembly\\n\\n                // solhint-disable-next-line no-inline-assembly\\n                assembly {\\n                    let returndata_size := mload(returndata)\\n                    revert(add(32, returndata), returndata_size)\\n                }\\n            } else {\\n                revert(errorMessage);\\n            }\\n        }\\n    }\\n}\\n\",\"keccak256\":\"0xfc5ea91fa9ceb1961023b2a6c978b902888c52b90847ac7813fe3b79524165f6\",\"license\":\"MIT\"},\"@openzeppelin/contracts-upgradeable/utils/ContextUpgradeable.sol\":{\"content\":\"// SPDX-License-Identifier: MIT\\n\\npragma solidity >=0.6.0 <0.8.0;\\nimport \\\"../proxy/Initializable.sol\\\";\\n\\n/*\\n * @dev Provides information about the current execution context, including the\\n * sender of the transaction and its data. While these are generally available\\n * via msg.sender and msg.data, they should not be accessed in such a direct\\n * manner, since when dealing with GSN meta-transactions the account sending and\\n * paying for execution may not be the actual sender (as far as an application\\n * is concerned).\\n *\\n * This contract is only required for intermediate, library-like contracts.\\n */\\nabstract contract ContextUpgradeable is Initializable {\\n    function __Context_init() internal initializer {\\n        __Context_init_unchained();\\n    }\\n\\n    function __Context_init_unchained() internal initializer {\\n    }\\n    function _msgSender() internal view virtual returns (address payable) {\\n        return msg.sender;\\n    }\\n\\n    function _msgData() internal view virtual returns (bytes memory) {\\n        this; // silence state mutability warning without generating bytecode - see https://github.com/ethereum/solidity/issues/2691\\n        return msg.data;\\n    }\\n    uint256[50] private __gap;\\n}\\n\",\"keccak256\":\"0xbbf8a21b9a66c48d45ff771b8563c6df19ba451d63dfb8380a865c1e1f29d1a0\",\"license\":\"MIT\"},\"@openzeppelin/contracts/math/SafeMath.sol\":{\"content\":\"// SPDX-License-Identifier: MIT\\n\\npragma solidity >=0.6.0 <0.8.0;\\n\\n/**\\n * @dev Wrappers over Solidity's arithmetic operations with added overflow\\n * checks.\\n *\\n * Arithmetic operations in Solidity wrap on overflow. This can easily result\\n * in bugs, because programmers usually assume that an overflow raises an\\n * error, which is the standard behavior in high level programming languages.\\n * `SafeMath` restores this intuition by reverting the transaction when an\\n * operation overflows.\\n *\\n * Using this library instead of the unchecked operations eliminates an entire\\n * class of bugs, so it's recommended to use it always.\\n */\\nlibrary SafeMath {\\n    /**\\n     * @dev Returns the addition of two unsigned integers, with an overflow flag.\\n     *\\n     * _Available since v3.4._\\n     */\\n    function tryAdd(uint256 a, uint256 b) internal pure returns (bool, uint256) {\\n        uint256 c = a + b;\\n        if (c < a) return (false, 0);\\n        return (true, c);\\n    }\\n\\n    /**\\n     * @dev Returns the substraction of two unsigned integers, with an overflow flag.\\n     *\\n     * _Available since v3.4._\\n     */\\n    function trySub(uint256 a, uint256 b) internal pure returns (bool, uint256) {\\n        if (b > a) return (false, 0);\\n        return (true, a - b);\\n    }\\n\\n    /**\\n     * @dev Returns the multiplication of two unsigned integers, with an overflow flag.\\n     *\\n     * _Available since v3.4._\\n     */\\n    function tryMul(uint256 a, uint256 b) internal pure returns (bool, uint256) {\\n        // Gas optimization: this is cheaper than requiring 'a' not being zero, but the\\n        // benefit is lost if 'b' is also tested.\\n        // See: https://github.com/OpenZeppelin/openzeppelin-contracts/pull/522\\n        if (a == 0) return (true, 0);\\n        uint256 c = a * b;\\n        if (c / a != b) return (false, 0);\\n        return (true, c);\\n    }\\n\\n    /**\\n     * @dev Returns the division of two unsigned integers, with a division by zero flag.\\n     *\\n     * _Available since v3.4._\\n     */\\n    function tryDiv(uint256 a, uint256 b) internal pure returns (bool, uint256) {\\n        if (b == 0) return (false, 0);\\n        return (true, a / b);\\n    }\\n\\n    /**\\n     * @dev Returns the remainder of dividing two unsigned integers, with a division by zero flag.\\n     *\\n     * _Available since v3.4._\\n     */\\n    function tryMod(uint256 a, uint256 b) internal pure returns (bool, uint256) {\\n        if (b == 0) return (false, 0);\\n        return (true, a % b);\\n    }\\n\\n    /**\\n     * @dev Returns the addition of two unsigned integers, reverting on\\n     * overflow.\\n     *\\n     * Counterpart to Solidity's `+` operator.\\n     *\\n     * Requirements:\\n     *\\n     * - Addition cannot overflow.\\n     */\\n    function add(uint256 a, uint256 b) internal pure returns (uint256) {\\n        uint256 c = a + b;\\n        require(c >= a, \\\"SafeMath: addition overflow\\\");\\n        return c;\\n    }\\n\\n    /**\\n     * @dev Returns the subtraction of two unsigned integers, reverting on\\n     * overflow (when the result is negative).\\n     *\\n     * Counterpart to Solidity's `-` operator.\\n     *\\n     * Requirements:\\n     *\\n     * - Subtraction cannot overflow.\\n     */\\n    function sub(uint256 a, uint256 b) internal pure returns (uint256) {\\n        require(b <= a, \\\"SafeMath: subtraction overflow\\\");\\n        return a - b;\\n    }\\n\\n    /**\\n     * @dev Returns the multiplication of two unsigned integers, reverting on\\n     * overflow.\\n     *\\n     * Counterpart to Solidity's `*` operator.\\n     *\\n     * Requirements:\\n     *\\n     * - Multiplication cannot overflow.\\n     */\\n    function mul(uint256 a, uint256 b) internal pure returns (uint256) {\\n        if (a == 0) return 0;\\n        uint256 c = a * b;\\n        require(c / a == b, \\\"SafeMath: multiplication overflow\\\");\\n        return c;\\n    }\\n\\n    /**\\n     * @dev Returns the integer division of two unsigned integers, reverting on\\n     * division by zero. The result is rounded towards zero.\\n     *\\n     * Counterpart to Solidity's `/` operator. Note: this function uses a\\n     * `revert` opcode (which leaves remaining gas untouched) while Solidity\\n     * uses an invalid opcode to revert (consuming all remaining gas).\\n     *\\n     * Requirements:\\n     *\\n     * - The divisor cannot be zero.\\n     */\\n    function div(uint256 a, uint256 b) internal pure returns (uint256) {\\n        require(b > 0, \\\"SafeMath: division by zero\\\");\\n        return a / b;\\n    }\\n\\n    /**\\n     * @dev Returns the remainder of dividing two unsigned integers. (unsigned integer modulo),\\n     * reverting when dividing by zero.\\n     *\\n     * Counterpart to Solidity's `%` operator. This function uses a `revert`\\n     * opcode (which leaves remaining gas untouched) while Solidity uses an\\n     * invalid opcode to revert (consuming all remaining gas).\\n     *\\n     * Requirements:\\n     *\\n     * - The divisor cannot be zero.\\n     */\\n    function mod(uint256 a, uint256 b) internal pure returns (uint256) {\\n        require(b > 0, \\\"SafeMath: modulo by zero\\\");\\n        return a % b;\\n    }\\n\\n    /**\\n     * @dev Returns the subtraction of two unsigned integers, reverting with custom message on\\n     * overflow (when the result is negative).\\n     *\\n     * CAUTION: This function is deprecated because it requires allocating memory for the error\\n     * message unnecessarily. For custom revert reasons use {trySub}.\\n     *\\n     * Counterpart to Solidity's `-` operator.\\n     *\\n     * Requirements:\\n     *\\n     * - Subtraction cannot overflow.\\n     */\\n    function sub(uint256 a, uint256 b, string memory errorMessage) internal pure returns (uint256) {\\n        require(b <= a, errorMessage);\\n        return a - b;\\n    }\\n\\n    /**\\n     * @dev Returns the integer division of two unsigned integers, reverting with custom message on\\n     * division by zero. The result is rounded towards zero.\\n     *\\n     * CAUTION: This function is deprecated because it requires allocating memory for the error\\n     * message unnecessarily. For custom revert reasons use {tryDiv}.\\n     *\\n     * Counterpart to Solidity's `/` operator. Note: this function uses a\\n     * `revert` opcode (which leaves remaining gas untouched) while Solidity\\n     * uses an invalid opcode to revert (consuming all remaining gas).\\n     *\\n     * Requirements:\\n     *\\n     * - The divisor cannot be zero.\\n     */\\n    function div(uint256 a, uint256 b, string memory errorMessage) internal pure returns (uint256) {\\n        require(b > 0, errorMessage);\\n        return a / b;\\n    }\\n\\n    /**\\n     * @dev Returns the remainder of dividing two unsigned integers. (unsigned integer modulo),\\n     * reverting with custom message when dividing by zero.\\n     *\\n     * CAUTION: This function is deprecated because it requires allocating memory for the error\\n     * message unnecessarily. For custom revert reasons use {tryMod}.\\n     *\\n     * Counterpart to Solidity's `%` operator. This function uses a `revert`\\n     * opcode (which leaves remaining gas untouched) while Solidity uses an\\n     * invalid opcode to revert (consuming all remaining gas).\\n     *\\n     * Requirements:\\n     *\\n     * - The divisor cannot be zero.\\n     */\\n    function mod(uint256 a, uint256 b, string memory errorMessage) internal pure returns (uint256) {\\n        require(b > 0, errorMessage);\\n        return a % b;\\n    }\\n}\\n\",\"keccak256\":\"0xcc78a17dd88fa5a2edc60c8489e2f405c0913b377216a5b26b35656b2d0dab52\",\"license\":\"MIT\"},\"@openzeppelin/contracts/token/ERC20/ERC20.sol\":{\"content\":\"// SPDX-License-Identifier: MIT\\n\\npragma solidity >=0.6.0 <0.8.0;\\n\\nimport \\\"../../utils/Context.sol\\\";\\nimport \\\"./IERC20.sol\\\";\\nimport \\\"../../math/SafeMath.sol\\\";\\n\\n/**\\n * @dev Implementation of the {IERC20} interface.\\n *\\n * This implementation is agnostic to the way tokens are created. This means\\n * that a supply mechanism has to be added in a derived contract using {_mint}.\\n * For a generic mechanism see {ERC20PresetMinterPauser}.\\n *\\n * TIP: For a detailed writeup see our guide\\n * https://forum.zeppelin.solutions/t/how-to-implement-erc20-supply-mechanisms/226[How\\n * to implement supply mechanisms].\\n *\\n * We have followed general OpenZeppelin guidelines: functions revert instead\\n * of returning `false` on failure. This behavior is nonetheless conventional\\n * and does not conflict with the expectations of ERC20 applications.\\n *\\n * Additionally, an {Approval} event is emitted on calls to {transferFrom}.\\n * This allows applications to reconstruct the allowance for all accounts just\\n * by listening to said events. Other implementations of the EIP may not emit\\n * these events, as it isn't required by the specification.\\n *\\n * Finally, the non-standard {decreaseAllowance} and {increaseAllowance}\\n * functions have been added to mitigate the well-known issues around setting\\n * allowances. See {IERC20-approve}.\\n */\\ncontract ERC20 is Context, IERC20 {\\n    using SafeMath for uint256;\\n\\n    mapping (address => uint256) private _balances;\\n\\n    mapping (address => mapping (address => uint256)) private _allowances;\\n\\n    uint256 private _totalSupply;\\n\\n    string private _name;\\n    string private _symbol;\\n    uint8 private _decimals;\\n\\n    /**\\n     * @dev Sets the values for {name} and {symbol}, initializes {decimals} with\\n     * a default value of 18.\\n     *\\n     * To select a different value for {decimals}, use {_setupDecimals}.\\n     *\\n     * All three of these values are immutable: they can only be set once during\\n     * construction.\\n     */\\n    constructor (string memory name_, string memory symbol_) public {\\n        _name = name_;\\n        _symbol = symbol_;\\n        _decimals = 18;\\n    }\\n\\n    /**\\n     * @dev Returns the name of the token.\\n     */\\n    function name() public view virtual returns (string memory) {\\n        return _name;\\n    }\\n\\n    /**\\n     * @dev Returns the symbol of the token, usually a shorter version of the\\n     * name.\\n     */\\n    function symbol() public view virtual returns (string memory) {\\n        return _symbol;\\n    }\\n\\n    /**\\n     * @dev Returns the number of decimals used to get its user representation.\\n     * For example, if `decimals` equals `2`, a balance of `505` tokens should\\n     * be displayed to a user as `5,05` (`505 / 10 ** 2`).\\n     *\\n     * Tokens usually opt for a value of 18, imitating the relationship between\\n     * Ether and Wei. This is the value {ERC20} uses, unless {_setupDecimals} is\\n     * called.\\n     *\\n     * NOTE: This information is only used for _display_ purposes: it in\\n     * no way affects any of the arithmetic of the contract, including\\n     * {IERC20-balanceOf} and {IERC20-transfer}.\\n     */\\n    function decimals() public view virtual returns (uint8) {\\n        return _decimals;\\n    }\\n\\n    /**\\n     * @dev See {IERC20-totalSupply}.\\n     */\\n    function totalSupply() public view virtual override returns (uint256) {\\n        return _totalSupply;\\n    }\\n\\n    /**\\n     * @dev See {IERC20-balanceOf}.\\n     */\\n    function balanceOf(address account) public view virtual override returns (uint256) {\\n        return _balances[account];\\n    }\\n\\n    /**\\n     * @dev See {IERC20-transfer}.\\n     *\\n     * Requirements:\\n     *\\n     * - `recipient` cannot be the zero address.\\n     * - the caller must have a balance of at least `amount`.\\n     */\\n    function transfer(address recipient, uint256 amount) public virtual override returns (bool) {\\n        _transfer(_msgSender(), recipient, amount);\\n        return true;\\n    }\\n\\n    /**\\n     * @dev See {IERC20-allowance}.\\n     */\\n    function allowance(address owner, address spender) public view virtual override returns (uint256) {\\n        return _allowances[owner][spender];\\n    }\\n\\n    /**\\n     * @dev See {IERC20-approve}.\\n     *\\n     * Requirements:\\n     *\\n     * - `spender` cannot be the zero address.\\n     */\\n    function approve(address spender, uint256 amount) public virtual override returns (bool) {\\n        _approve(_msgSender(), spender, amount);\\n        return true;\\n    }\\n\\n    /**\\n     * @dev See {IERC20-transferFrom}.\\n     *\\n     * Emits an {Approval} event indicating the updated allowance. This is not\\n     * required by the EIP. See the note at the beginning of {ERC20}.\\n     *\\n     * Requirements:\\n     *\\n     * - `sender` and `recipient` cannot be the zero address.\\n     * - `sender` must have a balance of at least `amount`.\\n     * - the caller must have allowance for ``sender``'s tokens of at least\\n     * `amount`.\\n     */\\n    function transferFrom(address sender, address recipient, uint256 amount) public virtual override returns (bool) {\\n        _transfer(sender, recipient, amount);\\n        _approve(sender, _msgSender(), _allowances[sender][_msgSender()].sub(amount, \\\"ERC20: transfer amount exceeds allowance\\\"));\\n        return true;\\n    }\\n\\n    /**\\n     * @dev Atomically increases the allowance granted to `spender` by the caller.\\n     *\\n     * This is an alternative to {approve} that can be used as a mitigation for\\n     * problems described in {IERC20-approve}.\\n     *\\n     * Emits an {Approval} event indicating the updated allowance.\\n     *\\n     * Requirements:\\n     *\\n     * - `spender` cannot be the zero address.\\n     */\\n    function increaseAllowance(address spender, uint256 addedValue) public virtual returns (bool) {\\n        _approve(_msgSender(), spender, _allowances[_msgSender()][spender].add(addedValue));\\n        return true;\\n    }\\n\\n    /**\\n     * @dev Atomically decreases the allowance granted to `spender` by the caller.\\n     *\\n     * This is an alternative to {approve} that can be used as a mitigation for\\n     * problems described in {IERC20-approve}.\\n     *\\n     * Emits an {Approval} event indicating the updated allowance.\\n     *\\n     * Requirements:\\n     *\\n     * - `spender` cannot be the zero address.\\n     * - `spender` must have allowance for the caller of at least\\n     * `subtractedValue`.\\n     */\\n    function decreaseAllowance(address spender, uint256 subtractedValue) public virtual returns (bool) {\\n        _approve(_msgSender(), spender, _allowances[_msgSender()][spender].sub(subtractedValue, \\\"ERC20: decreased allowance below zero\\\"));\\n        return true;\\n    }\\n\\n    /**\\n     * @dev Moves tokens `amount` from `sender` to `recipient`.\\n     *\\n     * This is internal function is equivalent to {transfer}, and can be used to\\n     * e.g. implement automatic token fees, slashing mechanisms, etc.\\n     *\\n     * Emits a {Transfer} event.\\n     *\\n     * Requirements:\\n     *\\n     * - `sender` cannot be the zero address.\\n     * - `recipient` cannot be the zero address.\\n     * - `sender` must have a balance of at least `amount`.\\n     */\\n    function _transfer(address sender, address recipient, uint256 amount) internal virtual {\\n        require(sender != address(0), \\\"ERC20: transfer from the zero address\\\");\\n        require(recipient != address(0), \\\"ERC20: transfer to the zero address\\\");\\n\\n        _beforeTokenTransfer(sender, recipient, amount);\\n\\n        _balances[sender] = _balances[sender].sub(amount, \\\"ERC20: transfer amount exceeds balance\\\");\\n        _balances[recipient] = _balances[recipient].add(amount);\\n        emit Transfer(sender, recipient, amount);\\n    }\\n\\n    /** @dev Creates `amount` tokens and assigns them to `account`, increasing\\n     * the total supply.\\n     *\\n     * Emits a {Transfer} event with `from` set to the zero address.\\n     *\\n     * Requirements:\\n     *\\n     * - `to` cannot be the zero address.\\n     */\\n    function _mint(address account, uint256 amount) internal virtual {\\n        require(account != address(0), \\\"ERC20: mint to the zero address\\\");\\n\\n        _beforeTokenTransfer(address(0), account, amount);\\n\\n        _totalSupply = _totalSupply.add(amount);\\n        _balances[account] = _balances[account].add(amount);\\n        emit Transfer(address(0), account, amount);\\n    }\\n\\n    /**\\n     * @dev Destroys `amount` tokens from `account`, reducing the\\n     * total supply.\\n     *\\n     * Emits a {Transfer} event with `to` set to the zero address.\\n     *\\n     * Requirements:\\n     *\\n     * - `account` cannot be the zero address.\\n     * - `account` must have at least `amount` tokens.\\n     */\\n    function _burn(address account, uint256 amount) internal virtual {\\n        require(account != address(0), \\\"ERC20: burn from the zero address\\\");\\n\\n        _beforeTokenTransfer(account, address(0), amount);\\n\\n        _balances[account] = _balances[account].sub(amount, \\\"ERC20: burn amount exceeds balance\\\");\\n        _totalSupply = _totalSupply.sub(amount);\\n        emit Transfer(account, address(0), amount);\\n    }\\n\\n    /**\\n     * @dev Sets `amount` as the allowance of `spender` over the `owner` s tokens.\\n     *\\n     * This internal function is equivalent to `approve`, and can be used to\\n     * e.g. set automatic allowances for certain subsystems, etc.\\n     *\\n     * Emits an {Approval} event.\\n     *\\n     * Requirements:\\n     *\\n     * - `owner` cannot be the zero address.\\n     * - `spender` cannot be the zero address.\\n     */\\n    function _approve(address owner, address spender, uint256 amount) internal virtual {\\n        require(owner != address(0), \\\"ERC20: approve from the zero address\\\");\\n        require(spender != address(0), \\\"ERC20: approve to the zero address\\\");\\n\\n        _allowances[owner][spender] = amount;\\n        emit Approval(owner, spender, amount);\\n    }\\n\\n    /**\\n     * @dev Sets {decimals} to a value other than the default one of 18.\\n     *\\n     * WARNING: This function should only be called from the constructor. Most\\n     * applications that interact with token contracts will not expect\\n     * {decimals} to ever change, and may work incorrectly if it does.\\n     */\\n    function _setupDecimals(uint8 decimals_) internal virtual {\\n        _decimals = decimals_;\\n    }\\n\\n    /**\\n     * @dev Hook that is called before any transfer of tokens. This includes\\n     * minting and burning.\\n     *\\n     * Calling conditions:\\n     *\\n     * - when `from` and `to` are both non-zero, `amount` of ``from``'s tokens\\n     * will be to transferred to `to`.\\n     * - when `from` is zero, `amount` tokens will be minted for `to`.\\n     * - when `to` is zero, `amount` of ``from``'s tokens will be burned.\\n     * - `from` and `to` are never both zero.\\n     *\\n     * To learn more about hooks, head to xref:ROOT:extending-contracts.adoc#using-hooks[Using Hooks].\\n     */\\n    function _beforeTokenTransfer(address from, address to, uint256 amount) internal virtual { }\\n}\\n\",\"keccak256\":\"0xca0c2396dbeb3503b51abf4248ebf77a1461edad513c01529df51850a012bee3\",\"license\":\"MIT\"},\"@openzeppelin/contracts/token/ERC20/IERC20.sol\":{\"content\":\"// SPDX-License-Identifier: MIT\\n\\npragma solidity >=0.6.0 <0.8.0;\\n\\n/**\\n * @dev Interface of the ERC20 standard as defined in the EIP.\\n */\\ninterface IERC20 {\\n    /**\\n     * @dev Returns the amount of tokens in existence.\\n     */\\n    function totalSupply() external view returns (uint256);\\n\\n    /**\\n     * @dev Returns the amount of tokens owned by `account`.\\n     */\\n    function balanceOf(address account) external view returns (uint256);\\n\\n    /**\\n     * @dev Moves `amount` tokens from the caller's account to `recipient`.\\n     *\\n     * Returns a boolean value indicating whether the operation succeeded.\\n     *\\n     * Emits a {Transfer} event.\\n     */\\n    function transfer(address recipient, uint256 amount) external returns (bool);\\n\\n    /**\\n     * @dev Returns the remaining number of tokens that `spender` will be\\n     * allowed to spend on behalf of `owner` through {transferFrom}. This is\\n     * zero by default.\\n     *\\n     * This value changes when {approve} or {transferFrom} are called.\\n     */\\n    function allowance(address owner, address spender) external view returns (uint256);\\n\\n    /**\\n     * @dev Sets `amount` as the allowance of `spender` over the caller's tokens.\\n     *\\n     * Returns a boolean value indicating whether the operation succeeded.\\n     *\\n     * IMPORTANT: Beware that changing an allowance with this method brings the risk\\n     * that someone may use both the old and the new allowance by unfortunate\\n     * transaction ordering. One possible solution to mitigate this race\\n     * condition is to first reduce the spender's allowance to 0 and set the\\n     * desired value afterwards:\\n     * https://github.com/ethereum/EIPs/issues/20#issuecomment-263524729\\n     *\\n     * Emits an {Approval} event.\\n     */\\n    function approve(address spender, uint256 amount) external returns (bool);\\n\\n    /**\\n     * @dev Moves `amount` tokens from `sender` to `recipient` using the\\n     * allowance mechanism. `amount` is then deducted from the caller's\\n     * allowance.\\n     *\\n     * Returns a boolean value indicating whether the operation succeeded.\\n     *\\n     * Emits a {Transfer} event.\\n     */\\n    function transferFrom(address sender, address recipient, uint256 amount) external returns (bool);\\n\\n    /**\\n     * @dev Emitted when `value` tokens are moved from one account (`from`) to\\n     * another (`to`).\\n     *\\n     * Note that `value` may be zero.\\n     */\\n    event Transfer(address indexed from, address indexed to, uint256 value);\\n\\n    /**\\n     * @dev Emitted when the allowance of a `spender` for an `owner` is set by\\n     * a call to {approve}. `value` is the new allowance.\\n     */\\n    event Approval(address indexed owner, address indexed spender, uint256 value);\\n}\\n\",\"keccak256\":\"0x5f02220344881ce43204ae4a6281145a67bc52c2bb1290a791857df3d19d78f5\",\"license\":\"MIT\"},\"@openzeppelin/contracts/token/ERC20/SafeERC20.sol\":{\"content\":\"// SPDX-License-Identifier: MIT\\n\\npragma solidity >=0.6.0 <0.8.0;\\n\\nimport \\\"./IERC20.sol\\\";\\nimport \\\"../../math/SafeMath.sol\\\";\\nimport \\\"../../utils/Address.sol\\\";\\n\\n/**\\n * @title SafeERC20\\n * @dev Wrappers around ERC20 operations that throw on failure (when the token\\n * contract returns false). Tokens that return no value (and instead revert or\\n * throw on failure) are also supported, non-reverting calls are assumed to be\\n * successful.\\n * To use this library you can add a `using SafeERC20 for IERC20;` statement to your contract,\\n * which allows you to call the safe operations as `token.safeTransfer(...)`, etc.\\n */\\nlibrary SafeERC20 {\\n    using SafeMath for uint256;\\n    using Address for address;\\n\\n    function safeTransfer(IERC20 token, address to, uint256 value) internal {\\n        _callOptionalReturn(token, abi.encodeWithSelector(token.transfer.selector, to, value));\\n    }\\n\\n    function safeTransferFrom(IERC20 token, address from, address to, uint256 value) internal {\\n        _callOptionalReturn(token, abi.encodeWithSelector(token.transferFrom.selector, from, to, value));\\n    }\\n\\n    /**\\n     * @dev Deprecated. This function has issues similar to the ones found in\\n     * {IERC20-approve}, and its usage is discouraged.\\n     *\\n     * Whenever possible, use {safeIncreaseAllowance} and\\n     * {safeDecreaseAllowance} instead.\\n     */\\n    function safeApprove(IERC20 token, address spender, uint256 value) internal {\\n        // safeApprove should only be called when setting an initial allowance,\\n        // or when resetting it to zero. To increase and decrease it, use\\n        // 'safeIncreaseAllowance' and 'safeDecreaseAllowance'\\n        // solhint-disable-next-line max-line-length\\n        require((value == 0) || (token.allowance(address(this), spender) == 0),\\n            \\\"SafeERC20: approve from non-zero to non-zero allowance\\\"\\n        );\\n        _callOptionalReturn(token, abi.encodeWithSelector(token.approve.selector, spender, value));\\n    }\\n\\n    function safeIncreaseAllowance(IERC20 token, address spender, uint256 value) internal {\\n        uint256 newAllowance = token.allowance(address(this), spender).add(value);\\n        _callOptionalReturn(token, abi.encodeWithSelector(token.approve.selector, spender, newAllowance));\\n    }\\n\\n    function safeDecreaseAllowance(IERC20 token, address spender, uint256 value) internal {\\n        uint256 newAllowance = token.allowance(address(this), spender).sub(value, \\\"SafeERC20: decreased allowance below zero\\\");\\n        _callOptionalReturn(token, abi.encodeWithSelector(token.approve.selector, spender, newAllowance));\\n    }\\n\\n    /**\\n     * @dev Imitates a Solidity high-level call (i.e. a regular function call to a contract), relaxing the requirement\\n     * on the return value: the return value is optional (but if data is returned, it must not be false).\\n     * @param token The token targeted by the call.\\n     * @param data The call data (encoded using abi.encode or one of its variants).\\n     */\\n    function _callOptionalReturn(IERC20 token, bytes memory data) private {\\n        // We need to perform a low level call here, to bypass Solidity's return data size checking mechanism, since\\n        // we're implementing it ourselves. We use {Address.functionCall} to perform this call, which verifies that\\n        // the target address contains contract code and also asserts for success in the low-level call.\\n\\n        bytes memory returndata = address(token).functionCall(data, \\\"SafeERC20: low-level call failed\\\");\\n        if (returndata.length > 0) { // Return data is optional\\n            // solhint-disable-next-line max-line-length\\n            require(abi.decode(returndata, (bool)), \\\"SafeERC20: ERC20 operation did not succeed\\\");\\n        }\\n    }\\n}\\n\",\"keccak256\":\"0xf12dfbe97e6276980b83d2830bb0eb75e0cf4f3e626c2471137f82158ae6a0fc\",\"license\":\"MIT\"},\"@openzeppelin/contracts/utils/Address.sol\":{\"content\":\"// SPDX-License-Identifier: MIT\\n\\npragma solidity >=0.6.2 <0.8.0;\\n\\n/**\\n * @dev Collection of functions related to the address type\\n */\\nlibrary Address {\\n    /**\\n     * @dev Returns true if `account` is a contract.\\n     *\\n     * [IMPORTANT]\\n     * ====\\n     * It is unsafe to assume that an address for which this function returns\\n     * false is an externally-owned account (EOA) and not a contract.\\n     *\\n     * Among others, `isContract` will return false for the following\\n     * types of addresses:\\n     *\\n     *  - an externally-owned account\\n     *  - a contract in construction\\n     *  - an address where a contract will be created\\n     *  - an address where a contract lived, but was destroyed\\n     * ====\\n     */\\n    function isContract(address account) internal view returns (bool) {\\n        // This method relies on extcodesize, which returns 0 for contracts in\\n        // construction, since the code is only stored at the end of the\\n        // constructor execution.\\n\\n        uint256 size;\\n        // solhint-disable-next-line no-inline-assembly\\n        assembly { size := extcodesize(account) }\\n        return size > 0;\\n    }\\n\\n    /**\\n     * @dev Replacement for Solidity's `transfer`: sends `amount` wei to\\n     * `recipient`, forwarding all available gas and reverting on errors.\\n     *\\n     * https://eips.ethereum.org/EIPS/eip-1884[EIP1884] increases the gas cost\\n     * of certain opcodes, possibly making contracts go over the 2300 gas limit\\n     * imposed by `transfer`, making them unable to receive funds via\\n     * `transfer`. {sendValue} removes this limitation.\\n     *\\n     * https://diligence.consensys.net/posts/2019/09/stop-using-soliditys-transfer-now/[Learn more].\\n     *\\n     * IMPORTANT: because control is transferred to `recipient`, care must be\\n     * taken to not create reentrancy vulnerabilities. Consider using\\n     * {ReentrancyGuard} or the\\n     * https://solidity.readthedocs.io/en/v0.5.11/security-considerations.html#use-the-checks-effects-interactions-pattern[checks-effects-interactions pattern].\\n     */\\n    function sendValue(address payable recipient, uint256 amount) internal {\\n        require(address(this).balance >= amount, \\\"Address: insufficient balance\\\");\\n\\n        // solhint-disable-next-line avoid-low-level-calls, avoid-call-value\\n        (bool success, ) = recipient.call{ value: amount }(\\\"\\\");\\n        require(success, \\\"Address: unable to send value, recipient may have reverted\\\");\\n    }\\n\\n    /**\\n     * @dev Performs a Solidity function call using a low level `call`. A\\n     * plain`call` is an unsafe replacement for a function call: use this\\n     * function instead.\\n     *\\n     * If `target` reverts with a revert reason, it is bubbled up by this\\n     * function (like regular Solidity function calls).\\n     *\\n     * Returns the raw returned data. To convert to the expected return value,\\n     * use https://solidity.readthedocs.io/en/latest/units-and-global-variables.html?highlight=abi.decode#abi-encoding-and-decoding-functions[`abi.decode`].\\n     *\\n     * Requirements:\\n     *\\n     * - `target` must be a contract.\\n     * - calling `target` with `data` must not revert.\\n     *\\n     * _Available since v3.1._\\n     */\\n    function functionCall(address target, bytes memory data) internal returns (bytes memory) {\\n      return functionCall(target, data, \\\"Address: low-level call failed\\\");\\n    }\\n\\n    /**\\n     * @dev Same as {xref-Address-functionCall-address-bytes-}[`functionCall`], but with\\n     * `errorMessage` as a fallback revert reason when `target` reverts.\\n     *\\n     * _Available since v3.1._\\n     */\\n    function functionCall(address target, bytes memory data, string memory errorMessage) internal returns (bytes memory) {\\n        return functionCallWithValue(target, data, 0, errorMessage);\\n    }\\n\\n    /**\\n     * @dev Same as {xref-Address-functionCall-address-bytes-}[`functionCall`],\\n     * but also transferring `value` wei to `target`.\\n     *\\n     * Requirements:\\n     *\\n     * - the calling contract must have an ETH balance of at least `value`.\\n     * - the called Solidity function must be `payable`.\\n     *\\n     * _Available since v3.1._\\n     */\\n    function functionCallWithValue(address target, bytes memory data, uint256 value) internal returns (bytes memory) {\\n        return functionCallWithValue(target, data, value, \\\"Address: low-level call with value failed\\\");\\n    }\\n\\n    /**\\n     * @dev Same as {xref-Address-functionCallWithValue-address-bytes-uint256-}[`functionCallWithValue`], but\\n     * with `errorMessage` as a fallback revert reason when `target` reverts.\\n     *\\n     * _Available since v3.1._\\n     */\\n    function functionCallWithValue(address target, bytes memory data, uint256 value, string memory errorMessage) internal returns (bytes memory) {\\n        require(address(this).balance >= value, \\\"Address: insufficient balance for call\\\");\\n        require(isContract(target), \\\"Address: call to non-contract\\\");\\n\\n        // solhint-disable-next-line avoid-low-level-calls\\n        (bool success, bytes memory returndata) = target.call{ value: value }(data);\\n        return _verifyCallResult(success, returndata, errorMessage);\\n    }\\n\\n    /**\\n     * @dev Same as {xref-Address-functionCall-address-bytes-}[`functionCall`],\\n     * but performing a static call.\\n     *\\n     * _Available since v3.3._\\n     */\\n    function functionStaticCall(address target, bytes memory data) internal view returns (bytes memory) {\\n        return functionStaticCall(target, data, \\\"Address: low-level static call failed\\\");\\n    }\\n\\n    /**\\n     * @dev Same as {xref-Address-functionCall-address-bytes-string-}[`functionCall`],\\n     * but performing a static call.\\n     *\\n     * _Available since v3.3._\\n     */\\n    function functionStaticCall(address target, bytes memory data, string memory errorMessage) internal view returns (bytes memory) {\\n        require(isContract(target), \\\"Address: static call to non-contract\\\");\\n\\n        // solhint-disable-next-line avoid-low-level-calls\\n        (bool success, bytes memory returndata) = target.staticcall(data);\\n        return _verifyCallResult(success, returndata, errorMessage);\\n    }\\n\\n    /**\\n     * @dev Same as {xref-Address-functionCall-address-bytes-}[`functionCall`],\\n     * but performing a delegate call.\\n     *\\n     * _Available since v3.4._\\n     */\\n    function functionDelegateCall(address target, bytes memory data) internal returns (bytes memory) {\\n        return functionDelegateCall(target, data, \\\"Address: low-level delegate call failed\\\");\\n    }\\n\\n    /**\\n     * @dev Same as {xref-Address-functionCall-address-bytes-string-}[`functionCall`],\\n     * but performing a delegate call.\\n     *\\n     * _Available since v3.4._\\n     */\\n    function functionDelegateCall(address target, bytes memory data, string memory errorMessage) internal returns (bytes memory) {\\n        require(isContract(target), \\\"Address: delegate call to non-contract\\\");\\n\\n        // solhint-disable-next-line avoid-low-level-calls\\n        (bool success, bytes memory returndata) = target.delegatecall(data);\\n        return _verifyCallResult(success, returndata, errorMessage);\\n    }\\n\\n    function _verifyCallResult(bool success, bytes memory returndata, string memory errorMessage) private pure returns(bytes memory) {\\n        if (success) {\\n            return returndata;\\n        } else {\\n            // Look for revert reason and bubble it up if present\\n            if (returndata.length > 0) {\\n                // The easiest way to bubble the revert reason is using memory via assembly\\n\\n                // solhint-disable-next-line no-inline-assembly\\n                assembly {\\n                    let returndata_size := mload(returndata)\\n                    revert(add(32, returndata), returndata_size)\\n                }\\n            } else {\\n                revert(errorMessage);\\n            }\\n        }\\n    }\\n}\\n\",\"keccak256\":\"0x28911e614500ae7c607a432a709d35da25f3bc5ddc8bd12b278b66358070c0ea\",\"license\":\"MIT\"},\"@openzeppelin/contracts/utils/Context.sol\":{\"content\":\"// SPDX-License-Identifier: MIT\\n\\npragma solidity >=0.6.0 <0.8.0;\\n\\n/*\\n * @dev Provides information about the current execution context, including the\\n * sender of the transaction and its data. While these are generally available\\n * via msg.sender and msg.data, they should not be accessed in such a direct\\n * manner, since when dealing with GSN meta-transactions the account sending and\\n * paying for execution may not be the actual sender (as far as an application\\n * is concerned).\\n *\\n * This contract is only required for intermediate, library-like contracts.\\n */\\nabstract contract Context {\\n    function _msgSender() internal view virtual returns (address payable) {\\n        return msg.sender;\\n    }\\n\\n    function _msgData() internal view virtual returns (bytes memory) {\\n        this; // silence state mutability warning without generating bytecode - see https://github.com/ethereum/solidity/issues/2691\\n        return msg.data;\\n    }\\n}\\n\",\"keccak256\":\"0x8d3cb350f04ff49cfb10aef08d87f19dcbaecc8027b0bed12f3275cd12f38cf0\",\"license\":\"MIT\"},\"contracts/AmplificationUtils.sol\":{\"content\":\"// SPDX-License-Identifier: MIT\\n\\npragma solidity 0.6.12;\\n\\nimport \\\"@openzeppelin/contracts/token/ERC20/SafeERC20.sol\\\";\\nimport \\\"./SwapUtils.sol\\\";\\n\\n/**\\n * @title AmplificationUtils library\\n * @notice A library to calculate and ramp the A parameter of a given `SwapUtils.Swap` struct.\\n * This library assumes the struct is fully validated.\\n */\\nlibrary AmplificationUtils {\\n    using SafeMath for uint256;\\n\\n    event RampA(\\n        uint256 oldA,\\n        uint256 newA,\\n        uint256 initialTime,\\n        uint256 futureTime\\n    );\\n    event StopRampA(uint256 currentA, uint256 time);\\n\\n    // Constant values used in ramping A calculations\\n    uint256 public constant A_PRECISION = 100;\\n    uint256 public constant MAX_A = 10**6;\\n    uint256 private constant MAX_A_CHANGE = 2;\\n    uint256 private constant MIN_RAMP_TIME = 14 days;\\n\\n    /**\\n     * @notice Return A, the amplification coefficient * n * (n - 1)\\n     * @dev See the StableSwap paper for details\\n     * @param self Swap struct to read from\\n     * @return A parameter\\n     */\\n    function getA(SwapUtils.Swap storage self) external view returns (uint256) {\\n        return _getAPrecise(self).div(A_PRECISION);\\n    }\\n\\n    /**\\n     * @notice Return A in its raw precision\\n     * @dev See the StableSwap paper for details\\n     * @param self Swap struct to read from\\n     * @return A parameter in its raw precision form\\n     */\\n    function getAPrecise(SwapUtils.Swap storage self)\\n        external\\n        view\\n        returns (uint256)\\n    {\\n        return _getAPrecise(self);\\n    }\\n\\n    /**\\n     * @notice Return A in its raw precision\\n     * @dev See the StableSwap paper for details\\n     * @param self Swap struct to read from\\n     * @return A parameter in its raw precision form\\n     */\\n    function _getAPrecise(SwapUtils.Swap storage self)\\n        internal\\n        view\\n        returns (uint256)\\n    {\\n        uint256 t1 = self.futureATime; // time when ramp is finished\\n        uint256 a1 = self.futureA; // final A value when ramp is finished\\n\\n        if (block.timestamp < t1) {\\n            uint256 t0 = self.initialATime; // time when ramp is started\\n            uint256 a0 = self.initialA; // initial A value when ramp is started\\n            if (a1 > a0) {\\n                // a0 + (a1 - a0) * (block.timestamp - t0) / (t1 - t0)\\n                return\\n                    a0.add(\\n                        a1.sub(a0).mul(block.timestamp.sub(t0)).div(t1.sub(t0))\\n                    );\\n            } else {\\n                // a0 - (a0 - a1) * (block.timestamp - t0) / (t1 - t0)\\n                return\\n                    a0.sub(\\n                        a0.sub(a1).mul(block.timestamp.sub(t0)).div(t1.sub(t0))\\n                    );\\n            }\\n        } else {\\n            return a1;\\n        }\\n    }\\n\\n    /**\\n     * @notice Start ramping up or down A parameter towards given futureA_ and futureTime_\\n     * Checks if the change is too rapid, and commits the new A value only when it falls under\\n     * the limit range.\\n     * @param self Swap struct to update\\n     * @param futureA_ the new A to ramp towards\\n     * @param futureTime_ timestamp when the new A should be reached\\n     */\\n    function rampA(\\n        SwapUtils.Swap storage self,\\n        uint256 futureA_,\\n        uint256 futureTime_\\n    ) external {\\n        require(\\n            block.timestamp >= self.initialATime.add(1 days),\\n            \\\"Wait 1 day before starting ramp\\\"\\n        );\\n        require(\\n            futureTime_ >= block.timestamp.add(MIN_RAMP_TIME),\\n            \\\"Insufficient ramp time\\\"\\n        );\\n        require(\\n            futureA_ > 0 && futureA_ < MAX_A,\\n            \\\"futureA_ must be > 0 and < MAX_A\\\"\\n        );\\n\\n        uint256 initialAPrecise = _getAPrecise(self);\\n        uint256 futureAPrecise = futureA_.mul(A_PRECISION);\\n\\n        if (futureAPrecise < initialAPrecise) {\\n            require(\\n                futureAPrecise.mul(MAX_A_CHANGE) >= initialAPrecise,\\n                \\\"futureA_ is too small\\\"\\n            );\\n        } else {\\n            require(\\n                futureAPrecise <= initialAPrecise.mul(MAX_A_CHANGE),\\n                \\\"futureA_ is too large\\\"\\n            );\\n        }\\n\\n        self.initialA = initialAPrecise;\\n        self.futureA = futureAPrecise;\\n        self.initialATime = block.timestamp;\\n        self.futureATime = futureTime_;\\n\\n        emit RampA(\\n            initialAPrecise,\\n            futureAPrecise,\\n            block.timestamp,\\n            futureTime_\\n        );\\n    }\\n\\n    /**\\n     * @notice Stops ramping A immediately. Once this function is called, rampA()\\n     * cannot be called for another 24 hours\\n     * @param self Swap struct to update\\n     */\\n    function stopRampA(SwapUtils.Swap storage self) external {\\n        require(self.futureATime > block.timestamp, \\\"Ramp is already stopped\\\");\\n\\n        uint256 currentA = _getAPrecise(self);\\n        self.initialA = currentA;\\n        self.futureA = currentA;\\n        self.initialATime = block.timestamp;\\n        self.futureATime = block.timestamp;\\n\\n        emit StopRampA(currentA, block.timestamp);\\n    }\\n}\\n\",\"keccak256\":\"0x454f7c599a980fc449ff0f21dee10922262193134ea709f3be50c9d44a7d5385\",\"license\":\"MIT\"},\"contracts/LPToken.sol\":{\"content\":\"// SPDX-License-Identifier: MIT\\n\\npragma solidity 0.6.12;\\n\\nimport \\\"@openzeppelin/contracts-upgradeable/token/ERC20/ERC20BurnableUpgradeable.sol\\\";\\nimport \\\"@openzeppelin/contracts-upgradeable/access/OwnableUpgradeable.sol\\\";\\nimport \\\"./interfaces/ISwap.sol\\\";\\n\\n/**\\n * @title Liquidity Provider Token\\n * @notice This token is an ERC20 detailed token with added capability to be minted by the owner.\\n * It is used to represent user's shares when providing liquidity to swap contracts.\\n * @dev Only Swap contracts should initialize and own LPToken contracts.\\n */\\ncontract LPToken is ERC20BurnableUpgradeable, OwnableUpgradeable {\\n    using SafeMathUpgradeable for uint256;\\n\\n    /**\\n     * @notice Initializes this LPToken contract with the given name and symbol\\n     * @dev The caller of this function will become the owner. A Swap contract should call this\\n     * in its initializer function.\\n     * @param name name of this token\\n     * @param symbol symbol of this token\\n     */\\n    function initialize(string memory name, string memory symbol)\\n        external\\n        initializer\\n        returns (bool)\\n    {\\n        __Context_init_unchained();\\n        __ERC20_init_unchained(name, symbol);\\n        __Ownable_init_unchained();\\n        return true;\\n    }\\n\\n    /**\\n     * @notice Mints the given amount of LPToken to the recipient.\\n     * @dev only owner can call this mint function\\n     * @param recipient address of account to receive the tokens\\n     * @param amount amount of tokens to mint\\n     */\\n    function mint(address recipient, uint256 amount) external onlyOwner {\\n        require(amount != 0, \\\"LPToken: cannot mint 0\\\");\\n        _mint(recipient, amount);\\n    }\\n\\n    /**\\n     * @dev Overrides ERC20._beforeTokenTransfer() which get called on every transfers including\\n     * minting and burning. This ensures that Swap.updateUserWithdrawFees are called everytime.\\n     * This assumes the owner is set to a Swap contract's address.\\n     */\\n    function _beforeTokenTransfer(\\n        address from,\\n        address to,\\n        uint256 amount\\n    ) internal virtual override(ERC20Upgradeable) {\\n        super._beforeTokenTransfer(from, to, amount);\\n        require(to != address(this), \\\"LPToken: cannot send to itself\\\");\\n    }\\n}\\n\",\"keccak256\":\"0x8b16a37e14fd2d387dac20bf1773522b7667402f27a4b301617b928d7b998ac5\",\"license\":\"MIT\"},\"contracts/MathUtils.sol\":{\"content\":\"// SPDX-License-Identifier: MIT\\n\\npragma solidity 0.6.12;\\n\\nimport \\\"@openzeppelin/contracts/math/SafeMath.sol\\\";\\n\\n/**\\n * @title MathUtils library\\n * @notice A library to be used in conjunction with SafeMath. Contains functions for calculating\\n * differences between two uint256.\\n */\\nlibrary MathUtils {\\n    /**\\n     * @notice Compares a and b and returns true if the difference between a and b\\n     *         is less than 1 or equal to each other.\\n     * @param a uint256 to compare with\\n     * @param b uint256 to compare with\\n     * @return True if the difference between a and b is less than 1 or equal,\\n     *         otherwise return false\\n     */\\n    function within1(uint256 a, uint256 b) internal pure returns (bool) {\\n        return (difference(a, b) <= 1);\\n    }\\n\\n    /**\\n     * @notice Calculates absolute difference between a and b\\n     * @param a uint256 to compare with\\n     * @param b uint256 to compare with\\n     * @return Difference between a and b\\n     */\\n    function difference(uint256 a, uint256 b) internal pure returns (uint256) {\\n        if (a > b) {\\n            return a - b;\\n        }\\n        return b - a;\\n    }\\n}\\n\",\"keccak256\":\"0x455c798b26b679dff11a4ad5d52f7fef85c42d403bd430da443948f65cf000a0\",\"license\":\"MIT\"},\"contracts/SwapUtils.sol\":{\"content\":\"// SPDX-License-Identifier: MIT\\n\\npragma solidity 0.6.12;\\n\\nimport \\\"@openzeppelin/contracts/math/SafeMath.sol\\\";\\nimport \\\"@openzeppelin/contracts/token/ERC20/SafeERC20.sol\\\";\\nimport \\\"./AmplificationUtils.sol\\\";\\nimport \\\"./LPToken.sol\\\";\\nimport \\\"./MathUtils.sol\\\";\\n\\n/**\\n * @title SwapUtils library\\n * @notice A library to be used within Swap.sol. Contains functions responsible for custody and AMM functionalities.\\n * @dev Contracts relying on this library must initialize SwapUtils.Swap struct then use this library\\n * for SwapUtils.Swap struct. Note that this library contains both functions called by users and admins.\\n * Admin functions should be protected within contracts using this library.\\n */\\nlibrary SwapUtils {\\n    using SafeERC20 for IERC20;\\n    using SafeMath for uint256;\\n    using MathUtils for uint256;\\n\\n    /*** EVENTS ***/\\n\\n    event TokenSwap(\\n        address indexed buyer,\\n        uint256 tokensSold,\\n        uint256 tokensBought,\\n        uint128 soldId,\\n        uint128 boughtId\\n    );\\n    event AddLiquidity(\\n        address indexed provider,\\n        uint256[] tokenAmounts,\\n        uint256[] fees,\\n        uint256 invariant,\\n        uint256 lpTokenSupply\\n    );\\n    event RemoveLiquidity(\\n        address indexed provider,\\n        uint256[] tokenAmounts,\\n        uint256 lpTokenSupply\\n    );\\n    event RemoveLiquidityOne(\\n        address indexed provider,\\n        uint256 lpTokenAmount,\\n        uint256 lpTokenSupply,\\n        uint256 boughtId,\\n        uint256 tokensBought\\n    );\\n    event RemoveLiquidityImbalance(\\n        address indexed provider,\\n        uint256[] tokenAmounts,\\n        uint256[] fees,\\n        uint256 invariant,\\n        uint256 lpTokenSupply\\n    );\\n    event NewAdminFee(uint256 newAdminFee);\\n    event NewSwapFee(uint256 newSwapFee);\\n\\n    struct Swap {\\n        // variables around the ramp management of A,\\n        // the amplification coefficient * n * (n - 1)\\n        // see https://www.curve.fi/stableswap-paper.pdf for details\\n        uint256 initialA;\\n        uint256 futureA;\\n        uint256 initialATime;\\n        uint256 futureATime;\\n        // fee calculation\\n        uint256 swapFee;\\n        uint256 adminFee;\\n        LPToken lpToken;\\n        // contract references for all tokens being pooled\\n        IERC20[] pooledTokens;\\n        // multipliers for each pooled token's precision to get to POOL_PRECISION_DECIMALS\\n        // for example, TBTC has 18 decimals, so the multiplier should be 1. WBTC\\n        // has 8, so the multiplier should be 10 ** 18 / 10 ** 8 => 10 ** 10\\n        uint256[] tokenPrecisionMultipliers;\\n        // the pool balance of each token, in the token's precision\\n        // the contract's actual token balance might differ\\n        uint256[] balances;\\n    }\\n\\n    // Struct storing variables used in calculations in the\\n    // calculateWithdrawOneTokenDY function to avoid stack too deep errors\\n    struct CalculateWithdrawOneTokenDYInfo {\\n        uint256 d0;\\n        uint256 d1;\\n        uint256 newY;\\n        uint256 feePerToken;\\n        uint256 preciseA;\\n    }\\n\\n    // Struct storing variables used in calculations in the\\n    // {add,remove}Liquidity functions to avoid stack too deep errors\\n    struct ManageLiquidityInfo {\\n        uint256 d0;\\n        uint256 d1;\\n        uint256 d2;\\n        uint256 preciseA;\\n        LPToken lpToken;\\n        uint256 totalSupply;\\n        uint256[] balances;\\n        uint256[] multipliers;\\n    }\\n\\n    // the precision all pools tokens will be converted to\\n    uint8 public constant POOL_PRECISION_DECIMALS = 18;\\n\\n    // the denominator used to calculate admin and LP fees. For example, an\\n    // LP fee might be something like tradeAmount.mul(fee).div(FEE_DENOMINATOR)\\n    uint256 private constant FEE_DENOMINATOR = 10**10;\\n\\n    // Max swap fee is 1% or 100bps of each swap\\n    uint256 public constant MAX_SWAP_FEE = 10**8;\\n\\n    // Max adminFee is 100% of the swapFee\\n    // adminFee does not add additional fee on top of swapFee\\n    // Instead it takes a certain % of the swapFee. Therefore it has no impact on the\\n    // users but only on the earnings of LPs\\n    uint256 public constant MAX_ADMIN_FEE = 10**10;\\n\\n    // Constant value used as max loop limit\\n    uint256 private constant MAX_LOOP_LIMIT = 256;\\n\\n    /*** VIEW & PURE FUNCTIONS ***/\\n\\n    function _getAPrecise(Swap storage self) internal view returns (uint256) {\\n        return AmplificationUtils._getAPrecise(self);\\n    }\\n\\n    /**\\n     * @notice Calculate the dy, the amount of selected token that user receives and\\n     * the fee of withdrawing in one token\\n     * @param tokenAmount the amount to withdraw in the pool's precision\\n     * @param tokenIndex which token will be withdrawn\\n     * @param self Swap struct to read from\\n     * @return the amount of token user will receive\\n     */\\n    function calculateWithdrawOneToken(\\n        Swap storage self,\\n        uint256 tokenAmount,\\n        uint8 tokenIndex\\n    ) external view returns (uint256) {\\n        (uint256 availableTokenAmount, ) = _calculateWithdrawOneToken(\\n            self,\\n            tokenAmount,\\n            tokenIndex,\\n            self.lpToken.totalSupply()\\n        );\\n        return availableTokenAmount;\\n    }\\n\\n    function _calculateWithdrawOneToken(\\n        Swap storage self,\\n        uint256 tokenAmount,\\n        uint8 tokenIndex,\\n        uint256 totalSupply\\n    ) internal view returns (uint256, uint256) {\\n        uint256 dy;\\n        uint256 newY;\\n        uint256 currentY;\\n\\n        (dy, newY, currentY) = calculateWithdrawOneTokenDY(\\n            self,\\n            tokenIndex,\\n            tokenAmount,\\n            totalSupply\\n        );\\n\\n        // dy_0 (without fees)\\n        // dy, dy_0 - dy\\n\\n        uint256 dySwapFee = currentY\\n            .sub(newY)\\n            .div(self.tokenPrecisionMultipliers[tokenIndex])\\n            .sub(dy);\\n\\n        return (dy, dySwapFee);\\n    }\\n\\n    /**\\n     * @notice Calculate the dy of withdrawing in one token\\n     * @param self Swap struct to read from\\n     * @param tokenIndex which token will be withdrawn\\n     * @param tokenAmount the amount to withdraw in the pools precision\\n     * @return the d and the new y after withdrawing one token\\n     */\\n    function calculateWithdrawOneTokenDY(\\n        Swap storage self,\\n        uint8 tokenIndex,\\n        uint256 tokenAmount,\\n        uint256 totalSupply\\n    )\\n        internal\\n        view\\n        returns (\\n            uint256,\\n            uint256,\\n            uint256\\n        )\\n    {\\n        // Get the current D, then solve the stableswap invariant\\n        // y_i for D - tokenAmount\\n        uint256[] memory xp = _xp(self);\\n\\n        require(tokenIndex < xp.length, \\\"Token index out of range\\\");\\n\\n        CalculateWithdrawOneTokenDYInfo\\n            memory v = CalculateWithdrawOneTokenDYInfo(0, 0, 0, 0, 0);\\n        v.preciseA = _getAPrecise(self);\\n        v.d0 = getD(xp, v.preciseA);\\n        v.d1 = v.d0.sub(tokenAmount.mul(v.d0).div(totalSupply));\\n\\n        require(tokenAmount <= xp[tokenIndex], \\\"Withdraw exceeds available\\\");\\n\\n        v.newY = getYD(v.preciseA, tokenIndex, xp, v.d1);\\n\\n        uint256[] memory xpReduced = new uint256[](xp.length);\\n\\n        v.feePerToken = _feePerToken(self.swapFee, xp.length);\\n        for (uint256 i = 0; i < xp.length; i++) {\\n            uint256 xpi = xp[i];\\n            // if i == tokenIndex, dxExpected = xp[i] * d1 / d0 - newY\\n            // else dxExpected = xp[i] - (xp[i] * d1 / d0)\\n            // xpReduced[i] -= dxExpected * fee / FEE_DENOMINATOR\\n            xpReduced[i] = xpi.sub(\\n                (\\n                    (i == tokenIndex)\\n                        ? xpi.mul(v.d1).div(v.d0).sub(v.newY)\\n                        : xpi.sub(xpi.mul(v.d1).div(v.d0))\\n                ).mul(v.feePerToken).div(FEE_DENOMINATOR)\\n            );\\n        }\\n\\n        uint256 dy = xpReduced[tokenIndex].sub(\\n            getYD(v.preciseA, tokenIndex, xpReduced, v.d1)\\n        );\\n        dy = dy.sub(1).div(self.tokenPrecisionMultipliers[tokenIndex]);\\n\\n        return (dy, v.newY, xp[tokenIndex]);\\n    }\\n\\n    /**\\n     * @notice Calculate the price of a token in the pool with given\\n     * precision-adjusted balances and a particular D.\\n     *\\n     * @dev This is accomplished via solving the invariant iteratively.\\n     * See the StableSwap paper and Curve.fi implementation for further details.\\n     *\\n     * x_1**2 + x1 * (sum' - (A*n**n - 1) * D / (A * n**n)) = D ** (n + 1) / (n ** (2 * n) * prod' * A)\\n     * x_1**2 + b*x_1 = c\\n     * x_1 = (x_1**2 + c) / (2*x_1 + b)\\n     *\\n     * @param a the amplification coefficient * n * (n - 1). See the StableSwap paper for details.\\n     * @param tokenIndex Index of token we are calculating for.\\n     * @param xp a precision-adjusted set of pool balances. Array should be\\n     * the same cardinality as the pool.\\n     * @param d the stableswap invariant\\n     * @return the price of the token, in the same precision as in xp\\n     */\\n    function getYD(\\n        uint256 a,\\n        uint8 tokenIndex,\\n        uint256[] memory xp,\\n        uint256 d\\n    ) internal pure returns (uint256) {\\n        uint256 numTokens = xp.length;\\n        require(tokenIndex < numTokens, \\\"Token not found\\\");\\n\\n        uint256 c = d;\\n        uint256 s;\\n        uint256 nA = a.mul(numTokens);\\n\\n        for (uint256 i = 0; i < numTokens; i++) {\\n            if (i != tokenIndex) {\\n                s = s.add(xp[i]);\\n                c = c.mul(d).div(xp[i].mul(numTokens));\\n                // If we were to protect the division loss we would have to keep the denominator separate\\n                // and divide at the end. However this leads to overflow with large numTokens or/and D.\\n                // c = c * D * D * D * ... overflow!\\n            }\\n        }\\n        c = c.mul(d).mul(AmplificationUtils.A_PRECISION).div(nA.mul(numTokens));\\n\\n        uint256 b = s.add(d.mul(AmplificationUtils.A_PRECISION).div(nA));\\n        uint256 yPrev;\\n        uint256 y = d;\\n        for (uint256 i = 0; i < MAX_LOOP_LIMIT; i++) {\\n            yPrev = y;\\n            y = y.mul(y).add(c).div(y.mul(2).add(b).sub(d));\\n            if (y.within1(yPrev)) {\\n                return y;\\n            }\\n        }\\n        revert(\\\"Approximation did not converge\\\");\\n    }\\n\\n    /**\\n     * @notice Get D, the StableSwap invariant, based on a set of balances and a particular A.\\n     * @param xp a precision-adjusted set of pool balances. Array should be the same cardinality\\n     * as the pool.\\n     * @param a the amplification coefficient * n * (n - 1) in A_PRECISION.\\n     * See the StableSwap paper for details\\n     * @return the invariant, at the precision of the pool\\n     */\\n    function getD(uint256[] memory xp, uint256 a)\\n        internal\\n        pure\\n        returns (uint256)\\n    {\\n        uint256 numTokens = xp.length;\\n        uint256 s;\\n        for (uint256 i = 0; i < numTokens; i++) {\\n            s = s.add(xp[i]);\\n        }\\n        if (s == 0) {\\n            return 0;\\n        }\\n\\n        uint256 prevD;\\n        uint256 d = s;\\n        uint256 nA = a.mul(numTokens);\\n\\n        for (uint256 i = 0; i < MAX_LOOP_LIMIT; i++) {\\n            uint256 dP = d;\\n            for (uint256 j = 0; j < numTokens; j++) {\\n                dP = dP.mul(d).div(xp[j].mul(numTokens));\\n                // If we were to protect the division loss we would have to keep the denominator separate\\n                // and divide at the end. However this leads to overflow with large numTokens or/and D.\\n                // dP = dP * D * D * D * ... overflow!\\n            }\\n            prevD = d;\\n            d = nA\\n                .mul(s)\\n                .div(AmplificationUtils.A_PRECISION)\\n                .add(dP.mul(numTokens))\\n                .mul(d)\\n                .div(\\n                    nA\\n                        .sub(AmplificationUtils.A_PRECISION)\\n                        .mul(d)\\n                        .div(AmplificationUtils.A_PRECISION)\\n                        .add(numTokens.add(1).mul(dP))\\n                );\\n            if (d.within1(prevD)) {\\n                return d;\\n            }\\n        }\\n\\n        // Convergence should occur in 4 loops or less. If this is reached, there may be something wrong\\n        // with the pool. If this were to occur repeatedly, LPs should withdraw via `removeLiquidity()`\\n        // function which does not rely on D.\\n        revert(\\\"D does not converge\\\");\\n    }\\n\\n    /**\\n     * @notice Given a set of balances and precision multipliers, return the\\n     * precision-adjusted balances.\\n     *\\n     * @param balances an array of token balances, in their native precisions.\\n     * These should generally correspond with pooled tokens.\\n     *\\n     * @param precisionMultipliers an array of multipliers, corresponding to\\n     * the amounts in the balances array. When multiplied together they\\n     * should yield amounts at the pool's precision.\\n     *\\n     * @return an array of amounts \\\"scaled\\\" to the pool's precision\\n     */\\n    function _xp(\\n        uint256[] memory balances,\\n        uint256[] memory precisionMultipliers\\n    ) internal pure returns (uint256[] memory) {\\n        uint256 numTokens = balances.length;\\n        require(\\n            numTokens == precisionMultipliers.length,\\n            \\\"Balances must match multipliers\\\"\\n        );\\n        uint256[] memory xp = new uint256[](numTokens);\\n        for (uint256 i = 0; i < numTokens; i++) {\\n            xp[i] = balances[i].mul(precisionMultipliers[i]);\\n        }\\n        return xp;\\n    }\\n\\n    /**\\n     * @notice Return the precision-adjusted balances of all tokens in the pool\\n     * @param self Swap struct to read from\\n     * @return the pool balances \\\"scaled\\\" to the pool's precision, allowing\\n     * them to be more easily compared.\\n     */\\n    function _xp(Swap storage self) internal view returns (uint256[] memory) {\\n        return _xp(self.balances, self.tokenPrecisionMultipliers);\\n    }\\n\\n    /**\\n     * @notice Get the virtual price, to help calculate profit\\n     * @param self Swap struct to read from\\n     * @return the virtual price, scaled to precision of POOL_PRECISION_DECIMALS\\n     */\\n    function getVirtualPrice(Swap storage self)\\n        external\\n        view\\n        returns (uint256)\\n    {\\n        uint256 d = getD(_xp(self), _getAPrecise(self));\\n        LPToken lpToken = self.lpToken;\\n        uint256 supply = lpToken.totalSupply();\\n        if (supply > 0) {\\n            return d.mul(10**uint256(POOL_PRECISION_DECIMALS)).div(supply);\\n        }\\n        return 0;\\n    }\\n\\n    /**\\n     * @notice Calculate the new balances of the tokens given the indexes of the token\\n     * that is swapped from (FROM) and the token that is swapped to (TO).\\n     * This function is used as a helper function to calculate how much TO token\\n     * the user should receive on swap.\\n     *\\n     * @param preciseA precise form of amplification coefficient\\n     * @param tokenIndexFrom index of FROM token\\n     * @param tokenIndexTo index of TO token\\n     * @param x the new total amount of FROM token\\n     * @param xp balances of the tokens in the pool\\n     * @return the amount of TO token that should remain in the pool\\n     */\\n    function getY(\\n        uint256 preciseA,\\n        uint8 tokenIndexFrom,\\n        uint8 tokenIndexTo,\\n        uint256 x,\\n        uint256[] memory xp\\n    ) internal pure returns (uint256) {\\n        uint256 numTokens = xp.length;\\n        require(\\n            tokenIndexFrom != tokenIndexTo,\\n            \\\"Can't compare token to itself\\\"\\n        );\\n        require(\\n            tokenIndexFrom < numTokens && tokenIndexTo < numTokens,\\n            \\\"Tokens must be in pool\\\"\\n        );\\n\\n        uint256 d = getD(xp, preciseA);\\n        uint256 c = d;\\n        uint256 s;\\n        uint256 nA = numTokens.mul(preciseA);\\n\\n        uint256 _x;\\n        for (uint256 i = 0; i < numTokens; i++) {\\n            if (i == tokenIndexFrom) {\\n                _x = x;\\n            } else if (i != tokenIndexTo) {\\n                _x = xp[i];\\n            } else {\\n                continue;\\n            }\\n            s = s.add(_x);\\n            c = c.mul(d).div(_x.mul(numTokens));\\n            // If we were to protect the division loss we would have to keep the denominator separate\\n            // and divide at the end. However this leads to overflow with large numTokens or/and D.\\n            // c = c * D * D * D * ... overflow!\\n        }\\n        c = c.mul(d).mul(AmplificationUtils.A_PRECISION).div(nA.mul(numTokens));\\n        uint256 b = s.add(d.mul(AmplificationUtils.A_PRECISION).div(nA));\\n        uint256 yPrev;\\n        uint256 y = d;\\n\\n        // iterative approximation\\n        for (uint256 i = 0; i < MAX_LOOP_LIMIT; i++) {\\n            yPrev = y;\\n            y = y.mul(y).add(c).div(y.mul(2).add(b).sub(d));\\n            if (y.within1(yPrev)) {\\n                return y;\\n            }\\n        }\\n        revert(\\\"Approximation did not converge\\\");\\n    }\\n\\n    /**\\n     * @notice Externally calculates a swap between two tokens.\\n     * @param self Swap struct to read from\\n     * @param tokenIndexFrom the token to sell\\n     * @param tokenIndexTo the token to buy\\n     * @param dx the number of tokens to sell. If the token charges a fee on transfers,\\n     * use the amount that gets transferred after the fee.\\n     * @return dy the number of tokens the user will get\\n     */\\n    function calculateSwap(\\n        Swap storage self,\\n        uint8 tokenIndexFrom,\\n        uint8 tokenIndexTo,\\n        uint256 dx\\n    ) external view returns (uint256 dy) {\\n        (dy, ) = _calculateSwap(\\n            self,\\n            tokenIndexFrom,\\n            tokenIndexTo,\\n            dx,\\n            self.balances\\n        );\\n    }\\n\\n    /**\\n     * @notice Internally calculates a swap between two tokens.\\n     *\\n     * @dev The caller is expected to transfer the actual amounts (dx and dy)\\n     * using the token contracts.\\n     *\\n     * @param self Swap struct to read from\\n     * @param tokenIndexFrom the token to sell\\n     * @param tokenIndexTo the token to buy\\n     * @param dx the number of tokens to sell. If the token charges a fee on transfers,\\n     * use the amount that gets transferred after the fee.\\n     * @return dy the number of tokens the user will get\\n     * @return dyFee the associated fee\\n     */\\n    function _calculateSwap(\\n        Swap storage self,\\n        uint8 tokenIndexFrom,\\n        uint8 tokenIndexTo,\\n        uint256 dx,\\n        uint256[] memory balances\\n    ) internal view returns (uint256 dy, uint256 dyFee) {\\n        uint256[] memory multipliers = self.tokenPrecisionMultipliers;\\n        uint256[] memory xp = _xp(balances, multipliers);\\n        require(\\n            tokenIndexFrom < xp.length && tokenIndexTo < xp.length,\\n            \\\"Token index out of range\\\"\\n        );\\n        uint256 x = dx.mul(multipliers[tokenIndexFrom]).add(xp[tokenIndexFrom]);\\n        uint256 y = getY(\\n            _getAPrecise(self),\\n            tokenIndexFrom,\\n            tokenIndexTo,\\n            x,\\n            xp\\n        );\\n        dy = xp[tokenIndexTo].sub(y).sub(1);\\n        dyFee = dy.mul(self.swapFee).div(FEE_DENOMINATOR);\\n        dy = dy.sub(dyFee).div(multipliers[tokenIndexTo]);\\n    }\\n\\n    /**\\n     * @notice A simple method to calculate amount of each underlying\\n     * tokens that is returned upon burning given amount of\\n     * LP tokens\\n     *\\n     * @param amount the amount of LP tokens that would to be burned on\\n     * withdrawal\\n     * @return array of amounts of tokens user will receive\\n     */\\n    function calculateRemoveLiquidity(Swap storage self, uint256 amount)\\n        external\\n        view\\n        returns (uint256[] memory)\\n    {\\n        return\\n            _calculateRemoveLiquidity(\\n                self.balances,\\n                amount,\\n                self.lpToken.totalSupply()\\n            );\\n    }\\n\\n    function _calculateRemoveLiquidity(\\n        uint256[] memory balances,\\n        uint256 amount,\\n        uint256 totalSupply\\n    ) internal pure returns (uint256[] memory) {\\n        require(amount <= totalSupply, \\\"Cannot exceed total supply\\\");\\n\\n        uint256[] memory amounts = new uint256[](balances.length);\\n\\n        for (uint256 i = 0; i < balances.length; i++) {\\n            amounts[i] = balances[i].mul(amount).div(totalSupply);\\n        }\\n        return amounts;\\n    }\\n\\n    /**\\n     * @notice A simple method to calculate prices from deposits or\\n     * withdrawals, excluding fees but including slippage. This is\\n     * helpful as an input into the various \\\"min\\\" parameters on calls\\n     * to fight front-running\\n     *\\n     * @dev This shouldn't be used outside frontends for user estimates.\\n     *\\n     * @param self Swap struct to read from\\n     * @param amounts an array of token amounts to deposit or withdrawal,\\n     * corresponding to pooledTokens. The amount should be in each\\n     * pooled token's native precision. If a token charges a fee on transfers,\\n     * use the amount that gets transferred after the fee.\\n     * @param deposit whether this is a deposit or a withdrawal\\n     * @return if deposit was true, total amount of lp token that will be minted and if\\n     * deposit was false, total amount of lp token that will be burned\\n     */\\n    function calculateTokenAmount(\\n        Swap storage self,\\n        uint256[] calldata amounts,\\n        bool deposit\\n    ) external view returns (uint256) {\\n        uint256 a = _getAPrecise(self);\\n        uint256[] memory balances = self.balances;\\n        uint256[] memory multipliers = self.tokenPrecisionMultipliers;\\n\\n        uint256 d0 = getD(_xp(balances, multipliers), a);\\n        for (uint256 i = 0; i < balances.length; i++) {\\n            if (deposit) {\\n                balances[i] = balances[i].add(amounts[i]);\\n            } else {\\n                balances[i] = balances[i].sub(\\n                    amounts[i],\\n                    \\\"Cannot withdraw more than available\\\"\\n                );\\n            }\\n        }\\n        uint256 d1 = getD(_xp(balances, multipliers), a);\\n        uint256 totalSupply = self.lpToken.totalSupply();\\n\\n        if (deposit) {\\n            return d1.sub(d0).mul(totalSupply).div(d0);\\n        } else {\\n            return d0.sub(d1).mul(totalSupply).div(d0);\\n        }\\n    }\\n\\n    /**\\n     * @notice return accumulated amount of admin fees of the token with given index\\n     * @param self Swap struct to read from\\n     * @param index Index of the pooled token\\n     * @return admin balance in the token's precision\\n     */\\n    function getAdminBalance(Swap storage self, uint256 index)\\n        external\\n        view\\n        returns (uint256)\\n    {\\n        require(index < self.pooledTokens.length, \\\"Token index out of range\\\");\\n        return\\n            self.pooledTokens[index].balanceOf(address(this)).sub(\\n                self.balances[index]\\n            );\\n    }\\n\\n    /**\\n     * @notice internal helper function to calculate fee per token multiplier used in\\n     * swap fee calculations\\n     * @param swapFee swap fee for the tokens\\n     * @param numTokens number of tokens pooled\\n     */\\n    function _feePerToken(uint256 swapFee, uint256 numTokens)\\n        internal\\n        pure\\n        returns (uint256)\\n    {\\n        return swapFee.mul(numTokens).div(numTokens.sub(1).mul(4));\\n    }\\n\\n    /*** STATE MODIFYING FUNCTIONS ***/\\n\\n    /**\\n     * @notice swap two tokens in the pool\\n     * @param self Swap struct to read from and write to\\n     * @param tokenIndexFrom the token the user wants to sell\\n     * @param tokenIndexTo the token the user wants to buy\\n     * @param dx the amount of tokens the user wants to sell\\n     * @param minDy the min amount the user would like to receive, or revert.\\n     * @return amount of token user received on swap\\n     */\\n    function swap(\\n        Swap storage self,\\n        uint8 tokenIndexFrom,\\n        uint8 tokenIndexTo,\\n        uint256 dx,\\n        uint256 minDy\\n    ) external returns (uint256) {\\n        {\\n            IERC20 tokenFrom = self.pooledTokens[tokenIndexFrom];\\n            require(\\n                dx <= tokenFrom.balanceOf(msg.sender),\\n                \\\"Cannot swap more than you own\\\"\\n            );\\n            // Transfer tokens first to see if a fee was charged on transfer\\n            uint256 beforeBalance = tokenFrom.balanceOf(address(this));\\n            tokenFrom.safeTransferFrom(msg.sender, address(this), dx);\\n\\n            // Use the actual transferred amount for AMM math\\n            dx = tokenFrom.balanceOf(address(this)).sub(beforeBalance);\\n        }\\n\\n        uint256 dy;\\n        uint256 dyFee;\\n        uint256[] memory balances = self.balances;\\n        (dy, dyFee) = _calculateSwap(\\n            self,\\n            tokenIndexFrom,\\n            tokenIndexTo,\\n            dx,\\n            balances\\n        );\\n        require(dy >= minDy, \\\"Swap didn't result in min tokens\\\");\\n\\n        uint256 dyAdminFee = dyFee.mul(self.adminFee).div(FEE_DENOMINATOR).div(\\n            self.tokenPrecisionMultipliers[tokenIndexTo]\\n        );\\n\\n        self.balances[tokenIndexFrom] = balances[tokenIndexFrom].add(dx);\\n        self.balances[tokenIndexTo] = balances[tokenIndexTo].sub(dy).sub(\\n            dyAdminFee\\n        );\\n\\n        self.pooledTokens[tokenIndexTo].safeTransfer(msg.sender, dy);\\n\\n        emit TokenSwap(msg.sender, dx, dy, tokenIndexFrom, tokenIndexTo);\\n\\n        return dy;\\n    }\\n\\n    /**\\n     * @notice Add liquidity to the pool\\n     * @param self Swap struct to read from and write to\\n     * @param amounts the amounts of each token to add, in their native precision\\n     * @param minToMint the minimum LP tokens adding this amount of liquidity\\n     * should mint, otherwise revert. Handy for front-running mitigation\\n     * allowed addresses. If the pool is not in the guarded launch phase, this parameter will be ignored.\\n     * @return amount of LP token user received\\n     */\\n    function addLiquidity(\\n        Swap storage self,\\n        uint256[] memory amounts,\\n        uint256 minToMint\\n    ) external returns (uint256) {\\n        IERC20[] memory pooledTokens = self.pooledTokens;\\n        require(\\n            amounts.length == pooledTokens.length,\\n            \\\"Amounts must match pooled tokens\\\"\\n        );\\n\\n        // current state\\n        ManageLiquidityInfo memory v = ManageLiquidityInfo(\\n            0,\\n            0,\\n            0,\\n            _getAPrecise(self),\\n            self.lpToken,\\n            0,\\n            self.balances,\\n            self.tokenPrecisionMultipliers\\n        );\\n        v.totalSupply = v.lpToken.totalSupply();\\n\\n        if (v.totalSupply != 0) {\\n            v.d0 = getD(_xp(v.balances, v.multipliers), v.preciseA);\\n        }\\n\\n        uint256[] memory newBalances = new uint256[](pooledTokens.length);\\n\\n        for (uint256 i = 0; i < pooledTokens.length; i++) {\\n            require(\\n                v.totalSupply != 0 || amounts[i] > 0,\\n                \\\"Must supply all tokens in pool\\\"\\n            );\\n\\n            // Transfer tokens first to see if a fee was charged on transfer\\n            if (amounts[i] != 0) {\\n                uint256 beforeBalance = pooledTokens[i].balanceOf(\\n                    address(this)\\n                );\\n                pooledTokens[i].safeTransferFrom(\\n                    msg.sender,\\n                    address(this),\\n                    amounts[i]\\n                );\\n\\n                // Update the amounts[] with actual transfer amount\\n                amounts[i] = pooledTokens[i].balanceOf(address(this)).sub(\\n                    beforeBalance\\n                );\\n            }\\n\\n            newBalances[i] = v.balances[i].add(amounts[i]);\\n        }\\n\\n        // invariant after change\\n        v.d1 = getD(_xp(newBalances, v.multipliers), v.preciseA);\\n        require(v.d1 > v.d0, \\\"D should increase\\\");\\n\\n        // updated to reflect fees and calculate the user's LP tokens\\n        v.d2 = v.d1;\\n        uint256[] memory fees = new uint256[](pooledTokens.length);\\n\\n        if (v.totalSupply != 0) {\\n            uint256 feePerToken = _feePerToken(\\n                self.swapFee,\\n                pooledTokens.length\\n            );\\n            for (uint256 i = 0; i < pooledTokens.length; i++) {\\n                uint256 idealBalance = v.d1.mul(v.balances[i]).div(v.d0);\\n                fees[i] = feePerToken\\n                    .mul(idealBalance.difference(newBalances[i]))\\n                    .div(FEE_DENOMINATOR);\\n                self.balances[i] = newBalances[i].sub(\\n                    fees[i].mul(self.adminFee).div(FEE_DENOMINATOR)\\n                );\\n                newBalances[i] = newBalances[i].sub(fees[i]);\\n            }\\n            v.d2 = getD(_xp(newBalances, v.multipliers), v.preciseA);\\n        } else {\\n            // the initial depositor doesn't pay fees\\n            self.balances = newBalances;\\n        }\\n\\n        uint256 toMint;\\n        if (v.totalSupply == 0) {\\n            toMint = v.d1;\\n        } else {\\n            toMint = v.d2.sub(v.d0).mul(v.totalSupply).div(v.d0);\\n        }\\n\\n        require(toMint >= minToMint, \\\"Couldn't mint min requested\\\");\\n\\n        // mint the user's LP tokens\\n        v.lpToken.mint(msg.sender, toMint);\\n\\n        emit AddLiquidity(\\n            msg.sender,\\n            amounts,\\n            fees,\\n            v.d1,\\n            v.totalSupply.add(toMint)\\n        );\\n\\n        return toMint;\\n    }\\n\\n    /**\\n     * @notice Burn LP tokens to remove liquidity from the pool.\\n     * @dev Liquidity can always be removed, even when the pool is paused.\\n     * @param self Swap struct to read from and write to\\n     * @param amount the amount of LP tokens to burn\\n     * @param minAmounts the minimum amounts of each token in the pool\\n     * acceptable for this burn. Useful as a front-running mitigation\\n     * @return amounts of tokens the user received\\n     */\\n    function removeLiquidity(\\n        Swap storage self,\\n        uint256 amount,\\n        uint256[] calldata minAmounts\\n    ) external returns (uint256[] memory) {\\n        LPToken lpToken = self.lpToken;\\n        IERC20[] memory pooledTokens = self.pooledTokens;\\n        require(amount <= lpToken.balanceOf(msg.sender), \\\">LP.balanceOf\\\");\\n        require(\\n            minAmounts.length == pooledTokens.length,\\n            \\\"minAmounts must match poolTokens\\\"\\n        );\\n\\n        uint256[] memory balances = self.balances;\\n        uint256 totalSupply = lpToken.totalSupply();\\n\\n        uint256[] memory amounts = _calculateRemoveLiquidity(\\n            balances,\\n            amount,\\n            totalSupply\\n        );\\n\\n        for (uint256 i = 0; i < amounts.length; i++) {\\n            require(amounts[i] >= minAmounts[i], \\\"amounts[i] < minAmounts[i]\\\");\\n            self.balances[i] = balances[i].sub(amounts[i]);\\n            pooledTokens[i].safeTransfer(msg.sender, amounts[i]);\\n        }\\n\\n        lpToken.burnFrom(msg.sender, amount);\\n\\n        emit RemoveLiquidity(msg.sender, amounts, totalSupply.sub(amount));\\n\\n        return amounts;\\n    }\\n\\n    /**\\n     * @notice Remove liquidity from the pool all in one token.\\n     * @param self Swap struct to read from and write to\\n     * @param tokenAmount the amount of the lp tokens to burn\\n     * @param tokenIndex the index of the token you want to receive\\n     * @param minAmount the minimum amount to withdraw, otherwise revert\\n     * @return amount chosen token that user received\\n     */\\n    function removeLiquidityOneToken(\\n        Swap storage self,\\n        uint256 tokenAmount,\\n        uint8 tokenIndex,\\n        uint256 minAmount\\n    ) external returns (uint256) {\\n        LPToken lpToken = self.lpToken;\\n        IERC20[] memory pooledTokens = self.pooledTokens;\\n\\n        require(tokenAmount <= lpToken.balanceOf(msg.sender), \\\">LP.balanceOf\\\");\\n        require(tokenIndex < pooledTokens.length, \\\"Token not found\\\");\\n\\n        uint256 totalSupply = lpToken.totalSupply();\\n\\n        (uint256 dy, uint256 dyFee) = _calculateWithdrawOneToken(\\n            self,\\n            tokenAmount,\\n            tokenIndex,\\n            totalSupply\\n        );\\n\\n        require(dy >= minAmount, \\\"dy < minAmount\\\");\\n\\n        self.balances[tokenIndex] = self.balances[tokenIndex].sub(\\n            dy.add(dyFee.mul(self.adminFee).div(FEE_DENOMINATOR))\\n        );\\n        lpToken.burnFrom(msg.sender, tokenAmount);\\n        pooledTokens[tokenIndex].safeTransfer(msg.sender, dy);\\n\\n        emit RemoveLiquidityOne(\\n            msg.sender,\\n            tokenAmount,\\n            totalSupply,\\n            tokenIndex,\\n            dy\\n        );\\n\\n        return dy;\\n    }\\n\\n    /**\\n     * @notice Remove liquidity from the pool, weighted differently than the\\n     * pool's current balances.\\n     *\\n     * @param self Swap struct to read from and write to\\n     * @param amounts how much of each token to withdraw\\n     * @param maxBurnAmount the max LP token provider is willing to pay to\\n     * remove liquidity. Useful as a front-running mitigation.\\n     * @return actual amount of LP tokens burned in the withdrawal\\n     */\\n    function removeLiquidityImbalance(\\n        Swap storage self,\\n        uint256[] memory amounts,\\n        uint256 maxBurnAmount\\n    ) public returns (uint256) {\\n        ManageLiquidityInfo memory v = ManageLiquidityInfo(\\n            0,\\n            0,\\n            0,\\n            _getAPrecise(self),\\n            self.lpToken,\\n            0,\\n            self.balances,\\n            self.tokenPrecisionMultipliers\\n        );\\n        v.totalSupply = v.lpToken.totalSupply();\\n\\n        IERC20[] memory pooledTokens = self.pooledTokens;\\n\\n        require(\\n            amounts.length == pooledTokens.length,\\n            \\\"Amounts should match pool tokens\\\"\\n        );\\n\\n        require(\\n            maxBurnAmount <= v.lpToken.balanceOf(msg.sender) &&\\n                maxBurnAmount != 0,\\n            \\\">LP.balanceOf\\\"\\n        );\\n\\n        uint256 feePerToken = _feePerToken(self.swapFee, pooledTokens.length);\\n        uint256[] memory fees = new uint256[](pooledTokens.length);\\n        {\\n            uint256[] memory balances1 = new uint256[](pooledTokens.length);\\n            v.d0 = getD(_xp(v.balances, v.multipliers), v.preciseA);\\n            for (uint256 i = 0; i < pooledTokens.length; i++) {\\n                balances1[i] = v.balances[i].sub(\\n                    amounts[i],\\n                    \\\"Cannot withdraw more than available\\\"\\n                );\\n            }\\n            v.d1 = getD(_xp(balances1, v.multipliers), v.preciseA);\\n\\n            for (uint256 i = 0; i < pooledTokens.length; i++) {\\n                uint256 idealBalance = v.d1.mul(v.balances[i]).div(v.d0);\\n                uint256 difference = idealBalance.difference(balances1[i]);\\n                fees[i] = feePerToken.mul(difference).div(FEE_DENOMINATOR);\\n                self.balances[i] = balances1[i].sub(\\n                    fees[i].mul(self.adminFee).div(FEE_DENOMINATOR)\\n                );\\n                balances1[i] = balances1[i].sub(fees[i]);\\n            }\\n\\n            v.d2 = getD(_xp(balances1, v.multipliers), v.preciseA);\\n        }\\n        uint256 tokenAmount = v.d0.sub(v.d2).mul(v.totalSupply).div(v.d0);\\n        require(tokenAmount != 0, \\\"Burnt amount cannot be zero\\\");\\n        tokenAmount = tokenAmount.add(1);\\n\\n        require(tokenAmount <= maxBurnAmount, \\\"tokenAmount > maxBurnAmount\\\");\\n\\n        v.lpToken.burnFrom(msg.sender, tokenAmount);\\n\\n        for (uint256 i = 0; i < pooledTokens.length; i++) {\\n            pooledTokens[i].safeTransfer(msg.sender, amounts[i]);\\n        }\\n\\n        emit RemoveLiquidityImbalance(\\n            msg.sender,\\n            amounts,\\n            fees,\\n            v.d1,\\n            v.totalSupply.sub(tokenAmount)\\n        );\\n\\n        return tokenAmount;\\n    }\\n\\n    /**\\n     * @notice withdraw all admin fees to a given address\\n     * @param self Swap struct to withdraw fees from\\n     * @param to Address to send the fees to\\n     */\\n    function withdrawAdminFees(Swap storage self, address to) external {\\n        IERC20[] memory pooledTokens = self.pooledTokens;\\n        for (uint256 i = 0; i < pooledTokens.length; i++) {\\n            IERC20 token = pooledTokens[i];\\n            uint256 balance = token.balanceOf(address(this)).sub(\\n                self.balances[i]\\n            );\\n            if (balance != 0) {\\n                token.safeTransfer(to, balance);\\n            }\\n        }\\n    }\\n\\n    /**\\n     * @notice Sets the admin fee\\n     * @dev adminFee cannot be higher than 100% of the swap fee\\n     * @param self Swap struct to update\\n     * @param newAdminFee new admin fee to be applied on future transactions\\n     */\\n    function setAdminFee(Swap storage self, uint256 newAdminFee) external {\\n        require(newAdminFee <= MAX_ADMIN_FEE, \\\"Fee is too high\\\");\\n        self.adminFee = newAdminFee;\\n\\n        emit NewAdminFee(newAdminFee);\\n    }\\n\\n    /**\\n     * @notice update the swap fee\\n     * @dev fee cannot be higher than 1% of each swap\\n     * @param self Swap struct to update\\n     * @param newSwapFee new swap fee to be applied on future transactions\\n     */\\n    function setSwapFee(Swap storage self, uint256 newSwapFee) external {\\n        require(newSwapFee <= MAX_SWAP_FEE, \\\"Fee is too high\\\");\\n        self.swapFee = newSwapFee;\\n\\n        emit NewSwapFee(newSwapFee);\\n    }\\n}\\n\",\"keccak256\":\"0x1571bb987f110239e647da76403b6a73b7a46a082035dc950ddc9db26eb0fbed\",\"license\":\"MIT\"},\"contracts/interfaces/IAllowlist.sol\":{\"content\":\"// SPDX-License-Identifier: MIT\\n\\npragma solidity 0.6.12;\\n\\ninterface IAllowlist {\\n    function getPoolAccountLimit(address poolAddress)\\n        external\\n        view\\n        returns (uint256);\\n\\n    function getPoolCap(address poolAddress) external view returns (uint256);\\n\\n    function verifyAddress(address account, bytes32[] calldata merkleProof)\\n        external\\n        returns (bool);\\n}\\n\",\"keccak256\":\"0xf55e4d678d05bc5d0e24ec5f24504d7437b885e19579f9d29152748c3c1c732e\",\"license\":\"MIT\"},\"contracts/interfaces/ISwap.sol\":{\"content\":\"// SPDX-License-Identifier: MIT\\n\\npragma solidity 0.6.12;\\n\\nimport \\\"@openzeppelin/contracts/token/ERC20/ERC20.sol\\\";\\nimport \\\"./IAllowlist.sol\\\";\\n\\ninterface ISwap {\\n    // pool data view functions\\n    function getA() external view returns (uint256);\\n\\n    function getAPrecise() external view returns (uint256);\\n\\n    function getAllowlist() external view returns (IAllowlist);\\n\\n    function getToken(uint8 index) external view returns (IERC20);\\n\\n    function getTokenIndex(address tokenAddress) external view returns (uint8);\\n\\n    function getTokenBalance(uint8 index) external view returns (uint256);\\n\\n    function getVirtualPrice() external view returns (uint256);\\n\\n    function owner() external view returns (address);\\n\\n    function isGuarded() external view returns (bool);\\n\\n    function paused() external view returns (bool);\\n\\n    function swapStorage()\\n        external\\n        view\\n        returns (\\n            uint256,\\n            uint256,\\n            uint256,\\n            uint256,\\n            uint256,\\n            uint256,\\n            address\\n        );\\n\\n    // min return calculation functions\\n    function calculateSwap(\\n        uint8 tokenIndexFrom,\\n        uint8 tokenIndexTo,\\n        uint256 dx\\n    ) external view returns (uint256);\\n\\n    function calculateTokenAmount(uint256[] calldata amounts, bool deposit)\\n        external\\n        view\\n        returns (uint256);\\n\\n    function calculateRemoveLiquidity(uint256 amount)\\n        external\\n        view\\n        returns (uint256[] memory);\\n\\n    function calculateRemoveLiquidityOneToken(\\n        uint256 tokenAmount,\\n        uint8 tokenIndex\\n    ) external view returns (uint256 availableTokenAmount);\\n\\n    // state modifying functions\\n    function initialize(\\n        IERC20[] memory pooledTokens,\\n        uint8[] memory decimals,\\n        string memory lpTokenName,\\n        string memory lpTokenSymbol,\\n        uint256 a,\\n        uint256 fee,\\n        uint256 adminFee,\\n        address lpTokenTargetAddress\\n    ) external;\\n\\n    function swap(\\n        uint8 tokenIndexFrom,\\n        uint8 tokenIndexTo,\\n        uint256 dx,\\n        uint256 minDy,\\n        uint256 deadline\\n    ) external returns (uint256);\\n\\n    function addLiquidity(\\n        uint256[] calldata amounts,\\n        uint256 minToMint,\\n        uint256 deadline\\n    ) external returns (uint256);\\n\\n    function removeLiquidity(\\n        uint256 amount,\\n        uint256[] calldata minAmounts,\\n        uint256 deadline\\n    ) external returns (uint256[] memory);\\n\\n    function removeLiquidityOneToken(\\n        uint256 tokenAmount,\\n        uint8 tokenIndex,\\n        uint256 minAmount,\\n        uint256 deadline\\n    ) external returns (uint256);\\n\\n    function removeLiquidityImbalance(\\n        uint256[] calldata amounts,\\n        uint256 maxBurnAmount,\\n        uint256 deadline\\n    ) external returns (uint256);\\n}\\n\",\"keccak256\":\"0xcd26195c5e3824e7984750a05c9fcb6dde3e266022c3bd1a9dcdda9e967a6f4c\",\"license\":\"MIT\"},\"contracts/meta/MetaSwapUtils.sol\":{\"content\":\"// SPDX-License-Identifier: MIT\\n\\npragma solidity 0.6.12;\\n\\nimport \\\"@openzeppelin/contracts/math/SafeMath.sol\\\";\\nimport \\\"@openzeppelin/contracts/token/ERC20/SafeERC20.sol\\\";\\nimport \\\"../LPToken.sol\\\";\\nimport \\\"../interfaces/ISwap.sol\\\";\\nimport \\\"../MathUtils.sol\\\";\\nimport \\\"../SwapUtils.sol\\\";\\n\\n/**\\n * @title MetaSwapUtils library\\n * @notice A library to be used within MetaSwap.sol. Contains functions responsible for custody and AMM functionalities.\\n *\\n * MetaSwap is a modified version of Swap that allows Swap's LP token to be utilized in pooling with other tokens.\\n * As an example, if there is a Swap pool consisting of [DAI, USDC, USDT]. Then a MetaSwap pool can be created\\n * with [sUSD, BaseSwapLPToken] to allow trades between either the LP token or the underlying tokens and sUSD.\\n *\\n * @dev Contracts relying on this library must initialize SwapUtils.Swap struct then use this library\\n * for SwapUtils.Swap struct. Note that this library contains both functions called by users and admins.\\n * Admin functions should be protected within contracts using this library.\\n */\\nlibrary MetaSwapUtils {\\n    using SafeERC20 for IERC20;\\n    using SafeMath for uint256;\\n    using MathUtils for uint256;\\n    using AmplificationUtils for SwapUtils.Swap;\\n\\n    /*** EVENTS ***/\\n\\n    event TokenSwap(\\n        address indexed buyer,\\n        uint256 tokensSold,\\n        uint256 tokensBought,\\n        uint128 soldId,\\n        uint128 boughtId\\n    );\\n    event TokenSwapUnderlying(\\n        address indexed buyer,\\n        uint256 tokensSold,\\n        uint256 tokensBought,\\n        uint128 soldId,\\n        uint128 boughtId\\n    );\\n    event AddLiquidity(\\n        address indexed provider,\\n        uint256[] tokenAmounts,\\n        uint256[] fees,\\n        uint256 invariant,\\n        uint256 lpTokenSupply\\n    );\\n    event RemoveLiquidityOne(\\n        address indexed provider,\\n        uint256 lpTokenAmount,\\n        uint256 lpTokenSupply,\\n        uint256 boughtId,\\n        uint256 tokensBought\\n    );\\n    event RemoveLiquidityImbalance(\\n        address indexed provider,\\n        uint256[] tokenAmounts,\\n        uint256[] fees,\\n        uint256 invariant,\\n        uint256 lpTokenSupply\\n    );\\n    event NewAdminFee(uint256 newAdminFee);\\n    event NewSwapFee(uint256 newSwapFee);\\n    event NewWithdrawFee(uint256 newWithdrawFee);\\n\\n    struct MetaSwap {\\n        // Meta-Swap related parameters\\n        ISwap baseSwap;\\n        uint256 baseVirtualPrice;\\n        uint256 baseCacheLastUpdated;\\n        IERC20[] baseTokens;\\n    }\\n\\n    // Struct storing variables used in calculations in the\\n    // calculateWithdrawOneTokenDY function to avoid stack too deep errors\\n    struct CalculateWithdrawOneTokenDYInfo {\\n        uint256 d0;\\n        uint256 d1;\\n        uint256 newY;\\n        uint256 feePerToken;\\n        uint256 preciseA;\\n        uint256 xpi;\\n    }\\n\\n    // Struct storing variables used in calculation in removeLiquidityImbalance function\\n    // to avoid stack too deep error\\n    struct ManageLiquidityInfo {\\n        uint256 d0;\\n        uint256 d1;\\n        uint256 d2;\\n        LPToken lpToken;\\n        uint256 totalSupply;\\n        uint256 preciseA;\\n        uint256 baseVirtualPrice;\\n        uint256[] tokenPrecisionMultipliers;\\n        uint256[] newBalances;\\n    }\\n\\n    struct SwapUnderlyingInfo {\\n        uint256 x;\\n        uint256 dx;\\n        uint256 dy;\\n        uint256[] tokenPrecisionMultipliers;\\n        uint256[] oldBalances;\\n        IERC20[] baseTokens;\\n        IERC20 tokenFrom;\\n        uint8 metaIndexFrom;\\n        IERC20 tokenTo;\\n        uint8 metaIndexTo;\\n        uint256 baseVirtualPrice;\\n    }\\n\\n    struct CalculateSwapUnderlyingInfo {\\n        uint256 baseVirtualPrice;\\n        ISwap baseSwap;\\n        uint8 baseLPTokenIndex;\\n        uint8 baseTokensLength;\\n        uint8 metaIndexTo;\\n        uint256 x;\\n        uint256 dy;\\n    }\\n\\n    // the denominator used to calculate admin and LP fees. For example, an\\n    // LP fee might be something like tradeAmount.mul(fee).div(FEE_DENOMINATOR)\\n    uint256 private constant FEE_DENOMINATOR = 10**10;\\n\\n    // Cache expire time for the stored value of base Swap's virtual price\\n    uint256 public constant BASE_CACHE_EXPIRE_TIME = 10 minutes;\\n    uint256 public constant BASE_VIRTUAL_PRICE_PRECISION = 10**18;\\n\\n    /*** VIEW & PURE FUNCTIONS ***/\\n\\n    /**\\n     * @notice Return the stored value of base Swap's virtual price. If\\n     * value was updated past BASE_CACHE_EXPIRE_TIME, then read it directly\\n     * from the base Swap contract.\\n     * @param metaSwapStorage MetaSwap struct to read from\\n     * @return base Swap's virtual price\\n     */\\n    function _getBaseVirtualPrice(MetaSwap storage metaSwapStorage)\\n        internal\\n        view\\n        returns (uint256)\\n    {\\n        if (\\n            block.timestamp >\\n            metaSwapStorage.baseCacheLastUpdated + BASE_CACHE_EXPIRE_TIME\\n        ) {\\n            return metaSwapStorage.baseSwap.getVirtualPrice();\\n        }\\n        return metaSwapStorage.baseVirtualPrice;\\n    }\\n\\n    function _getBaseSwapFee(ISwap baseSwap)\\n        internal\\n        view\\n        returns (uint256 swapFee)\\n    {\\n        (, , , , swapFee, , ) = baseSwap.swapStorage();\\n    }\\n\\n    /**\\n     * @notice Calculate how much the user would receive when withdrawing via single token\\n     * @param self Swap struct to read from\\n     * @param metaSwapStorage MetaSwap struct to read from\\n     * @param tokenAmount the amount to withdraw in the pool's precision\\n     * @param tokenIndex which token will be withdrawn\\n     * @return dy the amount of token user will receive\\n     */\\n    function calculateWithdrawOneToken(\\n        SwapUtils.Swap storage self,\\n        MetaSwap storage metaSwapStorage,\\n        uint256 tokenAmount,\\n        uint8 tokenIndex\\n    ) external view returns (uint256 dy) {\\n        (dy, ) = _calculateWithdrawOneToken(\\n            self,\\n            tokenAmount,\\n            tokenIndex,\\n            _getBaseVirtualPrice(metaSwapStorage),\\n            self.lpToken.totalSupply()\\n        );\\n    }\\n\\n    function _calculateWithdrawOneToken(\\n        SwapUtils.Swap storage self,\\n        uint256 tokenAmount,\\n        uint8 tokenIndex,\\n        uint256 baseVirtualPrice,\\n        uint256 totalSupply\\n    ) internal view returns (uint256, uint256) {\\n        uint256 dy;\\n        uint256 dySwapFee;\\n\\n        {\\n            uint256 currentY;\\n            uint256 newY;\\n\\n            // Calculate how much to withdraw\\n            (dy, newY, currentY) = _calculateWithdrawOneTokenDY(\\n                self,\\n                tokenIndex,\\n                tokenAmount,\\n                baseVirtualPrice,\\n                totalSupply\\n            );\\n\\n            // Calculate the associated swap fee\\n            dySwapFee = currentY\\n                .sub(newY)\\n                .div(self.tokenPrecisionMultipliers[tokenIndex])\\n                .sub(dy);\\n        }\\n\\n        return (dy, dySwapFee);\\n    }\\n\\n    /**\\n     * @notice Calculate the dy of withdrawing in one token\\n     * @param self Swap struct to read from\\n     * @param tokenIndex which token will be withdrawn\\n     * @param tokenAmount the amount to withdraw in the pools precision\\n     * @param baseVirtualPrice the virtual price of the base swap's LP token\\n     * @return the dy excluding swap fee, the new y after withdrawing one token, and current y\\n     */\\n    function _calculateWithdrawOneTokenDY(\\n        SwapUtils.Swap storage self,\\n        uint8 tokenIndex,\\n        uint256 tokenAmount,\\n        uint256 baseVirtualPrice,\\n        uint256 totalSupply\\n    )\\n        internal\\n        view\\n        returns (\\n            uint256,\\n            uint256,\\n            uint256\\n        )\\n    {\\n        // Get the current D, then solve the stableswap invariant\\n        // y_i for D - tokenAmount\\n        uint256[] memory xp = _xp(self, baseVirtualPrice);\\n        require(tokenIndex < xp.length, \\\"Token index out of range\\\");\\n\\n        CalculateWithdrawOneTokenDYInfo\\n            memory v = CalculateWithdrawOneTokenDYInfo(\\n                0,\\n                0,\\n                0,\\n                0,\\n                self._getAPrecise(),\\n                0\\n            );\\n        v.d0 = SwapUtils.getD(xp, v.preciseA);\\n        v.d1 = v.d0.sub(tokenAmount.mul(v.d0).div(totalSupply));\\n\\n        require(tokenAmount <= xp[tokenIndex], \\\"Withdraw exceeds available\\\");\\n\\n        v.newY = SwapUtils.getYD(v.preciseA, tokenIndex, xp, v.d1);\\n\\n        uint256[] memory xpReduced = new uint256[](xp.length);\\n\\n        v.feePerToken = SwapUtils._feePerToken(self.swapFee, xp.length);\\n        for (uint256 i = 0; i < xp.length; i++) {\\n            v.xpi = xp[i];\\n            // if i == tokenIndex, dxExpected = xp[i] * d1 / d0 - newY\\n            // else dxExpected = xp[i] - (xp[i] * d1 / d0)\\n            // xpReduced[i] -= dxExpected * fee / FEE_DENOMINATOR\\n            xpReduced[i] = v.xpi.sub(\\n                (\\n                    (i == tokenIndex)\\n                        ? v.xpi.mul(v.d1).div(v.d0).sub(v.newY)\\n                        : v.xpi.sub(v.xpi.mul(v.d1).div(v.d0))\\n                ).mul(v.feePerToken).div(FEE_DENOMINATOR)\\n            );\\n        }\\n\\n        uint256 dy = xpReduced[tokenIndex].sub(\\n            SwapUtils.getYD(v.preciseA, tokenIndex, xpReduced, v.d1)\\n        );\\n\\n        if (tokenIndex == xp.length.sub(1)) {\\n            dy = dy.mul(BASE_VIRTUAL_PRICE_PRECISION).div(baseVirtualPrice);\\n            v.newY = v.newY.mul(BASE_VIRTUAL_PRICE_PRECISION).div(\\n                baseVirtualPrice\\n            );\\n            xp[tokenIndex] = xp[tokenIndex]\\n                .mul(BASE_VIRTUAL_PRICE_PRECISION)\\n                .div(baseVirtualPrice);\\n        }\\n        dy = dy.sub(1).div(self.tokenPrecisionMultipliers[tokenIndex]);\\n\\n        return (dy, v.newY, xp[tokenIndex]);\\n    }\\n\\n    /**\\n     * @notice Given a set of balances and precision multipliers, return the\\n     * precision-adjusted balances. The last element will also get scaled up by\\n     * the given baseVirtualPrice.\\n     *\\n     * @param balances an array of token balances, in their native precisions.\\n     * These should generally correspond with pooled tokens.\\n     *\\n     * @param precisionMultipliers an array of multipliers, corresponding to\\n     * the amounts in the balances array. When multiplied together they\\n     * should yield amounts at the pool's precision.\\n     *\\n     * @param baseVirtualPrice the base virtual price to scale the balance of the\\n     * base Swap's LP token.\\n     *\\n     * @return an array of amounts \\\"scaled\\\" to the pool's precision\\n     */\\n    function _xp(\\n        uint256[] memory balances,\\n        uint256[] memory precisionMultipliers,\\n        uint256 baseVirtualPrice\\n    ) internal pure returns (uint256[] memory) {\\n        uint256[] memory xp = SwapUtils._xp(balances, precisionMultipliers);\\n        uint256 baseLPTokenIndex = balances.length.sub(1);\\n        xp[baseLPTokenIndex] = xp[baseLPTokenIndex].mul(baseVirtualPrice).div(\\n            BASE_VIRTUAL_PRICE_PRECISION\\n        );\\n        return xp;\\n    }\\n\\n    /**\\n     * @notice Return the precision-adjusted balances of all tokens in the pool\\n     * @param self Swap struct to read from\\n     * @return the pool balances \\\"scaled\\\" to the pool's precision, allowing\\n     * them to be more easily compared.\\n     */\\n    function _xp(SwapUtils.Swap storage self, uint256 baseVirtualPrice)\\n        internal\\n        view\\n        returns (uint256[] memory)\\n    {\\n        return\\n            _xp(\\n                self.balances,\\n                self.tokenPrecisionMultipliers,\\n                baseVirtualPrice\\n            );\\n    }\\n\\n    /**\\n     * @notice Get the virtual price, to help calculate profit\\n     * @param self Swap struct to read from\\n     * @param metaSwapStorage MetaSwap struct to read from\\n     * @return the virtual price, scaled to precision of BASE_VIRTUAL_PRICE_PRECISION\\n     */\\n    function getVirtualPrice(\\n        SwapUtils.Swap storage self,\\n        MetaSwap storage metaSwapStorage\\n    ) external view returns (uint256) {\\n        uint256 d = SwapUtils.getD(\\n            _xp(\\n                self.balances,\\n                self.tokenPrecisionMultipliers,\\n                _getBaseVirtualPrice(metaSwapStorage)\\n            ),\\n            self._getAPrecise()\\n        );\\n        uint256 supply = self.lpToken.totalSupply();\\n        if (supply != 0) {\\n            return d.mul(BASE_VIRTUAL_PRICE_PRECISION).div(supply);\\n        }\\n        return 0;\\n    }\\n\\n    /**\\n     * @notice Externally calculates a swap between two tokens. The SwapUtils.Swap storage and\\n     * MetaSwap storage should be from the same MetaSwap contract.\\n     * @param self Swap struct to read from\\n     * @param metaSwapStorage MetaSwap struct from the same contract\\n     * @param tokenIndexFrom the token to sell\\n     * @param tokenIndexTo the token to buy\\n     * @param dx the number of tokens to sell. If the token charges a fee on transfers,\\n     * use the amount that gets transferred after the fee.\\n     * @return dy the number of tokens the user will get\\n     */\\n    function calculateSwap(\\n        SwapUtils.Swap storage self,\\n        MetaSwap storage metaSwapStorage,\\n        uint8 tokenIndexFrom,\\n        uint8 tokenIndexTo,\\n        uint256 dx\\n    ) external view returns (uint256 dy) {\\n        (dy, ) = _calculateSwap(\\n            self,\\n            tokenIndexFrom,\\n            tokenIndexTo,\\n            dx,\\n            _getBaseVirtualPrice(metaSwapStorage)\\n        );\\n    }\\n\\n    /**\\n     * @notice Internally calculates a swap between two tokens.\\n     *\\n     * @dev The caller is expected to transfer the actual amounts (dx and dy)\\n     * using the token contracts.\\n     *\\n     * @param self Swap struct to read from\\n     * @param tokenIndexFrom the token to sell\\n     * @param tokenIndexTo the token to buy\\n     * @param dx the number of tokens to sell. If the token charges a fee on transfers,\\n     * use the amount that gets transferred after the fee.\\n     * @param baseVirtualPrice the virtual price of the base LP token\\n     * @return dy the number of tokens the user will get and dyFee the associated fee\\n     */\\n    function _calculateSwap(\\n        SwapUtils.Swap storage self,\\n        uint8 tokenIndexFrom,\\n        uint8 tokenIndexTo,\\n        uint256 dx,\\n        uint256 baseVirtualPrice\\n    ) internal view returns (uint256 dy, uint256 dyFee) {\\n        uint256[] memory xp = _xp(self, baseVirtualPrice);\\n        require(\\n            tokenIndexFrom < xp.length && tokenIndexTo < xp.length,\\n            \\\"Token index out of range\\\"\\n        );\\n        uint256 baseLPTokenIndex = xp.length.sub(1);\\n\\n        uint256 x = dx.mul(self.tokenPrecisionMultipliers[tokenIndexFrom]);\\n        if (tokenIndexFrom == baseLPTokenIndex) {\\n            // When swapping from a base Swap token, scale up dx by its virtual price\\n            x = x.mul(baseVirtualPrice).div(BASE_VIRTUAL_PRICE_PRECISION);\\n        }\\n        x = x.add(xp[tokenIndexFrom]);\\n\\n        uint256 y = SwapUtils.getY(\\n            self._getAPrecise(),\\n            tokenIndexFrom,\\n            tokenIndexTo,\\n            x,\\n            xp\\n        );\\n        dy = xp[tokenIndexTo].sub(y).sub(1);\\n\\n        if (tokenIndexTo == baseLPTokenIndex) {\\n            // When swapping to a base Swap token, scale down dy by its virtual price\\n            dy = dy.mul(BASE_VIRTUAL_PRICE_PRECISION).div(baseVirtualPrice);\\n        }\\n\\n        dyFee = dy.mul(self.swapFee).div(FEE_DENOMINATOR);\\n        dy = dy.sub(dyFee);\\n\\n        dy = dy.div(self.tokenPrecisionMultipliers[tokenIndexTo]);\\n    }\\n\\n    /**\\n     * @notice Calculates the expected return amount from swapping between\\n     * the pooled tokens and the underlying tokens of the base Swap pool.\\n     *\\n     * @param self Swap struct to read from\\n     * @param metaSwapStorage MetaSwap struct from the same contract\\n     * @param tokenIndexFrom the token to sell\\n     * @param tokenIndexTo the token to buy\\n     * @param dx the number of tokens to sell. If the token charges a fee on transfers,\\n     * use the amount that gets transferred after the fee.\\n     * @return dy the number of tokens the user will get\\n     */\\n    function calculateSwapUnderlying(\\n        SwapUtils.Swap storage self,\\n        MetaSwap storage metaSwapStorage,\\n        uint8 tokenIndexFrom,\\n        uint8 tokenIndexTo,\\n        uint256 dx\\n    ) external view returns (uint256) {\\n        CalculateSwapUnderlyingInfo memory v = CalculateSwapUnderlyingInfo(\\n            _getBaseVirtualPrice(metaSwapStorage),\\n            metaSwapStorage.baseSwap,\\n            0,\\n            uint8(metaSwapStorage.baseTokens.length),\\n            0,\\n            0,\\n            0\\n        );\\n\\n        uint256[] memory xp = _xp(self, v.baseVirtualPrice);\\n        v.baseLPTokenIndex = uint8(xp.length.sub(1));\\n        {\\n            uint8 maxRange = v.baseLPTokenIndex + v.baseTokensLength;\\n            require(\\n                tokenIndexFrom < maxRange && tokenIndexTo < maxRange,\\n                \\\"Token index out of range\\\"\\n            );\\n        }\\n\\n        if (tokenIndexFrom < v.baseLPTokenIndex) {\\n            // tokenFrom is from this pool\\n            v.x = xp[tokenIndexFrom].add(\\n                dx.mul(self.tokenPrecisionMultipliers[tokenIndexFrom])\\n            );\\n        } else {\\n            // tokenFrom is from the base pool\\n            tokenIndexFrom = tokenIndexFrom - v.baseLPTokenIndex;\\n            if (tokenIndexTo < v.baseLPTokenIndex) {\\n                uint256[] memory baseInputs = new uint256[](v.baseTokensLength);\\n                baseInputs[tokenIndexFrom] = dx;\\n                v.x = v\\n                    .baseSwap\\n                    .calculateTokenAmount(baseInputs, true)\\n                    .mul(v.baseVirtualPrice)\\n                    .div(BASE_VIRTUAL_PRICE_PRECISION);\\n                // when adding to the base pool,you pay approx 50% of the swap fee\\n                v.x = v\\n                    .x\\n                    .sub(\\n                        v.x.mul(_getBaseSwapFee(metaSwapStorage.baseSwap)).div(\\n                            FEE_DENOMINATOR.mul(2)\\n                        )\\n                    )\\n                    .add(xp[v.baseLPTokenIndex]);\\n            } else {\\n                // both from and to are from the base pool\\n                return\\n                    v.baseSwap.calculateSwap(\\n                        tokenIndexFrom,\\n                        tokenIndexTo - v.baseLPTokenIndex,\\n                        dx\\n                    );\\n            }\\n            tokenIndexFrom = v.baseLPTokenIndex;\\n        }\\n\\n        v.metaIndexTo = v.baseLPTokenIndex;\\n        if (tokenIndexTo < v.baseLPTokenIndex) {\\n            v.metaIndexTo = tokenIndexTo;\\n        }\\n\\n        {\\n            uint256 y = SwapUtils.getY(\\n                self._getAPrecise(),\\n                tokenIndexFrom,\\n                v.metaIndexTo,\\n                v.x,\\n                xp\\n            );\\n            v.dy = xp[v.metaIndexTo].sub(y).sub(1);\\n            uint256 dyFee = v.dy.mul(self.swapFee).div(FEE_DENOMINATOR);\\n            v.dy = v.dy.sub(dyFee);\\n        }\\n\\n        if (tokenIndexTo < v.baseLPTokenIndex) {\\n            // tokenTo is from this pool\\n            v.dy = v.dy.div(self.tokenPrecisionMultipliers[v.metaIndexTo]);\\n        } else {\\n            // tokenTo is from the base pool\\n            v.dy = v.baseSwap.calculateRemoveLiquidityOneToken(\\n                v.dy.mul(BASE_VIRTUAL_PRICE_PRECISION).div(v.baseVirtualPrice),\\n                tokenIndexTo - v.baseLPTokenIndex\\n            );\\n        }\\n\\n        return v.dy;\\n    }\\n\\n    /**\\n     * @notice A simple method to calculate prices from deposits or\\n     * withdrawals, excluding fees but including slippage. This is\\n     * helpful as an input into the various \\\"min\\\" parameters on calls\\n     * to fight front-running\\n     *\\n     * @dev This shouldn't be used outside frontends for user estimates.\\n     *\\n     * @param self Swap struct to read from\\n     * @param metaSwapStorage MetaSwap struct to read from\\n     * @param amounts an array of token amounts to deposit or withdrawal,\\n     * corresponding to pooledTokens. The amount should be in each\\n     * pooled token's native precision. If a token charges a fee on transfers,\\n     * use the amount that gets transferred after the fee.\\n     * @param deposit whether this is a deposit or a withdrawal\\n     * @return if deposit was true, total amount of lp token that will be minted and if\\n     * deposit was false, total amount of lp token that will be burned\\n     */\\n    function calculateTokenAmount(\\n        SwapUtils.Swap storage self,\\n        MetaSwap storage metaSwapStorage,\\n        uint256[] calldata amounts,\\n        bool deposit\\n    ) external view returns (uint256) {\\n        uint256 a = self._getAPrecise();\\n        uint256 d0;\\n        uint256 d1;\\n        {\\n            uint256 baseVirtualPrice = _getBaseVirtualPrice(metaSwapStorage);\\n            uint256[] memory balances1 = self.balances;\\n            uint256[] memory tokenPrecisionMultipliers = self\\n                .tokenPrecisionMultipliers;\\n            uint256 numTokens = balances1.length;\\n            d0 = SwapUtils.getD(\\n                _xp(balances1, tokenPrecisionMultipliers, baseVirtualPrice),\\n                a\\n            );\\n            for (uint256 i = 0; i < numTokens; i++) {\\n                if (deposit) {\\n                    balances1[i] = balances1[i].add(amounts[i]);\\n                } else {\\n                    balances1[i] = balances1[i].sub(\\n                        amounts[i],\\n                        \\\"Cannot withdraw more than available\\\"\\n                    );\\n                }\\n            }\\n            d1 = SwapUtils.getD(\\n                _xp(balances1, tokenPrecisionMultipliers, baseVirtualPrice),\\n                a\\n            );\\n        }\\n        uint256 totalSupply = self.lpToken.totalSupply();\\n\\n        if (deposit) {\\n            return d1.sub(d0).mul(totalSupply).div(d0);\\n        } else {\\n            return d0.sub(d1).mul(totalSupply).div(d0);\\n        }\\n    }\\n\\n    /*** STATE MODIFYING FUNCTIONS ***/\\n\\n    /**\\n     * @notice swap two tokens in the pool\\n     * @param self Swap struct to read from and write to\\n     * @param metaSwapStorage MetaSwap struct to read from and write to\\n     * @param tokenIndexFrom the token the user wants to sell\\n     * @param tokenIndexTo the token the user wants to buy\\n     * @param dx the amount of tokens the user wants to sell\\n     * @param minDy the min amount the user would like to receive, or revert.\\n     * @return amount of token user received on swap\\n     */\\n    function swap(\\n        SwapUtils.Swap storage self,\\n        MetaSwap storage metaSwapStorage,\\n        uint8 tokenIndexFrom,\\n        uint8 tokenIndexTo,\\n        uint256 dx,\\n        uint256 minDy\\n    ) external returns (uint256) {\\n        {\\n            uint256 pooledTokensLength = self.pooledTokens.length;\\n            require(\\n                tokenIndexFrom < pooledTokensLength &&\\n                    tokenIndexTo < pooledTokensLength,\\n                \\\"Token index is out of range\\\"\\n            );\\n        }\\n\\n        uint256 transferredDx;\\n        {\\n            IERC20 tokenFrom = self.pooledTokens[tokenIndexFrom];\\n            require(\\n                dx <= tokenFrom.balanceOf(msg.sender),\\n                \\\"Cannot swap more than you own\\\"\\n            );\\n\\n            {\\n                // Transfer tokens first to see if a fee was charged on transfer\\n                uint256 beforeBalance = tokenFrom.balanceOf(address(this));\\n                tokenFrom.safeTransferFrom(msg.sender, address(this), dx);\\n\\n                // Use the actual transferred amount for AMM math\\n                transferredDx = tokenFrom.balanceOf(address(this)).sub(\\n                    beforeBalance\\n                );\\n            }\\n        }\\n\\n        (uint256 dy, uint256 dyFee) = _calculateSwap(\\n            self,\\n            tokenIndexFrom,\\n            tokenIndexTo,\\n            transferredDx,\\n            _updateBaseVirtualPrice(metaSwapStorage)\\n        );\\n        require(dy >= minDy, \\\"Swap didn't result in min tokens\\\");\\n\\n        uint256 dyAdminFee = dyFee.mul(self.adminFee).div(FEE_DENOMINATOR).div(\\n            self.tokenPrecisionMultipliers[tokenIndexTo]\\n        );\\n\\n        self.balances[tokenIndexFrom] = self.balances[tokenIndexFrom].add(\\n            transferredDx\\n        );\\n        self.balances[tokenIndexTo] = self.balances[tokenIndexTo].sub(dy).sub(\\n            dyAdminFee\\n        );\\n\\n        self.pooledTokens[tokenIndexTo].safeTransfer(msg.sender, dy);\\n\\n        emit TokenSwap(\\n            msg.sender,\\n            transferredDx,\\n            dy,\\n            tokenIndexFrom,\\n            tokenIndexTo\\n        );\\n\\n        return dy;\\n    }\\n\\n    /**\\n     * @notice Swaps with the underlying tokens of the base Swap pool. For this function,\\n     * the token indices are flattened out so that underlying tokens are represented\\n     * in the indices.\\n     * @dev Since this calls multiple external functions during the execution,\\n     * it is recommended to protect any function that depends on this with reentrancy guards.\\n     * @param self Swap struct to read from and write to\\n     * @param metaSwapStorage MetaSwap struct to read from and write to\\n     * @param tokenIndexFrom the token the user wants to sell\\n     * @param tokenIndexTo the token the user wants to buy\\n     * @param dx the amount of tokens the user wants to sell\\n     * @param minDy the min amount the user would like to receive, or revert.\\n     * @return amount of token user received on swap\\n     */\\n    function swapUnderlying(\\n        SwapUtils.Swap storage self,\\n        MetaSwap storage metaSwapStorage,\\n        uint8 tokenIndexFrom,\\n        uint8 tokenIndexTo,\\n        uint256 dx,\\n        uint256 minDy\\n    ) external returns (uint256) {\\n        SwapUnderlyingInfo memory v = SwapUnderlyingInfo(\\n            0,\\n            0,\\n            0,\\n            self.tokenPrecisionMultipliers,\\n            self.balances,\\n            metaSwapStorage.baseTokens,\\n            IERC20(address(0)),\\n            0,\\n            IERC20(address(0)),\\n            0,\\n            _updateBaseVirtualPrice(metaSwapStorage)\\n        );\\n\\n        uint8 baseLPTokenIndex = uint8(v.oldBalances.length.sub(1));\\n\\n        {\\n            uint8 maxRange = uint8(baseLPTokenIndex + v.baseTokens.length);\\n            require(\\n                tokenIndexFrom < maxRange && tokenIndexTo < maxRange,\\n                \\\"Token index out of range\\\"\\n            );\\n        }\\n\\n        ISwap baseSwap = metaSwapStorage.baseSwap;\\n\\n        // Find the address of the token swapping from and the index in MetaSwap's token list\\n        if (tokenIndexFrom < baseLPTokenIndex) {\\n            v.tokenFrom = self.pooledTokens[tokenIndexFrom];\\n            v.metaIndexFrom = tokenIndexFrom;\\n        } else {\\n            v.tokenFrom = v.baseTokens[tokenIndexFrom - baseLPTokenIndex];\\n            v.metaIndexFrom = baseLPTokenIndex;\\n        }\\n\\n        // Find the address of the token swapping to and the index in MetaSwap's token list\\n        if (tokenIndexTo < baseLPTokenIndex) {\\n            v.tokenTo = self.pooledTokens[tokenIndexTo];\\n            v.metaIndexTo = tokenIndexTo;\\n        } else {\\n            v.tokenTo = v.baseTokens[tokenIndexTo - baseLPTokenIndex];\\n            v.metaIndexTo = baseLPTokenIndex;\\n        }\\n\\n        // Check for possible fee on transfer\\n        v.dx = v.tokenFrom.balanceOf(address(this));\\n        v.tokenFrom.safeTransferFrom(msg.sender, address(this), dx);\\n        v.dx = v.tokenFrom.balanceOf(address(this)).sub(v.dx); // update dx in case of fee on transfer\\n\\n        if (\\n            tokenIndexFrom < baseLPTokenIndex || tokenIndexTo < baseLPTokenIndex\\n        ) {\\n            // Either one of the tokens belongs to the MetaSwap tokens list\\n            uint256[] memory xp = _xp(\\n                v.oldBalances,\\n                v.tokenPrecisionMultipliers,\\n                v.baseVirtualPrice\\n            );\\n\\n            if (tokenIndexFrom < baseLPTokenIndex) {\\n                // Swapping from a MetaSwap token\\n                v.x = xp[tokenIndexFrom].add(\\n                    dx.mul(v.tokenPrecisionMultipliers[tokenIndexFrom])\\n                );\\n            } else {\\n                // Swapping from one of the tokens hosted in the base Swap\\n                // This case requires adding the underlying token to the base Swap, then\\n                // using the base LP token to swap to the desired token\\n                uint256[] memory baseAmounts = new uint256[](\\n                    v.baseTokens.length\\n                );\\n                baseAmounts[tokenIndexFrom - baseLPTokenIndex] = v.dx;\\n\\n                // Add liquidity to the base Swap contract and receive base LP token\\n                v.dx = baseSwap.addLiquidity(baseAmounts, 0, block.timestamp);\\n\\n                // Calculate the value of total amount of baseLPToken we end up with\\n                v.x = v\\n                    .dx\\n                    .mul(v.baseVirtualPrice)\\n                    .div(BASE_VIRTUAL_PRICE_PRECISION)\\n                    .add(xp[baseLPTokenIndex]);\\n            }\\n\\n            // Calculate how much to withdraw in MetaSwap level and the the associated swap fee\\n            uint256 dyFee;\\n            {\\n                uint256 y = SwapUtils.getY(\\n                    self._getAPrecise(),\\n                    v.metaIndexFrom,\\n                    v.metaIndexTo,\\n                    v.x,\\n                    xp\\n                );\\n                v.dy = xp[v.metaIndexTo].sub(y).sub(1);\\n                if (tokenIndexTo >= baseLPTokenIndex) {\\n                    // When swapping to a base Swap token, scale down dy by its virtual price\\n                    v.dy = v.dy.mul(BASE_VIRTUAL_PRICE_PRECISION).div(\\n                        v.baseVirtualPrice\\n                    );\\n                }\\n                dyFee = v.dy.mul(self.swapFee).div(FEE_DENOMINATOR);\\n                v.dy = v.dy.sub(dyFee).div(\\n                    v.tokenPrecisionMultipliers[v.metaIndexTo]\\n                );\\n            }\\n\\n            // Update the balances array according to the calculated input and output amount\\n            {\\n                uint256 dyAdminFee = dyFee.mul(self.adminFee).div(\\n                    FEE_DENOMINATOR\\n                );\\n                dyAdminFee = dyAdminFee.div(\\n                    v.tokenPrecisionMultipliers[v.metaIndexTo]\\n                );\\n                self.balances[v.metaIndexFrom] = v\\n                    .oldBalances[v.metaIndexFrom]\\n                    .add(v.dx);\\n                self.balances[v.metaIndexTo] = v\\n                    .oldBalances[v.metaIndexTo]\\n                    .sub(v.dy)\\n                    .sub(dyAdminFee);\\n            }\\n\\n            if (tokenIndexTo >= baseLPTokenIndex) {\\n                // When swapping to a token that belongs to the base Swap, burn the LP token\\n                // and withdraw the desired token from the base pool\\n                uint256 oldBalance = v.tokenTo.balanceOf(address(this));\\n                baseSwap.removeLiquidityOneToken(\\n                    v.dy,\\n                    tokenIndexTo - baseLPTokenIndex,\\n                    0,\\n                    block.timestamp\\n                );\\n                v.dy = v.tokenTo.balanceOf(address(this)) - oldBalance;\\n            }\\n\\n            // Check the amount of token to send meets minDy\\n            require(v.dy >= minDy, \\\"Swap didn't result in min tokens\\\");\\n        } else {\\n            // Both tokens are from the base Swap pool\\n            // Do a swap through the base Swap\\n            v.dy = v.tokenTo.balanceOf(address(this));\\n            baseSwap.swap(\\n                tokenIndexFrom - baseLPTokenIndex,\\n                tokenIndexTo - baseLPTokenIndex,\\n                v.dx,\\n                minDy,\\n                block.timestamp\\n            );\\n            v.dy = v.tokenTo.balanceOf(address(this)).sub(v.dy);\\n        }\\n\\n        // Send the desired token to the caller\\n        v.tokenTo.safeTransfer(msg.sender, v.dy);\\n\\n        emit TokenSwapUnderlying(\\n            msg.sender,\\n            dx,\\n            v.dy,\\n            tokenIndexFrom,\\n            tokenIndexTo\\n        );\\n\\n        return v.dy;\\n    }\\n\\n    /**\\n     * @notice Add liquidity to the pool\\n     * @param self Swap struct to read from and write to\\n     * @param metaSwapStorage MetaSwap struct to read from and write to\\n     * @param amounts the amounts of each token to add, in their native precision\\n     * @param minToMint the minimum LP tokens adding this amount of liquidity\\n     * should mint, otherwise revert. Handy for front-running mitigation\\n     * allowed addresses. If the pool is not in the guarded launch phase, this parameter will be ignored.\\n     * @return amount of LP token user received\\n     */\\n    function addLiquidity(\\n        SwapUtils.Swap storage self,\\n        MetaSwap storage metaSwapStorage,\\n        uint256[] memory amounts,\\n        uint256 minToMint\\n    ) external returns (uint256) {\\n        IERC20[] memory pooledTokens = self.pooledTokens;\\n        require(\\n            amounts.length == pooledTokens.length,\\n            \\\"Amounts must match pooled tokens\\\"\\n        );\\n\\n        uint256[] memory fees = new uint256[](pooledTokens.length);\\n\\n        // current state\\n        ManageLiquidityInfo memory v = ManageLiquidityInfo(\\n            0,\\n            0,\\n            0,\\n            self.lpToken,\\n            0,\\n            self._getAPrecise(),\\n            _updateBaseVirtualPrice(metaSwapStorage),\\n            self.tokenPrecisionMultipliers,\\n            self.balances\\n        );\\n        v.totalSupply = v.lpToken.totalSupply();\\n\\n        if (v.totalSupply != 0) {\\n            v.d0 = SwapUtils.getD(\\n                _xp(\\n                    v.newBalances,\\n                    v.tokenPrecisionMultipliers,\\n                    v.baseVirtualPrice\\n                ),\\n                v.preciseA\\n            );\\n        }\\n\\n        for (uint256 i = 0; i < pooledTokens.length; i++) {\\n            require(\\n                v.totalSupply != 0 || amounts[i] > 0,\\n                \\\"Must supply all tokens in pool\\\"\\n            );\\n\\n            // Transfer tokens first to see if a fee was charged on transfer\\n            if (amounts[i] != 0) {\\n                uint256 beforeBalance = pooledTokens[i].balanceOf(\\n                    address(this)\\n                );\\n                pooledTokens[i].safeTransferFrom(\\n                    msg.sender,\\n                    address(this),\\n                    amounts[i]\\n                );\\n\\n                // Update the amounts[] with actual transfer amount\\n                amounts[i] = pooledTokens[i].balanceOf(address(this)).sub(\\n                    beforeBalance\\n                );\\n            }\\n\\n            v.newBalances[i] = v.newBalances[i].add(amounts[i]);\\n        }\\n\\n        // invariant after change\\n        v.d1 = SwapUtils.getD(\\n            _xp(v.newBalances, v.tokenPrecisionMultipliers, v.baseVirtualPrice),\\n            v.preciseA\\n        );\\n        require(v.d1 > v.d0, \\\"D should increase\\\");\\n\\n        // updated to reflect fees and calculate the user's LP tokens\\n        v.d2 = v.d1;\\n        uint256 toMint;\\n\\n        if (v.totalSupply != 0) {\\n            uint256 feePerToken = SwapUtils._feePerToken(\\n                self.swapFee,\\n                pooledTokens.length\\n            );\\n            for (uint256 i = 0; i < pooledTokens.length; i++) {\\n                uint256 idealBalance = v.d1.mul(self.balances[i]).div(v.d0);\\n                fees[i] = feePerToken\\n                    .mul(idealBalance.difference(v.newBalances[i]))\\n                    .div(FEE_DENOMINATOR);\\n                self.balances[i] = v.newBalances[i].sub(\\n                    fees[i].mul(self.adminFee).div(FEE_DENOMINATOR)\\n                );\\n                v.newBalances[i] = v.newBalances[i].sub(fees[i]);\\n            }\\n            v.d2 = SwapUtils.getD(\\n                _xp(\\n                    v.newBalances,\\n                    v.tokenPrecisionMultipliers,\\n                    v.baseVirtualPrice\\n                ),\\n                v.preciseA\\n            );\\n            toMint = v.d2.sub(v.d0).mul(v.totalSupply).div(v.d0);\\n        } else {\\n            // the initial depositor doesn't pay fees\\n            self.balances = v.newBalances;\\n            toMint = v.d1;\\n        }\\n\\n        require(toMint >= minToMint, \\\"Couldn't mint min requested\\\");\\n\\n        // mint the user's LP tokens\\n        self.lpToken.mint(msg.sender, toMint);\\n\\n        emit AddLiquidity(\\n            msg.sender,\\n            amounts,\\n            fees,\\n            v.d1,\\n            v.totalSupply.add(toMint)\\n        );\\n\\n        return toMint;\\n    }\\n\\n    /**\\n     * @notice Remove liquidity from the pool all in one token.\\n     * @param self Swap struct to read from and write to\\n     * @param metaSwapStorage MetaSwap struct to read from and write to\\n     * @param tokenAmount the amount of the lp tokens to burn\\n     * @param tokenIndex the index of the token you want to receive\\n     * @param minAmount the minimum amount to withdraw, otherwise revert\\n     * @return amount chosen token that user received\\n     */\\n    function removeLiquidityOneToken(\\n        SwapUtils.Swap storage self,\\n        MetaSwap storage metaSwapStorage,\\n        uint256 tokenAmount,\\n        uint8 tokenIndex,\\n        uint256 minAmount\\n    ) external returns (uint256) {\\n        LPToken lpToken = self.lpToken;\\n        uint256 totalSupply = lpToken.totalSupply();\\n        uint256 numTokens = self.pooledTokens.length;\\n        require(tokenAmount <= lpToken.balanceOf(msg.sender), \\\">LP.balanceOf\\\");\\n        require(tokenIndex < numTokens, \\\"Token not found\\\");\\n\\n        uint256 dyFee;\\n        uint256 dy;\\n\\n        (dy, dyFee) = _calculateWithdrawOneToken(\\n            self,\\n            tokenAmount,\\n            tokenIndex,\\n            _updateBaseVirtualPrice(metaSwapStorage),\\n            totalSupply\\n        );\\n\\n        require(dy >= minAmount, \\\"dy < minAmount\\\");\\n\\n        // Update balances array\\n        self.balances[tokenIndex] = self.balances[tokenIndex].sub(\\n            dy.add(dyFee.mul(self.adminFee).div(FEE_DENOMINATOR))\\n        );\\n\\n        // Burn the associated LP token from the caller and send the desired token\\n        lpToken.burnFrom(msg.sender, tokenAmount);\\n        self.pooledTokens[tokenIndex].safeTransfer(msg.sender, dy);\\n\\n        emit RemoveLiquidityOne(\\n            msg.sender,\\n            tokenAmount,\\n            totalSupply,\\n            tokenIndex,\\n            dy\\n        );\\n\\n        return dy;\\n    }\\n\\n    /**\\n     * @notice Remove liquidity from the pool, weighted differently than the\\n     * pool's current balances.\\n     *\\n     * @param self Swap struct to read from and write to\\n     * @param metaSwapStorage MetaSwap struct to read from and write to\\n     * @param amounts how much of each token to withdraw\\n     * @param maxBurnAmount the max LP token provider is willing to pay to\\n     * remove liquidity. Useful as a front-running mitigation.\\n     * @return actual amount of LP tokens burned in the withdrawal\\n     */\\n    function removeLiquidityImbalance(\\n        SwapUtils.Swap storage self,\\n        MetaSwap storage metaSwapStorage,\\n        uint256[] memory amounts,\\n        uint256 maxBurnAmount\\n    ) public returns (uint256) {\\n        // Using this struct to avoid stack too deep error\\n        ManageLiquidityInfo memory v = ManageLiquidityInfo(\\n            0,\\n            0,\\n            0,\\n            self.lpToken,\\n            0,\\n            self._getAPrecise(),\\n            _updateBaseVirtualPrice(metaSwapStorage),\\n            self.tokenPrecisionMultipliers,\\n            self.balances\\n        );\\n        v.totalSupply = v.lpToken.totalSupply();\\n\\n        require(\\n            amounts.length == v.newBalances.length,\\n            \\\"Amounts should match pool tokens\\\"\\n        );\\n        require(maxBurnAmount != 0, \\\"Must burn more than 0\\\");\\n\\n        uint256 feePerToken = SwapUtils._feePerToken(\\n            self.swapFee,\\n            v.newBalances.length\\n        );\\n\\n        // Calculate how much LPToken should be burned\\n        uint256[] memory fees = new uint256[](v.newBalances.length);\\n        {\\n            uint256[] memory balances1 = new uint256[](v.newBalances.length);\\n\\n            v.d0 = SwapUtils.getD(\\n                _xp(\\n                    v.newBalances,\\n                    v.tokenPrecisionMultipliers,\\n                    v.baseVirtualPrice\\n                ),\\n                v.preciseA\\n            );\\n            for (uint256 i = 0; i < v.newBalances.length; i++) {\\n                balances1[i] = v.newBalances[i].sub(\\n                    amounts[i],\\n                    \\\"Cannot withdraw more than available\\\"\\n                );\\n            }\\n            v.d1 = SwapUtils.getD(\\n                _xp(balances1, v.tokenPrecisionMultipliers, v.baseVirtualPrice),\\n                v.preciseA\\n            );\\n\\n            for (uint256 i = 0; i < v.newBalances.length; i++) {\\n                uint256 idealBalance = v.d1.mul(v.newBalances[i]).div(v.d0);\\n                uint256 difference = idealBalance.difference(balances1[i]);\\n                fees[i] = feePerToken.mul(difference).div(FEE_DENOMINATOR);\\n                self.balances[i] = balances1[i].sub(\\n                    fees[i].mul(self.adminFee).div(FEE_DENOMINATOR)\\n                );\\n                balances1[i] = balances1[i].sub(fees[i]);\\n            }\\n\\n            v.d2 = SwapUtils.getD(\\n                _xp(balances1, v.tokenPrecisionMultipliers, v.baseVirtualPrice),\\n                v.preciseA\\n            );\\n        }\\n\\n        uint256 tokenAmount = v.d0.sub(v.d2).mul(v.totalSupply).div(v.d0);\\n        require(tokenAmount != 0, \\\"Burnt amount cannot be zero\\\");\\n\\n        // Scale up by withdraw fee\\n        tokenAmount = tokenAmount.add(1);\\n\\n        // Check for max burn amount\\n        require(tokenAmount <= maxBurnAmount, \\\"tokenAmount > maxBurnAmount\\\");\\n\\n        // Burn the calculated amount of LPToken from the caller and send the desired tokens\\n        v.lpToken.burnFrom(msg.sender, tokenAmount);\\n        for (uint256 i = 0; i < v.newBalances.length; i++) {\\n            self.pooledTokens[i].safeTransfer(msg.sender, amounts[i]);\\n        }\\n\\n        emit RemoveLiquidityImbalance(\\n            msg.sender,\\n            amounts,\\n            fees,\\n            v.d1,\\n            v.totalSupply.sub(tokenAmount)\\n        );\\n\\n        return tokenAmount;\\n    }\\n\\n    /**\\n     * @notice Determines if the stored value of base Swap's virtual price is expired.\\n     * If the last update was past the BASE_CACHE_EXPIRE_TIME, then update the stored value.\\n     *\\n     * @param metaSwapStorage MetaSwap struct to read from and write to\\n     * @return base Swap's virtual price\\n     */\\n    function _updateBaseVirtualPrice(MetaSwap storage metaSwapStorage)\\n        internal\\n        returns (uint256)\\n    {\\n        if (\\n            block.timestamp >\\n            metaSwapStorage.baseCacheLastUpdated + BASE_CACHE_EXPIRE_TIME\\n        ) {\\n            // When the cache is expired, update it\\n            uint256 baseVirtualPrice = ISwap(metaSwapStorage.baseSwap)\\n                .getVirtualPrice();\\n            metaSwapStorage.baseVirtualPrice = baseVirtualPrice;\\n            metaSwapStorage.baseCacheLastUpdated = block.timestamp;\\n            return baseVirtualPrice;\\n        } else {\\n            return metaSwapStorage.baseVirtualPrice;\\n        }\\n    }\\n}\\n\",\"keccak256\":\"0xb64b855d7c6af37c3ccd1713e9079e61baf14b4c8f984b7ef77ba33ceab87e7d\",\"license\":\"MIT\"}},\"version\":1}",
  "bytecode": "0x614b42610026600b82828239805160001a60731461001957fe5b30600052607381538281f3fe73000000000000000000000000000000000000000030146080604052600436106100dd5760003560e01c8063becf967c1161008b578063d45757ba11610065578063d45757ba1461041d578063e9d4d07714610459578063f6ada8c21461047c576100dd565b8063becf967c14610312578063c1a662731461031a578063d1ab4b4a1461035f576100dd565b80637e971656116100bc5780637e971656146101fd57806398414eed146102bb578063a28c23411461030a576100dd565b806280247a146100e25780635afb90ff1461014357806378b0bcbe1461017f575b600080fd5b8180156100ee57600080fd5b50610131600480360360c081101561010557600080fd5b5080359060208101359060ff604082013581169160608101359091169060808101359060a001356104ae565b60408051918252519081900360200190f35b610131600480360360a081101561015957600080fd5b5080359060208101359060ff604082013581169160608101359091169060800135611162565b6101316004803603608081101561019557600080fd5b8135916020810135918101906060810160408201356401000000008111156101bc57600080fd5b8201836020820111156101ce57600080fd5b803590602001918460208302840111640100000000831117156101f057600080fd5b9193509150351515611184565b81801561020957600080fd5b506101316004803603608081101561022057600080fd5b81359160208101359181019060608101604082013564010000000081111561024757600080fd5b82018360208201111561025957600080fd5b8035906020019184602083028401116401000000008311171561027b57600080fd5b9190808060200260200160405190810160405280939291908181526020018383602002808284376000920191909152509295505091359250611408915050565b8180156102c757600080fd5b50610131600480360360c08110156102de57600080fd5b5080359060208101359060ff604082013581169160608101359091169060808101359060a00135611b9d565b610131611fb7565b610131611fc3565b81801561032657600080fd5b50610131600480360360a081101561033d57600080fd5b5080359060208101359060408101359060ff6060820135169060800135611fc9565b81801561036b57600080fd5b506101316004803603608081101561038257600080fd5b8135916020810135918101906060810160408201356401000000008111156103a957600080fd5b8201836020820111156103bb57600080fd5b803590602001918460208302840111640100000000831117156103dd57600080fd5b9190808060200260200160405190810160405280939291908181526020018383602002808284376000920191909152509295505091359250612355915050565b610131600480360360a081101561043357600080fd5b5080359060208101359060ff604082013581169160608101359091169060800135612bb6565b6101316004803603604081101561046f57600080fd5b5080359060200135613139565b6101316004803603608081101561049257600080fd5b508035906020810135906040810135906060013560ff166132b8565b60006104b86148df565b6040518061016001604052806000815260200160008152602001600081526020018960080180548060200260200160405190810160405280929190818152602001828054801561052757602002820191906000526020600020905b815481526020019060010190808311610513575b505050505081526020018960090180548060200260200160405190810160405280929190818152602001828054801561057f57602002820191906000526020600020905b81548152602001906001019080831161056b575b50505050508152602001886003018054806020026020016040519081016040528092919081815260200182805480156105e157602002820191906000526020600020905b81546001600160a01b031681526001909101906020018083116105c3575b50505091835250506000602082018190526040820181905260608201819052608082015260a00161061189613354565b905260808101515190915060009061062a906001613411565b905060008260a00151518260ff160190508060ff168860ff1610801561065557508060ff168760ff16105b6106a6576040805162461bcd60e51b815260206004820152601860248201527f546f6b656e20696e646578206f7574206f662072616e67650000000000000000604482015290519081900360640190fd5b5087546001600160a01b031660ff80831690891610156106fa57896007018860ff16815481106106d257fe5b6000918252602090912001546001600160a01b031660c084015260ff881660e0840152610732565b8260a0015182890360ff168151811061070f57fe5b60209081029190910101516001600160a01b031660c084015260ff821660e08401525b8160ff168760ff16101561077c57896007018760ff168154811061075257fe5b6000918252602090912001546001600160a01b031661010084015260ff87166101208401526107b6565b8260a0015182880360ff168151811061079157fe5b60209081029190910101516001600160a01b031661010084015260ff82166101208401525b8260c001516001600160a01b03166370a08231306040518263ffffffff1660e01b815260040180826001600160a01b0316815260200191505060206040518083038186803b15801561080757600080fd5b505afa15801561081b573d6000803e3d6000fd5b505050506040513d602081101561083157600080fd5b5051602084015260c0830151610852906001600160a01b031633308961346e565b6108dd83602001518460c001516001600160a01b03166370a08231306040518263ffffffff1660e01b815260040180826001600160a01b0316815260200191505060206040518083038186803b1580156108ab57600080fd5b505afa1580156108bf573d6000803e3d6000fd5b505050506040513d60208110156108d557600080fd5b505190613411565b602084015260ff80831690891610806108fb57508160ff168760ff16105b15610f2b57606061091a846080015185606001518661014001516134fc565b90508260ff168960ff1610156109865761097f61095a85606001518b60ff168151811061094357fe5b60200260200101518961356290919063ffffffff16565b828b60ff168151811061096957fe5b60200260200101516135bb90919063ffffffff16565b8452610b0e565b60608460a001515167ffffffffffffffff811180156109a457600080fd5b506040519080825280602002602001820160405280156109ce578160200160208202803683370190505b509050846020015181858c0360ff16815181106109e757fe5b602002602001018181525050826001600160a01b0316634d49e87d826000426040518463ffffffff1660e01b81526004018080602001848152602001838152602001828103825285818151815260200191508051906020019060200280838360005b83811015610a61578181015183820152602001610a49565b50505050905001945050505050602060405180830381600087803b158015610a8857600080fd5b505af1158015610a9c573d6000803e3d6000fd5b505050506040513d6020811015610ab257600080fd5b505160208601528151610b0a90839060ff8716908110610ace57fe5b6020026020010151610b04670de0b6b3a7640000610afe8961014001518a6020015161356290919063ffffffff16565b90613615565b906135bb565b8552505b600080610b30610b1d8e61367c565b60e0880151610120890151895187613711565b9050610b6b6001610b6583868a610120015160ff1681518110610b4f57fe5b602002602001015161341190919063ffffffff16565b90613411565b604087015260ff808616908b1610610bab57610ba5866101400151610afe670de0b6b3a7640000896040015161356290919063ffffffff16565b60408701525b610bcf6402540be400610afe8f60040154896040015161356290919063ffffffff16565b9150610c0b866060015187610120015160ff1681518110610bec57fe5b6020026020010151610afe84896040015161341190919063ffffffff16565b60408701525060058c0154600090610c2f906402540be40090610afe908590613562565b9050610c63866060015187610120015160ff1681518110610c4c57fe5b60200260200101518261361590919063ffffffff16565b9050610c84866020015187608001518860e0015160ff168151811061096957fe5b8d6009018760e0015160ff1681548110610c9a57fe5b9060005260206000200181905550610ccc81610b65886040015189608001518a610120015160ff1681518110610b4f57fe5b8d60090187610120015160ff1681548110610ce357fe5b9060005260206000200181905550508360ff168960ff1610610ecb5760008561010001516001600160a01b03166370a08231306040518263ffffffff1660e01b815260040180826001600160a01b0316815260200191505060206040518083038186803b158015610d5357600080fd5b505afa158015610d67573d6000803e3d6000fd5b505050506040513d6020811015610d7d57600080fd5b505160408088015181517f3e3a1560000000000000000000000000000000000000000000000000000000008152600481019190915260ff888e0316602482015260006044820181905242606483015291519293506001600160a01b03871692633e3a156092608480840193602093929083900390910190829087803b158015610e0557600080fd5b505af1158015610e19573d6000803e3d6000fd5b505050506040513d6020811015610e2f57600080fd5b5050610100860151604080517f70a08231000000000000000000000000000000000000000000000000000000008152306004820152905183926001600160a01b0316916370a08231916024808301926020929190829003018186803b158015610e9757600080fd5b505afa158015610eab573d6000803e3d6000fd5b505050506040513d6020811015610ec157600080fd5b5051036040870152505b8685604001511015610f24576040805162461bcd60e51b815260206004820181905260248201527f53776170206469646e277420726573756c7420696e206d696e20746f6b656e73604482015290519081900360640190fd5b50506110d8565b8261010001516001600160a01b03166370a08231306040518263ffffffff1660e01b815260040180826001600160a01b0316815260200191505060206040518083038186803b158015610f7d57600080fd5b505afa158015610f91573d6000803e3d6000fd5b505050506040513d6020811015610fa757600080fd5b505160408085019190915260208481015182517f9169558600000000000000000000000000000000000000000000000000000000815260ff868d0381166004830152868c0316602482015260448101919091526064810188905242608482015291516001600160a01b0384169263916955869260a48083019391928290030181600087803b15801561103857600080fd5b505af115801561104c573d6000803e3d6000fd5b505050506040513d602081101561106257600080fd5b505060408084015161010085015182517f70a0823100000000000000000000000000000000000000000000000000000000815230600482015292516110d2936001600160a01b03909216916370a08231916024808301926020929190829003018186803b1580156108ab57600080fd5b60408401525b6110ff3384604001518561010001516001600160a01b03166139579092919063ffffffff16565b6040808401518151888152602081019190915260ff808b168284015289166060820152905133917f6617207207e397b41fc98016d8c9febb7223f44c355db66ad429730f2b950a60919081900360800190a2505060400151979650505050505050565b6000611179868585856111748a6139dc565b613a7e565b509695505050505050565b6000806111908761367c565b905060008060006111a0896139dc565b905060608a6009018054806020026020016040519081016040528092919081815260200182805480156111f257602002820191906000526020600020905b8154815260200190600101908083116111de575b5050505050905060608b60080180548060200260200160405190810160405280929190818152602001828054801561124957602002820191906000526020600020905b815481526020019060010190808311611235575b5050505050905060008251905061126a6112648484876134fc565b88613c4e565b955060005b8181101561132f5789156112bc5761129f8c8c8381811061128c57fe5b9050602002013585838151811061096957fe5b8482815181106112ab57fe5b602002602001018181525050611327565b61130e8c8c838181106112cb57fe5b90506020020135604051806060016040528060238152602001614aea602391398684815181106112f757fe5b6020026020010151613db49092919063ffffffff16565b84828151811061131a57fe5b6020026020010181815250505b60010161126f565b5061133e6112648484876134fc565b94505050505060008960060160009054906101000a90046001600160a01b03166001600160a01b03166318160ddd6040518163ffffffff1660e01b815260040160206040518083038186803b15801561139657600080fd5b505afa1580156113aa573d6000803e3d6000fd5b505050506040513d60208110156113c057600080fd5b5051905085156113ed576113e283610afe836113dc8684613411565b90613562565b9450505050506113ff565b6113e283610afe836113dc8387613411565b95945050505050565b6000611412614951565b604080516101208101825260008082526020820181905291810182905260068801546001600160a01b03166060820152608081019190915260a081016114578861367c565b815260200161146587613354565b8152602001876008018054806020026020016040519081016040528092919081815260200182805480156114b857602002820191906000526020600020905b8154815260200190600101908083116114a4575b505050505081526020018760090180548060200260200160405190810160405280929190818152602001828054801561151057602002820191906000526020600020905b8154815260200190600101908083116114fc575b5050505050815250905080606001516001600160a01b03166318160ddd6040518163ffffffff1660e01b815260040160206040518083038186803b15801561155757600080fd5b505afa15801561156b573d6000803e3d6000fd5b505050506040513d602081101561158157600080fd5b50516080820152610100810151518451146115e3576040805162461bcd60e51b815260206004820181905260248201527f416d6f756e74732073686f756c64206d6174636820706f6f6c20746f6b656e73604482015290519081900360640190fd5b82611635576040805162461bcd60e51b815260206004820152601560248201527f4d757374206275726e206d6f7265207468616e20300000000000000000000000604482015290519081900360640190fd5b600061164b876004015483610100015151613e4b565b905060608261010001515167ffffffffffffffff8111801561166c57600080fd5b50604051908082528060200260200182016040528015611696578160200160208202803683370190505b50905060608361010001515167ffffffffffffffff811180156116b857600080fd5b506040519080825280602002602001820160405280156116e2578160200160208202803683370190505b50905061170a6117008561010001518660e001518760c001516134fc565b8560a00151613c4e565b845260005b8461010001515181101561177d5761175e88828151811061172c57fe5b6020026020010151604051806060016040528060238152602001614aea6023913987610100015184815181106112f757fe5b82828151811061176a57fe5b602090810291909101015260010161170f565b50611794611700828660e001518760c001516134fc565b602085015260005b846101000151518110156118dd5760006117e38660000151610afe88610100015185815181106117c857fe5b6020026020010151896020015161356290919063ffffffff16565b9050600061180d8484815181106117f657fe5b602002602001015183613e6a90919063ffffffff16565b90506118226402540be400610afe8884613562565b85848151811061182e57fe5b60200260200101818152505061187c6118706402540be400610afe8f6005015489888151811061185a57fe5b602002602001015161356290919063ffffffff16565b858581518110610b4f57fe5b8c600901848154811061188b57fe5b90600052602060002001819055506118bc8584815181106118a857fe5b6020026020010151858581518110610b4f57fe5b8484815181106118c857fe5b6020908102919091010152505060010161179c565b506118f4611700828660e001518760c001516134fc565b60408501819052845160808601516000935061191a92610afe91906113dc908490613411565b90508061196e576040805162461bcd60e51b815260206004820152601b60248201527f4275726e7420616d6f756e742063616e6e6f74206265207a65726f0000000000604482015290519081900360640190fd5b6119798160016135bb565b9050858111156119d0576040805162461bcd60e51b815260206004820152601b60248201527f746f6b656e416d6f756e74203e206d61784275726e416d6f756e740000000000604482015290519081900360640190fd5b83606001516001600160a01b03166379cc679033836040518363ffffffff1660e01b815260040180836001600160a01b0316815260200182815260200192505050600060405180830381600087803b158015611a2b57600080fd5b505af1158015611a3f573d6000803e3d6000fd5b5050505060005b84610100015151811015611a9f57611a9733898381518110611a6457fe5b60200260200101518c6007018481548110611a7b57fe5b6000918252602090912001546001600160a01b03169190613957565b600101611a46565b50336001600160a01b03167f3631c28b1f9dd213e0319fb167b554d76b6c283a41143eb400a0d1adb1af175588848760200151611ae9868a6080015161341190919063ffffffff16565b604051808060200180602001858152602001848152602001838103835287818151815260200191508051906020019060200280838360005b83811015611b39578181015183820152602001611b21565b50505050905001838103825286818151815260200191508051906020019060200280838360005b83811015611b78578181015183820152602001611b60565b50505050905001965050505050505060405180910390a293505050505b949350505050565b600786015460009060ff861681118015611bb95750808560ff16105b611c0a576040805162461bcd60e51b815260206004820152601b60248201527f546f6b656e20696e646578206973206f7574206f662072616e67650000000000604482015290519081900360640190fd5b50600080886007018760ff1681548110611c2057fe5b60009182526020918290200154604080517f70a0823100000000000000000000000000000000000000000000000000000000815233600482015290516001600160a01b03909216935083926370a0823192602480840193829003018186803b158015611c8b57600080fd5b505afa158015611c9f573d6000803e3d6000fd5b505050506040513d6020811015611cb557600080fd5b5051851115611d0b576040805162461bcd60e51b815260206004820152601d60248201527f43616e6e6f742073776170206d6f7265207468616e20796f75206f776e000000604482015290519081900360640190fd5b6000816001600160a01b03166370a08231306040518263ffffffff1660e01b815260040180826001600160a01b0316815260200191505060206040518083038186803b158015611d5a57600080fd5b505afa158015611d6e573d6000803e3d6000fd5b505050506040513d6020811015611d8457600080fd5b50519050611d9d6001600160a01b03831633308961346e565b611dee81836001600160a01b03166370a08231306040518263ffffffff1660e01b815260040180826001600160a01b0316815260200191505060206040518083038186803b1580156108ab57600080fd5b92505050600080611e058a8989866111748e613354565b9150915084821015611e5e576040805162461bcd60e51b815260206004820181905260248201527f53776170206469646e277420726573756c7420696e206d696e20746f6b656e73604482015290519081900360640190fd5b6000611ea08b6008018960ff1681548110611e7557fe5b9060005260206000200154610afe6402540be400610afe8f600501548761356290919063ffffffff16565b9050611ed1848c6009018b60ff1681548110611eb857fe5b90600052602060002001546135bb90919063ffffffff16565b8b6009018a60ff1681548110611ee357fe5b9060005260206000200181905550611f2481610b65858e6009018c60ff1681548110611f0b57fe5b906000526020600020015461341190919063ffffffff16565b8b6009018960ff1681548110611f3657fe5b9060005260206000200181905550611f5b33848d6007018b60ff1681548110611a7b57fe5b604080518581526020810185905260ff808c16828401528a166060820152905133917fc6c1e0630dbe9130cc068028486c0d118ddcea348550819defd5cb8c257f8a38919081900360800190a250909998505050505050505050565b670de0b6b3a764000081565b61025881565b6006850154604080517f18160ddd00000000000000000000000000000000000000000000000000000000815290516000926001600160a01b031691839183916318160ddd916004808301926020929190829003018186803b15801561202d57600080fd5b505afa158015612041573d6000803e3d6000fd5b505050506040513d602081101561205757600080fd5b50516007890154604080517f70a08231000000000000000000000000000000000000000000000000000000008152336004820152905192935090916001600160a01b038516916370a08231916024808301926020929190829003018186803b1580156120c257600080fd5b505afa1580156120d6573d6000803e3d6000fd5b505050506040513d60208110156120ec57600080fd5b5051871115612142576040805162461bcd60e51b815260206004820152600d60248201527f3e4c502e62616c616e63654f6600000000000000000000000000000000000000604482015290519081900360640190fd5b808660ff1610612199576040805162461bcd60e51b815260206004820152600f60248201527f546f6b656e206e6f7420666f756e640000000000000000000000000000000000604482015290519081900360640190fd5b6000806121b18b8a8a6121ab8e613354565b88613e82565b925090508681101561220a576040805162461bcd60e51b815260206004820152600e60248201527f6479203c206d696e416d6f756e74000000000000000000000000000000000000604482015290519081900360640190fd5b6122496122376122306402540be400610afe8f600501548761356290919063ffffffff16565b83906135bb565b8c6009018a60ff1681548110611f0b57fe5b8b6009018960ff168154811061225b57fe5b6000918252602082200191909155604080517f79cc6790000000000000000000000000000000000000000000000000000000008152336004820152602481018c905290516001600160a01b038816926379cc6790926044808201939182900301818387803b1580156122cc57600080fd5b505af11580156122e0573d6000803e3d6000fd5b505050506122fb33828d6007018b60ff1681548110611a7b57fe5b604080518a81526020810186905260ff8a168183015260608101839052905133917f43fb02998f4e03da2e0e6fff53fdbf0c40a9f45f145dc377fc30615d7d7a8a64919081900360800190a29a9950505050505050505050565b60006060856007018054806020026020016040519081016040528092919081815260200182805480156123b157602002820191906000526020600020905b81546001600160a01b03168152600190910190602001808311612393575b50505050509050805184511461240e576040805162461bcd60e51b815260206004820181905260248201527f416d6f756e7473206d757374206d6174636820706f6f6c656420746f6b656e73604482015290519081900360640190fd5b6060815167ffffffffffffffff8111801561242857600080fd5b50604051908082528060200260200182016040528015612452578160200160208202803683370190505b50905061245d614951565b604080516101208101825260008082526020820181905291810182905260068a01546001600160a01b03166060820152608081019190915260a081016124a28a61367c565b81526020016124b089613354565b81526020018960080180548060200260200160405190810160405280929190818152602001828054801561250357602002820191906000526020600020905b8154815260200190600101908083116124ef575b505050505081526020018960090180548060200260200160405190810160405280929190818152602001828054801561255b57602002820191906000526020600020905b815481526020019060010190808311612547575b5050505050815250905080606001516001600160a01b03166318160ddd6040518163ffffffff1660e01b815260040160206040518083038186803b1580156125a257600080fd5b505afa1580156125b6573d6000803e3d6000fd5b505050506040513d60208110156125cc57600080fd5b50516080820181905215612602576125ff6125f58261010001518360e001518460c001516134fc565b8260a00151613c4e565b81525b60005b83518110156128455760808201511515806126335750600087828151811061262957fe5b6020026020010151115b612684576040805162461bcd60e51b815260206004820152601e60248201527f4d75737420737570706c7920616c6c20746f6b656e7320696e20706f6f6c0000604482015290519081900360640190fd5b86818151811061269057fe5b60200260200101516000146127f95760008482815181106126ad57fe5b60200260200101516001600160a01b03166370a08231306040518263ffffffff1660e01b815260040180826001600160a01b0316815260200191505060206040518083038186803b15801561270157600080fd5b505afa158015612715573d6000803e3d6000fd5b505050506040513d602081101561272b57600080fd5b5051885190915061277b90339030908b908690811061274657fe5b602002602001015188868151811061275a57fe5b60200260200101516001600160a01b031661346e909392919063ffffffff16565b6127df8186848151811061278b57fe5b60200260200101516001600160a01b03166370a08231306040518263ffffffff1660e01b815260040180826001600160a01b0316815260200191505060206040518083038186803b1580156108ab57600080fd5b8883815181106127eb57fe5b602002602001018181525050505b61282187828151811061280857fe5b6020026020010151836101000151838151811061096957fe5b826101000151828151811061283257fe5b6020908102919091010152600101612605565b506128616125f58261010001518360e001518460c001516134fc565b602082018190528151106128bc576040805162461bcd60e51b815260206004820152601160248201527f442073686f756c6420696e637265617365000000000000000000000000000000604482015290519081900360640190fd5b60208101516040820152608081015160009015612a6e5760006128e48a600401548651613e4b565b905060005b8551811015612a1f57600061292c8560000151610afe8e600901858154811061290e57fe5b9060005260206000200154886020015161356290919063ffffffff16565b905061296c6402540be400610afe612965886101000151868151811061294e57fe5b602002602001015185613e6a90919063ffffffff16565b8690613562565b86838151811061297857fe5b6020026020010181815250506129b56129a46402540be400610afe8f600501548a878151811061185a57fe5b8661010001518481518110610b4f57fe5b8c60090183815481106129c457fe5b90600052602060002001819055506129fa8683815181106129e157fe5b60200260200101518661010001518481518110610b4f57fe5b8561010001518381518110612a0b57fe5b6020908102919091010152506001016128e9565b50612a45612a3b8461010001518560e001518660c001516134fc565b8460a00151613c4e565b6040840181905283516080850151612a6692610afe91906113dc9084613411565b915050612a92565b6101008201518051612a8a9160098c01916020909101906149a6565b505060208101515b85811015612ae7576040805162461bcd60e51b815260206004820152601b60248201527f436f756c646e2774206d696e74206d696e207265717565737465640000000000604482015290519081900360640190fd5b6006890154604080517f40c10f190000000000000000000000000000000000000000000000000000000081523360048201526024810184905290516001600160a01b03909216916340c10f199160448082019260009290919082900301818387803b158015612b5557600080fd5b505af1158015612b69573d6000803e3d6000fd5b50505050336001600160a01b03167f189c623b666b1b45b83d7178f39b8c087cb09774317ca2f53c2d3c3726f222a288858560200151611ae98688608001516135bb90919063ffffffff16565b6000612bc06149f1565b6040518060e00160405280612bd4886139dc565b815287546001600160a01b03166020820152600060408201819052600389015460ff166060808401919091526080830182905260a0830182905260c090920152815191925090612c25908990613ee5565b8051909150612c35906001613411565b60ff9081166040840181905260608401510190818116908816108015612c6057508060ff168660ff16105b612cb1576040805162461bcd60e51b815260206004820152601860248201527f546f6b656e20696e646578206f7574206f662072616e67650000000000000000604482015290519081900360640190fd5b50816040015160ff168660ff161015612d0f57612d05612cf6896008018860ff1681548110612cdc57fe5b90600052602060002001548661356290919063ffffffff16565b828860ff168151811061096957fe5b60a0830152612f88565b6040820151958690039560ff9081169086161015612ee6576060826060015160ff1667ffffffffffffffff81118015612d4757600080fd5b50604051908082528060200260200182016040528015612d71578160200160208202803683370190505b50905084818860ff1681518110612d8457fe5b602002602001018181525050612e67670de0b6b3a7640000610afe856000015186602001516001600160a01b031663e6ab28068660016040518363ffffffff1660e01b815260040180806020018315158152602001828103825284818151815260200191508051906020019060200280838360005b83811015612e11578181015183820152602001612df9565b50505050905001935050505060206040518083038186803b158015612e3557600080fd5b505afa158015612e49573d6000803e3d6000fd5b505050506040513d6020811015612e5f57600080fd5b505190613562565b8360a0018181525050612edb82846040015160ff1681518110612e8657fe5b6020026020010151610b04612ed0612ead60026402540be40061356290919063ffffffff16565b8c54610afe90612ec5906001600160a01b0316613f96565b60a08a015190613562565b60a087015190613411565b60a084015250612f80565b81602001516001600160a01b031663a95b089f8784604001518803876040518463ffffffff1660e01b8152600401808460ff1681526020018360ff168152602001828152602001935050505060206040518083038186803b158015612f4a57600080fd5b505afa158015612f5e573d6000803e3d6000fd5b505050506040513d6020811015612f7457600080fd5b505192506113ff915050565b816040015195505b604082015160ff908116608084018190529086161015612fac5760ff851660808301525b6000612fcb612fba8a61367c565b8885608001518660a0015186613711565b9050612fe96001610b658385876080015160ff1681518110610b4f57fe5b60c0840181905260048a015460009161300c916402540be40091610afe91613562565b60c085015190915061301e9082613411565b60c08501525050604082015160ff90811690861610156130795761306f88600801836080015160ff168154811061305157fe5b90600052602060002001548360c0015161361590919063ffffffff16565b60c083015261312a565b81602001516001600160a01b031663342a87a16130b38460000151610afe670de0b6b3a76400008760c0015161356290919063ffffffff16565b846040015188036040518363ffffffff1660e01b8152600401808381526020018260ff1681526020019250505060206040518083038186803b1580156130f857600080fd5b505afa15801561310c573d6000803e3d6000fd5b505050506040513d602081101561312257600080fd5b505160c08301525b5060c001519695505050505050565b6000806132046131f68560090180548060200260200160405190810160405280929190818152602001828054801561319057602002820191906000526020600020905b81548152602001906001019080831161317c575b5050505050866008018054806020026020016040519081016040528092919081815260200182805480156131e357602002820191906000526020600020905b8154815260200190600101908083116131cf575b50505050506131f1876139dc565b6134fc565b6131ff8661367c565b613c4e565b905060008460060160009054906101000a90046001600160a01b03166001600160a01b03166318160ddd6040518163ffffffff1660e01b815260040160206040518083038186803b15801561325857600080fd5b505afa15801561326c573d6000803e3d6000fd5b505050506040513d602081101561328257600080fd5b5051905080156132ab576132a281610afe84670de0b6b3a7640000613562565b925050506132b2565b6000925050505b92915050565b600061334a8584846132c9886139dc565b8960060160009054906101000a90046001600160a01b03166001600160a01b03166318160ddd6040518163ffffffff1660e01b815260040160206040518083038186803b15801561331957600080fd5b505afa15801561332d573d6000803e3d6000fd5b505050506040513d602081101561334357600080fd5b5051613e82565b5095945050505050565b6000610258826002015401421115613405578154604080517fe25aa5fa00000000000000000000000000000000000000000000000000000000815290516000926001600160a01b03169163e25aa5fa916004808301926020929190829003018186803b1580156133c357600080fd5b505afa1580156133d7573d6000803e3d6000fd5b505050506040513d60208110156133ed57600080fd5b505160018401819055426002850155915061340c9050565b5060018101545b919050565b600082821115613468576040805162461bcd60e51b815260206004820152601e60248201527f536166654d6174683a207375627472616374696f6e206f766572666c6f770000604482015290519081900360640190fd5b50900390565b604080516001600160a01b0380861660248301528416604482015260648082018490528251808303909101815260849091019091526020810180517bffffffffffffffffffffffffffffffffffffffffffffffffffffffff167f23b872dd000000000000000000000000000000000000000000000000000000001790526134f6908590614006565b50505050565b60608061350985856140b7565b905060006135226001875161341190919063ffffffff16565b9050613540670de0b6b3a7640000610afe8685858151811061185a57fe5b82828151811061354c57fe5b60209081029190910101525090505b9392505050565b600082613571575060006132b2565b8282028284828161357e57fe5b041461355b5760405162461bcd60e51b8152600401808060200182810382526021815260200180614a9f6021913960400191505060405180910390fd5b60008282018381101561355b576040805162461bcd60e51b815260206004820152601b60248201527f536166654d6174683a206164646974696f6e206f766572666c6f770000000000604482015290519081900360640190fd5b600080821161366b576040805162461bcd60e51b815260206004820152601a60248201527f536166654d6174683a206469766973696f6e206279207a65726f000000000000604482015290519081900360640190fd5b81838161367457fe5b049392505050565b6003810154600182015460009190428211156137085760028401548454808311156136da576136cf6136c86136b18685613411565b610afe6136be4287613411565b6113dc8887613411565b82906135bb565b94505050505061340c565b6136cf6137016136ea8685613411565b610afe6136f74287613411565b6113dc8689613411565b8290613411565b915061340c9050565b805160009060ff8681169086161415613771576040805162461bcd60e51b815260206004820152601d60248201527f43616e277420636f6d7061726520746f6b656e20746f20697473656c66000000604482015290519081900360640190fd5b808660ff161080156137855750808560ff16105b6137d6576040805162461bcd60e51b815260206004820152601660248201527f546f6b656e73206d75737420626520696e20706f6f6c00000000000000000000604482015290519081900360640190fd5b60006137e28489613c4e565b9050806000806137f2858c613562565b90506000805b8681101561386b578b60ff168114156138135789915061383d565b8a60ff1681146138385788818151811061382957fe5b6020026020010151915061383d565b613863565b61384784836135bb565b93506138606138568389613562565b610afe8789613562565b94505b6001016137f8565b506138886138798388613562565b610afe60646113dc888a613562565b935060006138a561389e84610afe896064613562565b85906135bb565b9050600086815b6101008110156139095790915081906138df6138d18a610b6587610b04876002613562565b610afe8a610b048680613562565b91506138eb82846141ae565b15613901575098506113ff975050505050505050565b6001016138ac565b506040805162461bcd60e51b815260206004820152601e60248201527f417070726f78696d6174696f6e20646964206e6f7420636f6e76657267650000604482015290519081900360640190fd5b604080516001600160a01b038416602482015260448082018490528251808303909101815260649091019091526020810180517bffffffffffffffffffffffffffffffffffffffffffffffffffffffff167fa9059cbb000000000000000000000000000000000000000000000000000000001790526139d7908490614006565b505050565b6000610258826002015401421115613405578154604080517fe25aa5fa00000000000000000000000000000000000000000000000000000000815290516001600160a01b039092169163e25aa5fa91600480820192602092909190829003018186803b158015613a4b57600080fd5b505afa158015613a5f573d6000803e3d6000fd5b505050506040513d6020811015613a7557600080fd5b5051905061340c565b6000806060613a8d8885613ee5565b905080518760ff16108015613aa5575080518660ff16105b613af6576040805162461bcd60e51b815260206004820152601860248201527f546f6b656e20696e646578206f7574206f662072616e67650000000000000000604482015290519081900360640190fd5b8051600090613b06906001613411565b90506000613b398a6008018a60ff1681548110613b1f57fe5b90600052602060002001548861356290919063ffffffff16565b9050818960ff161415613b5f57613b5c670de0b6b3a7640000610afe8389613562565b90505b613b88838a60ff1681518110613b7157fe5b6020026020010151826135bb90919063ffffffff16565b90506000613ba1613b988c61367c565b8b8b8588613711565b9050613bbb6001610b6583878d60ff1681518110610b4f57fe5b9550828960ff161415613be157613bde87610afe88670de0b6b3a7640000613562565b95505b613c016402540be400610afe8d600401548961356290919063ffffffff16565b9450613c0d8686613411565b9550613c3e8b6008018a60ff1681548110613c2457fe5b90600052602060002001548761361590919063ffffffff16565b9550505050509550959350505050565b815160009081805b82811015613c8e57613c84868281518110613c6d57fe5b6020026020010151836135bb90919063ffffffff16565b9150600101613c56565b5080613c9f576000925050506132b2565b60008181613cad8786613562565b905060005b610100811015613d66578260005b87811015613cef57613ce5613cdb898d848151811061185a57fe5b610afe8488613562565b9150600101613cc0565b509293508392613d3d613d1d613d0a836113dc8b60016135bb565b610b046064610afe896113dc8a84613411565b610afe866113dc613d2e868d613562565b610b046064610afe8b8f613562565b9350613d4984866141ae565b15613d5d57839750505050505050506132b2565b50600101613cb2565b506040805162461bcd60e51b815260206004820152601360248201527f4420646f6573206e6f7420636f6e766572676500000000000000000000000000604482015290519081900360640190fd5b60008184841115613e435760405162461bcd60e51b81526004018080602001828103825283818151815260200191508051906020019080838360005b83811015613e08578181015183820152602001613df0565b50505050905090810190601f168015613e355780820380516001836020036101000a031916815260200191505b509250505060405180910390fd5b505050900390565b600061355b613e6060046113dc856001613411565b610afe8585613562565b600081831115613e7d57508082036132b2565b500390565b600080600080600080613e988b8a8c8b8b6141c5565b809450819350829650505050613ed384610b658d6008018c60ff1681548110613ebd57fe5b600091825260209091200154610afe8686613411565b939b939a509298505050505050505050565b606061355b83600901805480602002602001604051908101604052809291908181526020018280548015613f3857602002820191906000526020600020905b815481526020019060010190808311613f24575b505050505084600801805480602002602001604051908101604052809291908181526020018280548015613f8b57602002820191906000526020600020905b815481526020019060010190808311613f77575b5050505050846134fc565b6000816001600160a01b0316635fd65f0f6040518163ffffffff1660e01b815260040160e06040518083038186803b158015613fd157600080fd5b505afa158015613fe5573d6000803e3d6000fd5b505050506040513d60e0811015613ffb57600080fd5b506080015192915050565b606061405b826040518060400160405280602081526020017f5361666545524332303a206c6f772d6c6576656c2063616c6c206661696c6564815250856001600160a01b031661457d9092919063ffffffff16565b8051909150156139d75780806020019051602081101561407a57600080fd5b50516139d75760405162461bcd60e51b815260040180806020018281038252602a815260200180614ac0602a913960400191505060405180910390fd5b81518151606091908114614112576040805162461bcd60e51b815260206004820152601f60248201527f42616c616e636573206d757374206d61746368206d756c7469706c6965727300604482015290519081900360640190fd5b60608167ffffffffffffffff8111801561412b57600080fd5b50604051908082528060200260200182016040528015614155578160200160208202803683370190505b50905060005b828110156141a55761418685828151811061417257fe5b602002602001015187838151811061185a57fe5b82828151811061419257fe5b602090810291909101015260010161415b565b50949350505050565b600060016141bc8484613e6a565b11159392505050565b600080600060606141d68987613ee5565b905080518860ff1610614230576040805162461bcd60e51b815260206004820152601860248201527f546f6b656e20696e646578206f7574206f662072616e67650000000000000000604482015290519081900360640190fd5b614238614a2d565b6040518060c00160405280600081526020016000815260200160008152602001600081526020016142688c61367c565b815260200160008152509050614282828260800151613c4e565b8082526142a29061429a908890610afe908c90613562565b825190613411565b60208201528151829060ff8b169081106142b857fe5b6020026020010151881115614314576040805162461bcd60e51b815260206004820152601a60248201527f5769746864726177206578636565647320617661696c61626c65000000000000604482015290519081900360640190fd5b61432881608001518a84846020015161458c565b6040820152815160609067ffffffffffffffff8111801561434857600080fd5b50604051908082528060200260200182016040528015614372578160200160208202803683370190505b5090506143848b600401548451613e4b565b606083015260005b835181101561445b578381815181106143a157fe5b60200260200101518360a001818152505061443c6144316402540be400610afe86606001518f60ff168614614406576144016143f68960000151610afe8b602001518c60a0015161356290919063ffffffff16565b60a08a015190613411565b6113dc565b6113dc8860400151610b658a60000151610afe8c602001518d60a0015161356290919063ffffffff16565b60a085015190613411565b82828151811061444857fe5b602090810291909101015260010161438c565b50600061448461447584608001518d85876020015161458c565b838d60ff1681518110610b4f57fe5b8451909150614494906001613411565b8b60ff16141561451d576144b489610afe83670de0b6b3a7640000613562565b90506144d989610afe670de0b6b3a7640000866040015161356290919063ffffffff16565b83604001818152505061450189610afe670de0b6b3a7640000878f60ff168151811061185a57fe5b848c60ff168151811061451057fe5b6020026020010181815250505b6145498c6008018c60ff168154811061453257fe5b600091825260209091200154610afe836001613411565b9050808360400151858d60ff168151811061456057fe5b602002602001015196509650965050505050955095509592505050565b6060611b9584846000856146f9565b815160009060ff851681116145e8576040805162461bcd60e51b815260206004820152600f60248201527f546f6b656e206e6f7420666f756e640000000000000000000000000000000000604482015290519081900360640190fd5b826000806145f68985613562565b905060005b8481101561465d578860ff1681146146555761463388828151811061461c57fe5b6020026020010151846135bb90919063ffffffff16565b9250614652614648868a848151811061185a57fe5b610afe868a613562565b93505b6001016145fb565b5061467a61466b8286613562565b610afe60646113dc878b613562565b9250600061469761469083610afe8a6064613562565b84906135bb565b9050600087815b6101008110156139095790915081906146d16146c38b610b6587610b04876002613562565b610afe89610b048680613562565b91506146dd82846141ae565b156146f157509650611b9595505050505050565b60010161469e565b60608247101561473a5760405162461bcd60e51b8152600401808060200182810382526026815260200180614a796026913960400191505060405180910390fd5b61474385614873565b614794576040805162461bcd60e51b815260206004820152601d60248201527f416464726573733a2063616c6c20746f206e6f6e2d636f6e7472616374000000604482015290519081900360640190fd5b60006060866001600160a01b031685876040518082805190602001908083835b602083106147f157805182527fffffffffffffffffffffffffffffffffffffffffffffffffffffffffffffffe090920191602091820191016147b4565b6001836020036101000a03801982511681845116808217855250505050505090500191505060006040518083038185875af1925050503d8060008114614853576040519150601f19603f3d011682016040523d82523d6000602084013e614858565b606091505b5091509150614868828286614879565b979650505050505050565b3b151590565b6060831561488857508161355b565b8251156148985782518084602001fd5b60405162461bcd60e51b8152602060048201818152845160248401528451859391928392604401919085019080838360008315613e08578181015183820152602001613df0565b60405180610160016040528060008152602001600081526020016000815260200160608152602001606081526020016060815260200160006001600160a01b03168152602001600060ff16815260200160006001600160a01b03168152602001600060ff168152602001600081525090565b60405180610120016040528060008152602001600081526020016000815260200160006001600160a01b0316815260200160008152602001600081526020016000815260200160608152602001606081525090565b8280548282559060005260206000209081019282156149e1579160200282015b828111156149e15782518255916020019190600101906149c6565b506149ed929150614a63565b5090565b6040805160e081018252600080825260208201819052918101829052606081018290526080810182905260a0810182905260c081019190915290565b6040518060c001604052806000815260200160008152602001600081526020016000815260200160008152602001600081525090565b5b808211156149ed5760008155600101614a6456fe416464726573733a20696e73756666696369656e742062616c616e636520666f722063616c6c536166654d6174683a206d756c7469706c69636174696f6e206f766572666c6f775361666545524332303a204552433230206f7065726174696f6e20646964206e6f74207375636365656443616e6e6f74207769746864726177206d6f7265207468616e20617661696c61626c65a2646970667358221220c6c59fced5b50e03eabbcaebe09d0fe28b2eb40b64bc1ffeb9eede3ce635c94764736f6c634300060c0033",
  "deployedBytecode": "0x73000000000000000000000000000000000000000030146080604052600436106100dd5760003560e01c8063becf967c1161008b578063d45757ba11610065578063d45757ba1461041d578063e9d4d07714610459578063f6ada8c21461047c576100dd565b8063becf967c14610312578063c1a662731461031a578063d1ab4b4a1461035f576100dd565b80637e971656116100bc5780637e971656146101fd57806398414eed146102bb578063a28c23411461030a576100dd565b806280247a146100e25780635afb90ff1461014357806378b0bcbe1461017f575b600080fd5b8180156100ee57600080fd5b50610131600480360360c081101561010557600080fd5b5080359060208101359060ff604082013581169160608101359091169060808101359060a001356104ae565b60408051918252519081900360200190f35b610131600480360360a081101561015957600080fd5b5080359060208101359060ff604082013581169160608101359091169060800135611162565b6101316004803603608081101561019557600080fd5b8135916020810135918101906060810160408201356401000000008111156101bc57600080fd5b8201836020820111156101ce57600080fd5b803590602001918460208302840111640100000000831117156101f057600080fd5b9193509150351515611184565b81801561020957600080fd5b506101316004803603608081101561022057600080fd5b81359160208101359181019060608101604082013564010000000081111561024757600080fd5b82018360208201111561025957600080fd5b8035906020019184602083028401116401000000008311171561027b57600080fd5b9190808060200260200160405190810160405280939291908181526020018383602002808284376000920191909152509295505091359250611408915050565b8180156102c757600080fd5b50610131600480360360c08110156102de57600080fd5b5080359060208101359060ff604082013581169160608101359091169060808101359060a00135611b9d565b610131611fb7565b610131611fc3565b81801561032657600080fd5b50610131600480360360a081101561033d57600080fd5b5080359060208101359060408101359060ff6060820135169060800135611fc9565b81801561036b57600080fd5b506101316004803603608081101561038257600080fd5b8135916020810135918101906060810160408201356401000000008111156103a957600080fd5b8201836020820111156103bb57600080fd5b803590602001918460208302840111640100000000831117156103dd57600080fd5b9190808060200260200160405190810160405280939291908181526020018383602002808284376000920191909152509295505091359250612355915050565b610131600480360360a081101561043357600080fd5b5080359060208101359060ff604082013581169160608101359091169060800135612bb6565b6101316004803603604081101561046f57600080fd5b5080359060200135613139565b6101316004803603608081101561049257600080fd5b508035906020810135906040810135906060013560ff166132b8565b60006104b86148df565b6040518061016001604052806000815260200160008152602001600081526020018960080180548060200260200160405190810160405280929190818152602001828054801561052757602002820191906000526020600020905b815481526020019060010190808311610513575b505050505081526020018960090180548060200260200160405190810160405280929190818152602001828054801561057f57602002820191906000526020600020905b81548152602001906001019080831161056b575b50505050508152602001886003018054806020026020016040519081016040528092919081815260200182805480156105e157602002820191906000526020600020905b81546001600160a01b031681526001909101906020018083116105c3575b50505091835250506000602082018190526040820181905260608201819052608082015260a00161061189613354565b905260808101515190915060009061062a906001613411565b905060008260a00151518260ff160190508060ff168860ff1610801561065557508060ff168760ff16105b6106a6576040805162461bcd60e51b815260206004820152601860248201527f546f6b656e20696e646578206f7574206f662072616e67650000000000000000604482015290519081900360640190fd5b5087546001600160a01b031660ff80831690891610156106fa57896007018860ff16815481106106d257fe5b6000918252602090912001546001600160a01b031660c084015260ff881660e0840152610732565b8260a0015182890360ff168151811061070f57fe5b60209081029190910101516001600160a01b031660c084015260ff821660e08401525b8160ff168760ff16101561077c57896007018760ff168154811061075257fe5b6000918252602090912001546001600160a01b031661010084015260ff87166101208401526107b6565b8260a0015182880360ff168151811061079157fe5b60209081029190910101516001600160a01b031661010084015260ff82166101208401525b8260c001516001600160a01b03166370a08231306040518263ffffffff1660e01b815260040180826001600160a01b0316815260200191505060206040518083038186803b15801561080757600080fd5b505afa15801561081b573d6000803e3d6000fd5b505050506040513d602081101561083157600080fd5b5051602084015260c0830151610852906001600160a01b031633308961346e565b6108dd83602001518460c001516001600160a01b03166370a08231306040518263ffffffff1660e01b815260040180826001600160a01b0316815260200191505060206040518083038186803b1580156108ab57600080fd5b505afa1580156108bf573d6000803e3d6000fd5b505050506040513d60208110156108d557600080fd5b505190613411565b602084015260ff80831690891610806108fb57508160ff168760ff16105b15610f2b57606061091a846080015185606001518661014001516134fc565b90508260ff168960ff1610156109865761097f61095a85606001518b60ff168151811061094357fe5b60200260200101518961356290919063ffffffff16565b828b60ff168151811061096957fe5b60200260200101516135bb90919063ffffffff16565b8452610b0e565b60608460a001515167ffffffffffffffff811180156109a457600080fd5b506040519080825280602002602001820160405280156109ce578160200160208202803683370190505b509050846020015181858c0360ff16815181106109e757fe5b602002602001018181525050826001600160a01b0316634d49e87d826000426040518463ffffffff1660e01b81526004018080602001848152602001838152602001828103825285818151815260200191508051906020019060200280838360005b83811015610a61578181015183820152602001610a49565b50505050905001945050505050602060405180830381600087803b158015610a8857600080fd5b505af1158015610a9c573d6000803e3d6000fd5b505050506040513d6020811015610ab257600080fd5b505160208601528151610b0a90839060ff8716908110610ace57fe5b6020026020010151610b04670de0b6b3a7640000610afe8961014001518a6020015161356290919063ffffffff16565b90613615565b906135bb565b8552505b600080610b30610b1d8e61367c565b60e0880151610120890151895187613711565b9050610b6b6001610b6583868a610120015160ff1681518110610b4f57fe5b602002602001015161341190919063ffffffff16565b90613411565b604087015260ff808616908b1610610bab57610ba5866101400151610afe670de0b6b3a7640000896040015161356290919063ffffffff16565b60408701525b610bcf6402540be400610afe8f60040154896040015161356290919063ffffffff16565b9150610c0b866060015187610120015160ff1681518110610bec57fe5b6020026020010151610afe84896040015161341190919063ffffffff16565b60408701525060058c0154600090610c2f906402540be40090610afe908590613562565b9050610c63866060015187610120015160ff1681518110610c4c57fe5b60200260200101518261361590919063ffffffff16565b9050610c84866020015187608001518860e0015160ff168151811061096957fe5b8d6009018760e0015160ff1681548110610c9a57fe5b9060005260206000200181905550610ccc81610b65886040015189608001518a610120015160ff1681518110610b4f57fe5b8d60090187610120015160ff1681548110610ce357fe5b9060005260206000200181905550508360ff168960ff1610610ecb5760008561010001516001600160a01b03166370a08231306040518263ffffffff1660e01b815260040180826001600160a01b0316815260200191505060206040518083038186803b158015610d5357600080fd5b505afa158015610d67573d6000803e3d6000fd5b505050506040513d6020811015610d7d57600080fd5b505160408088015181517f3e3a1560000000000000000000000000000000000000000000000000000000008152600481019190915260ff888e0316602482015260006044820181905242606483015291519293506001600160a01b03871692633e3a156092608480840193602093929083900390910190829087803b158015610e0557600080fd5b505af1158015610e19573d6000803e3d6000fd5b505050506040513d6020811015610e2f57600080fd5b5050610100860151604080517f70a08231000000000000000000000000000000000000000000000000000000008152306004820152905183926001600160a01b0316916370a08231916024808301926020929190829003018186803b158015610e9757600080fd5b505afa158015610eab573d6000803e3d6000fd5b505050506040513d6020811015610ec157600080fd5b5051036040870152505b8685604001511015610f24576040805162461bcd60e51b815260206004820181905260248201527f53776170206469646e277420726573756c7420696e206d696e20746f6b656e73604482015290519081900360640190fd5b50506110d8565b8261010001516001600160a01b03166370a08231306040518263ffffffff1660e01b815260040180826001600160a01b0316815260200191505060206040518083038186803b158015610f7d57600080fd5b505afa158015610f91573d6000803e3d6000fd5b505050506040513d6020811015610fa757600080fd5b505160408085019190915260208481015182517f9169558600000000000000000000000000000000000000000000000000000000815260ff868d0381166004830152868c0316602482015260448101919091526064810188905242608482015291516001600160a01b0384169263916955869260a48083019391928290030181600087803b15801561103857600080fd5b505af115801561104c573d6000803e3d6000fd5b505050506040513d602081101561106257600080fd5b505060408084015161010085015182517f70a0823100000000000000000000000000000000000000000000000000000000815230600482015292516110d2936001600160a01b03909216916370a08231916024808301926020929190829003018186803b1580156108ab57600080fd5b60408401525b6110ff3384604001518561010001516001600160a01b03166139579092919063ffffffff16565b6040808401518151888152602081019190915260ff808b168284015289166060820152905133917f6617207207e397b41fc98016d8c9febb7223f44c355db66ad429730f2b950a60919081900360800190a2505060400151979650505050505050565b6000611179868585856111748a6139dc565b613a7e565b509695505050505050565b6000806111908761367c565b905060008060006111a0896139dc565b905060608a6009018054806020026020016040519081016040528092919081815260200182805480156111f257602002820191906000526020600020905b8154815260200190600101908083116111de575b5050505050905060608b60080180548060200260200160405190810160405280929190818152602001828054801561124957602002820191906000526020600020905b815481526020019060010190808311611235575b5050505050905060008251905061126a6112648484876134fc565b88613c4e565b955060005b8181101561132f5789156112bc5761129f8c8c8381811061128c57fe5b9050602002013585838151811061096957fe5b8482815181106112ab57fe5b602002602001018181525050611327565b61130e8c8c838181106112cb57fe5b90506020020135604051806060016040528060238152602001614aea602391398684815181106112f757fe5b6020026020010151613db49092919063ffffffff16565b84828151811061131a57fe5b6020026020010181815250505b60010161126f565b5061133e6112648484876134fc565b94505050505060008960060160009054906101000a90046001600160a01b03166001600160a01b03166318160ddd6040518163ffffffff1660e01b815260040160206040518083038186803b15801561139657600080fd5b505afa1580156113aa573d6000803e3d6000fd5b505050506040513d60208110156113c057600080fd5b5051905085156113ed576113e283610afe836113dc8684613411565b90613562565b9450505050506113ff565b6113e283610afe836113dc8387613411565b95945050505050565b6000611412614951565b604080516101208101825260008082526020820181905291810182905260068801546001600160a01b03166060820152608081019190915260a081016114578861367c565b815260200161146587613354565b8152602001876008018054806020026020016040519081016040528092919081815260200182805480156114b857602002820191906000526020600020905b8154815260200190600101908083116114a4575b505050505081526020018760090180548060200260200160405190810160405280929190818152602001828054801561151057602002820191906000526020600020905b8154815260200190600101908083116114fc575b5050505050815250905080606001516001600160a01b03166318160ddd6040518163ffffffff1660e01b815260040160206040518083038186803b15801561155757600080fd5b505afa15801561156b573d6000803e3d6000fd5b505050506040513d602081101561158157600080fd5b50516080820152610100810151518451146115e3576040805162461bcd60e51b815260206004820181905260248201527f416d6f756e74732073686f756c64206d6174636820706f6f6c20746f6b656e73604482015290519081900360640190fd5b82611635576040805162461bcd60e51b815260206004820152601560248201527f4d757374206275726e206d6f7265207468616e20300000000000000000000000604482015290519081900360640190fd5b600061164b876004015483610100015151613e4b565b905060608261010001515167ffffffffffffffff8111801561166c57600080fd5b50604051908082528060200260200182016040528015611696578160200160208202803683370190505b50905060608361010001515167ffffffffffffffff811180156116b857600080fd5b506040519080825280602002602001820160405280156116e2578160200160208202803683370190505b50905061170a6117008561010001518660e001518760c001516134fc565b8560a00151613c4e565b845260005b8461010001515181101561177d5761175e88828151811061172c57fe5b6020026020010151604051806060016040528060238152602001614aea6023913987610100015184815181106112f757fe5b82828151811061176a57fe5b602090810291909101015260010161170f565b50611794611700828660e001518760c001516134fc565b602085015260005b846101000151518110156118dd5760006117e38660000151610afe88610100015185815181106117c857fe5b6020026020010151896020015161356290919063ffffffff16565b9050600061180d8484815181106117f657fe5b602002602001015183613e6a90919063ffffffff16565b90506118226402540be400610afe8884613562565b85848151811061182e57fe5b60200260200101818152505061187c6118706402540be400610afe8f6005015489888151811061185a57fe5b602002602001015161356290919063ffffffff16565b858581518110610b4f57fe5b8c600901848154811061188b57fe5b90600052602060002001819055506118bc8584815181106118a857fe5b6020026020010151858581518110610b4f57fe5b8484815181106118c857fe5b6020908102919091010152505060010161179c565b506118f4611700828660e001518760c001516134fc565b60408501819052845160808601516000935061191a92610afe91906113dc908490613411565b90508061196e576040805162461bcd60e51b815260206004820152601b60248201527f4275726e7420616d6f756e742063616e6e6f74206265207a65726f0000000000604482015290519081900360640190fd5b6119798160016135bb565b9050858111156119d0576040805162461bcd60e51b815260206004820152601b60248201527f746f6b656e416d6f756e74203e206d61784275726e416d6f756e740000000000604482015290519081900360640190fd5b83606001516001600160a01b03166379cc679033836040518363ffffffff1660e01b815260040180836001600160a01b0316815260200182815260200192505050600060405180830381600087803b158015611a2b57600080fd5b505af1158015611a3f573d6000803e3d6000fd5b5050505060005b84610100015151811015611a9f57611a9733898381518110611a6457fe5b60200260200101518c6007018481548110611a7b57fe5b6000918252602090912001546001600160a01b03169190613957565b600101611a46565b50336001600160a01b03167f3631c28b1f9dd213e0319fb167b554d76b6c283a41143eb400a0d1adb1af175588848760200151611ae9868a6080015161341190919063ffffffff16565b604051808060200180602001858152602001848152602001838103835287818151815260200191508051906020019060200280838360005b83811015611b39578181015183820152602001611b21565b50505050905001838103825286818151815260200191508051906020019060200280838360005b83811015611b78578181015183820152602001611b60565b50505050905001965050505050505060405180910390a293505050505b949350505050565b600786015460009060ff861681118015611bb95750808560ff16105b611c0a576040805162461bcd60e51b815260206004820152601b60248201527f546f6b656e20696e646578206973206f7574206f662072616e67650000000000604482015290519081900360640190fd5b50600080886007018760ff1681548110611c2057fe5b60009182526020918290200154604080517f70a0823100000000000000000000000000000000000000000000000000000000815233600482015290516001600160a01b03909216935083926370a0823192602480840193829003018186803b158015611c8b57600080fd5b505afa158015611c9f573d6000803e3d6000fd5b505050506040513d6020811015611cb557600080fd5b5051851115611d0b576040805162461bcd60e51b815260206004820152601d60248201527f43616e6e6f742073776170206d6f7265207468616e20796f75206f776e000000604482015290519081900360640190fd5b6000816001600160a01b03166370a08231306040518263ffffffff1660e01b815260040180826001600160a01b0316815260200191505060206040518083038186803b158015611d5a57600080fd5b505afa158015611d6e573d6000803e3d6000fd5b505050506040513d6020811015611d8457600080fd5b50519050611d9d6001600160a01b03831633308961346e565b611dee81836001600160a01b03166370a08231306040518263ffffffff1660e01b815260040180826001600160a01b0316815260200191505060206040518083038186803b1580156108ab57600080fd5b92505050600080611e058a8989866111748e613354565b9150915084821015611e5e576040805162461bcd60e51b815260206004820181905260248201527f53776170206469646e277420726573756c7420696e206d696e20746f6b656e73604482015290519081900360640190fd5b6000611ea08b6008018960ff1681548110611e7557fe5b9060005260206000200154610afe6402540be400610afe8f600501548761356290919063ffffffff16565b9050611ed1848c6009018b60ff1681548110611eb857fe5b90600052602060002001546135bb90919063ffffffff16565b8b6009018a60ff1681548110611ee357fe5b9060005260206000200181905550611f2481610b65858e6009018c60ff1681548110611f0b57fe5b906000526020600020015461341190919063ffffffff16565b8b6009018960ff1681548110611f3657fe5b9060005260206000200181905550611f5b33848d6007018b60ff1681548110611a7b57fe5b604080518581526020810185905260ff808c16828401528a166060820152905133917fc6c1e0630dbe9130cc068028486c0d118ddcea348550819defd5cb8c257f8a38919081900360800190a250909998505050505050505050565b670de0b6b3a764000081565b61025881565b6006850154604080517f18160ddd00000000000000000000000000000000000000000000000000000000815290516000926001600160a01b031691839183916318160ddd916004808301926020929190829003018186803b15801561202d57600080fd5b505afa158015612041573d6000803e3d6000fd5b505050506040513d602081101561205757600080fd5b50516007890154604080517f70a08231000000000000000000000000000000000000000000000000000000008152336004820152905192935090916001600160a01b038516916370a08231916024808301926020929190829003018186803b1580156120c257600080fd5b505afa1580156120d6573d6000803e3d6000fd5b505050506040513d60208110156120ec57600080fd5b5051871115612142576040805162461bcd60e51b815260206004820152600d60248201527f3e4c502e62616c616e63654f6600000000000000000000000000000000000000604482015290519081900360640190fd5b808660ff1610612199576040805162461bcd60e51b815260206004820152600f60248201527f546f6b656e206e6f7420666f756e640000000000000000000000000000000000604482015290519081900360640190fd5b6000806121b18b8a8a6121ab8e613354565b88613e82565b925090508681101561220a576040805162461bcd60e51b815260206004820152600e60248201527f6479203c206d696e416d6f756e74000000000000000000000000000000000000604482015290519081900360640190fd5b6122496122376122306402540be400610afe8f600501548761356290919063ffffffff16565b83906135bb565b8c6009018a60ff1681548110611f0b57fe5b8b6009018960ff168154811061225b57fe5b6000918252602082200191909155604080517f79cc6790000000000000000000000000000000000000000000000000000000008152336004820152602481018c905290516001600160a01b038816926379cc6790926044808201939182900301818387803b1580156122cc57600080fd5b505af11580156122e0573d6000803e3d6000fd5b505050506122fb33828d6007018b60ff1681548110611a7b57fe5b604080518a81526020810186905260ff8a168183015260608101839052905133917f43fb02998f4e03da2e0e6fff53fdbf0c40a9f45f145dc377fc30615d7d7a8a64919081900360800190a29a9950505050505050505050565b60006060856007018054806020026020016040519081016040528092919081815260200182805480156123b157602002820191906000526020600020905b81546001600160a01b03168152600190910190602001808311612393575b50505050509050805184511461240e576040805162461bcd60e51b815260206004820181905260248201527f416d6f756e7473206d757374206d6174636820706f6f6c656420746f6b656e73604482015290519081900360640190fd5b6060815167ffffffffffffffff8111801561242857600080fd5b50604051908082528060200260200182016040528015612452578160200160208202803683370190505b50905061245d614951565b604080516101208101825260008082526020820181905291810182905260068a01546001600160a01b03166060820152608081019190915260a081016124a28a61367c565b81526020016124b089613354565b81526020018960080180548060200260200160405190810160405280929190818152602001828054801561250357602002820191906000526020600020905b8154815260200190600101908083116124ef575b505050505081526020018960090180548060200260200160405190810160405280929190818152602001828054801561255b57602002820191906000526020600020905b815481526020019060010190808311612547575b5050505050815250905080606001516001600160a01b03166318160ddd6040518163ffffffff1660e01b815260040160206040518083038186803b1580156125a257600080fd5b505afa1580156125b6573d6000803e3d6000fd5b505050506040513d60208110156125cc57600080fd5b50516080820181905215612602576125ff6125f58261010001518360e001518460c001516134fc565b8260a00151613c4e565b81525b60005b83518110156128455760808201511515806126335750600087828151811061262957fe5b6020026020010151115b612684576040805162461bcd60e51b815260206004820152601e60248201527f4d75737420737570706c7920616c6c20746f6b656e7320696e20706f6f6c0000604482015290519081900360640190fd5b86818151811061269057fe5b60200260200101516000146127f95760008482815181106126ad57fe5b60200260200101516001600160a01b03166370a08231306040518263ffffffff1660e01b815260040180826001600160a01b0316815260200191505060206040518083038186803b15801561270157600080fd5b505afa158015612715573d6000803e3d6000fd5b505050506040513d602081101561272b57600080fd5b5051885190915061277b90339030908b908690811061274657fe5b602002602001015188868151811061275a57fe5b60200260200101516001600160a01b031661346e909392919063ffffffff16565b6127df8186848151811061278b57fe5b60200260200101516001600160a01b03166370a08231306040518263ffffffff1660e01b815260040180826001600160a01b0316815260200191505060206040518083038186803b1580156108ab57600080fd5b8883815181106127eb57fe5b602002602001018181525050505b61282187828151811061280857fe5b6020026020010151836101000151838151811061096957fe5b826101000151828151811061283257fe5b6020908102919091010152600101612605565b506128616125f58261010001518360e001518460c001516134fc565b602082018190528151106128bc576040805162461bcd60e51b815260206004820152601160248201527f442073686f756c6420696e637265617365000000000000000000000000000000604482015290519081900360640190fd5b60208101516040820152608081015160009015612a6e5760006128e48a600401548651613e4b565b905060005b8551811015612a1f57600061292c8560000151610afe8e600901858154811061290e57fe5b9060005260206000200154886020015161356290919063ffffffff16565b905061296c6402540be400610afe612965886101000151868151811061294e57fe5b602002602001015185613e6a90919063ffffffff16565b8690613562565b86838151811061297857fe5b6020026020010181815250506129b56129a46402540be400610afe8f600501548a878151811061185a57fe5b8661010001518481518110610b4f57fe5b8c60090183815481106129c457fe5b90600052602060002001819055506129fa8683815181106129e157fe5b60200260200101518661010001518481518110610b4f57fe5b8561010001518381518110612a0b57fe5b6020908102919091010152506001016128e9565b50612a45612a3b8461010001518560e001518660c001516134fc565b8460a00151613c4e565b6040840181905283516080850151612a6692610afe91906113dc9084613411565b915050612a92565b6101008201518051612a8a9160098c01916020909101906149a6565b505060208101515b85811015612ae7576040805162461bcd60e51b815260206004820152601b60248201527f436f756c646e2774206d696e74206d696e207265717565737465640000000000604482015290519081900360640190fd5b6006890154604080517f40c10f190000000000000000000000000000000000000000000000000000000081523360048201526024810184905290516001600160a01b03909216916340c10f199160448082019260009290919082900301818387803b158015612b5557600080fd5b505af1158015612b69573d6000803e3d6000fd5b50505050336001600160a01b03167f189c623b666b1b45b83d7178f39b8c087cb09774317ca2f53c2d3c3726f222a288858560200151611ae98688608001516135bb90919063ffffffff16565b6000612bc06149f1565b6040518060e00160405280612bd4886139dc565b815287546001600160a01b03166020820152600060408201819052600389015460ff166060808401919091526080830182905260a0830182905260c090920152815191925090612c25908990613ee5565b8051909150612c35906001613411565b60ff9081166040840181905260608401510190818116908816108015612c6057508060ff168660ff16105b612cb1576040805162461bcd60e51b815260206004820152601860248201527f546f6b656e20696e646578206f7574206f662072616e67650000000000000000604482015290519081900360640190fd5b50816040015160ff168660ff161015612d0f57612d05612cf6896008018860ff1681548110612cdc57fe5b90600052602060002001548661356290919063ffffffff16565b828860ff168151811061096957fe5b60a0830152612f88565b6040820151958690039560ff9081169086161015612ee6576060826060015160ff1667ffffffffffffffff81118015612d4757600080fd5b50604051908082528060200260200182016040528015612d71578160200160208202803683370190505b50905084818860ff1681518110612d8457fe5b602002602001018181525050612e67670de0b6b3a7640000610afe856000015186602001516001600160a01b031663e6ab28068660016040518363ffffffff1660e01b815260040180806020018315158152602001828103825284818151815260200191508051906020019060200280838360005b83811015612e11578181015183820152602001612df9565b50505050905001935050505060206040518083038186803b158015612e3557600080fd5b505afa158015612e49573d6000803e3d6000fd5b505050506040513d6020811015612e5f57600080fd5b505190613562565b8360a0018181525050612edb82846040015160ff1681518110612e8657fe5b6020026020010151610b04612ed0612ead60026402540be40061356290919063ffffffff16565b8c54610afe90612ec5906001600160a01b0316613f96565b60a08a015190613562565b60a087015190613411565b60a084015250612f80565b81602001516001600160a01b031663a95b089f8784604001518803876040518463ffffffff1660e01b8152600401808460ff1681526020018360ff168152602001828152602001935050505060206040518083038186803b158015612f4a57600080fd5b505afa158015612f5e573d6000803e3d6000fd5b505050506040513d6020811015612f7457600080fd5b505192506113ff915050565b816040015195505b604082015160ff908116608084018190529086161015612fac5760ff851660808301525b6000612fcb612fba8a61367c565b8885608001518660a0015186613711565b9050612fe96001610b658385876080015160ff1681518110610b4f57fe5b60c0840181905260048a015460009161300c916402540be40091610afe91613562565b60c085015190915061301e9082613411565b60c08501525050604082015160ff90811690861610156130795761306f88600801836080015160ff168154811061305157fe5b90600052602060002001548360c0015161361590919063ffffffff16565b60c083015261312a565b81602001516001600160a01b031663342a87a16130b38460000151610afe670de0b6b3a76400008760c0015161356290919063ffffffff16565b846040015188036040518363ffffffff1660e01b8152600401808381526020018260ff1681526020019250505060206040518083038186803b1580156130f857600080fd5b505afa15801561310c573d6000803e3d6000fd5b505050506040513d602081101561312257600080fd5b505160c08301525b5060c001519695505050505050565b6000806132046131f68560090180548060200260200160405190810160405280929190818152602001828054801561319057602002820191906000526020600020905b81548152602001906001019080831161317c575b5050505050866008018054806020026020016040519081016040528092919081815260200182805480156131e357602002820191906000526020600020905b8154815260200190600101908083116131cf575b50505050506131f1876139dc565b6134fc565b6131ff8661367c565b613c4e565b905060008460060160009054906101000a90046001600160a01b03166001600160a01b03166318160ddd6040518163ffffffff1660e01b815260040160206040518083038186803b15801561325857600080fd5b505afa15801561326c573d6000803e3d6000fd5b505050506040513d602081101561328257600080fd5b5051905080156132ab576132a281610afe84670de0b6b3a7640000613562565b925050506132b2565b6000925050505b92915050565b600061334a8584846132c9886139dc565b8960060160009054906101000a90046001600160a01b03166001600160a01b03166318160ddd6040518163ffffffff1660e01b815260040160206040518083038186803b15801561331957600080fd5b505afa15801561332d573d6000803e3d6000fd5b505050506040513d602081101561334357600080fd5b5051613e82565b5095945050505050565b6000610258826002015401421115613405578154604080517fe25aa5fa00000000000000000000000000000000000000000000000000000000815290516000926001600160a01b03169163e25aa5fa916004808301926020929190829003018186803b1580156133c357600080fd5b505afa1580156133d7573d6000803e3d6000fd5b505050506040513d60208110156133ed57600080fd5b505160018401819055426002850155915061340c9050565b5060018101545b919050565b600082821115613468576040805162461bcd60e51b815260206004820152601e60248201527f536166654d6174683a207375627472616374696f6e206f766572666c6f770000604482015290519081900360640190fd5b50900390565b604080516001600160a01b0380861660248301528416604482015260648082018490528251808303909101815260849091019091526020810180517bffffffffffffffffffffffffffffffffffffffffffffffffffffffff167f23b872dd000000000000000000000000000000000000000000000000000000001790526134f6908590614006565b50505050565b60608061350985856140b7565b905060006135226001875161341190919063ffffffff16565b9050613540670de0b6b3a7640000610afe8685858151811061185a57fe5b82828151811061354c57fe5b60209081029190910101525090505b9392505050565b600082613571575060006132b2565b8282028284828161357e57fe5b041461355b5760405162461bcd60e51b8152600401808060200182810382526021815260200180614a9f6021913960400191505060405180910390fd5b60008282018381101561355b576040805162461bcd60e51b815260206004820152601b60248201527f536166654d6174683a206164646974696f6e206f766572666c6f770000000000604482015290519081900360640190fd5b600080821161366b576040805162461bcd60e51b815260206004820152601a60248201527f536166654d6174683a206469766973696f6e206279207a65726f000000000000604482015290519081900360640190fd5b81838161367457fe5b049392505050565b6003810154600182015460009190428211156137085760028401548454808311156136da576136cf6136c86136b18685613411565b610afe6136be4287613411565b6113dc8887613411565b82906135bb565b94505050505061340c565b6136cf6137016136ea8685613411565b610afe6136f74287613411565b6113dc8689613411565b8290613411565b915061340c9050565b805160009060ff8681169086161415613771576040805162461bcd60e51b815260206004820152601d60248201527f43616e277420636f6d7061726520746f6b656e20746f20697473656c66000000604482015290519081900360640190fd5b808660ff161080156137855750808560ff16105b6137d6576040805162461bcd60e51b815260206004820152601660248201527f546f6b656e73206d75737420626520696e20706f6f6c00000000000000000000604482015290519081900360640190fd5b60006137e28489613c4e565b9050806000806137f2858c613562565b90506000805b8681101561386b578b60ff168114156138135789915061383d565b8a60ff1681146138385788818151811061382957fe5b6020026020010151915061383d565b613863565b61384784836135bb565b93506138606138568389613562565b610afe8789613562565b94505b6001016137f8565b506138886138798388613562565b610afe60646113dc888a613562565b935060006138a561389e84610afe896064613562565b85906135bb565b9050600086815b6101008110156139095790915081906138df6138d18a610b6587610b04876002613562565b610afe8a610b048680613562565b91506138eb82846141ae565b15613901575098506113ff975050505050505050565b6001016138ac565b506040805162461bcd60e51b815260206004820152601e60248201527f417070726f78696d6174696f6e20646964206e6f7420636f6e76657267650000604482015290519081900360640190fd5b604080516001600160a01b038416602482015260448082018490528251808303909101815260649091019091526020810180517bffffffffffffffffffffffffffffffffffffffffffffffffffffffff167fa9059cbb000000000000000000000000000000000000000000000000000000001790526139d7908490614006565b505050565b6000610258826002015401421115613405578154604080517fe25aa5fa00000000000000000000000000000000000000000000000000000000815290516001600160a01b039092169163e25aa5fa91600480820192602092909190829003018186803b158015613a4b57600080fd5b505afa158015613a5f573d6000803e3d6000fd5b505050506040513d6020811015613a7557600080fd5b5051905061340c565b6000806060613a8d8885613ee5565b905080518760ff16108015613aa5575080518660ff16105b613af6576040805162461bcd60e51b815260206004820152601860248201527f546f6b656e20696e646578206f7574206f662072616e67650000000000000000604482015290519081900360640190fd5b8051600090613b06906001613411565b90506000613b398a6008018a60ff1681548110613b1f57fe5b90600052602060002001548861356290919063ffffffff16565b9050818960ff161415613b5f57613b5c670de0b6b3a7640000610afe8389613562565b90505b613b88838a60ff1681518110613b7157fe5b6020026020010151826135bb90919063ffffffff16565b90506000613ba1613b988c61367c565b8b8b8588613711565b9050613bbb6001610b6583878d60ff1681518110610b4f57fe5b9550828960ff161415613be157613bde87610afe88670de0b6b3a7640000613562565b95505b613c016402540be400610afe8d600401548961356290919063ffffffff16565b9450613c0d8686613411565b9550613c3e8b6008018a60ff1681548110613c2457fe5b90600052602060002001548761361590919063ffffffff16565b9550505050509550959350505050565b815160009081805b82811015613c8e57613c84868281518110613c6d57fe5b6020026020010151836135bb90919063ffffffff16565b9150600101613c56565b5080613c9f576000925050506132b2565b60008181613cad8786613562565b905060005b610100811015613d66578260005b87811015613cef57613ce5613cdb898d848151811061185a57fe5b610afe8488613562565b9150600101613cc0565b509293508392613d3d613d1d613d0a836113dc8b60016135bb565b610b046064610afe896113dc8a84613411565b610afe866113dc613d2e868d613562565b610b046064610afe8b8f613562565b9350613d4984866141ae565b15613d5d57839750505050505050506132b2565b50600101613cb2565b506040805162461bcd60e51b815260206004820152601360248201527f4420646f6573206e6f7420636f6e766572676500000000000000000000000000604482015290519081900360640190fd5b60008184841115613e435760405162461bcd60e51b81526004018080602001828103825283818151815260200191508051906020019080838360005b83811015613e08578181015183820152602001613df0565b50505050905090810190601f168015613e355780820380516001836020036101000a031916815260200191505b509250505060405180910390fd5b505050900390565b600061355b613e6060046113dc856001613411565b610afe8585613562565b600081831115613e7d57508082036132b2565b500390565b600080600080600080613e988b8a8c8b8b6141c5565b809450819350829650505050613ed384610b658d6008018c60ff1681548110613ebd57fe5b600091825260209091200154610afe8686613411565b939b939a509298505050505050505050565b606061355b83600901805480602002602001604051908101604052809291908181526020018280548015613f3857602002820191906000526020600020905b815481526020019060010190808311613f24575b505050505084600801805480602002602001604051908101604052809291908181526020018280548015613f8b57602002820191906000526020600020905b815481526020019060010190808311613f77575b5050505050846134fc565b6000816001600160a01b0316635fd65f0f6040518163ffffffff1660e01b815260040160e06040518083038186803b158015613fd157600080fd5b505afa158015613fe5573d6000803e3d6000fd5b505050506040513d60e0811015613ffb57600080fd5b506080015192915050565b606061405b826040518060400160405280602081526020017f5361666545524332303a206c6f772d6c6576656c2063616c6c206661696c6564815250856001600160a01b031661457d9092919063ffffffff16565b8051909150156139d75780806020019051602081101561407a57600080fd5b50516139d75760405162461bcd60e51b815260040180806020018281038252602a815260200180614ac0602a913960400191505060405180910390fd5b81518151606091908114614112576040805162461bcd60e51b815260206004820152601f60248201527f42616c616e636573206d757374206d61746368206d756c7469706c6965727300604482015290519081900360640190fd5b60608167ffffffffffffffff8111801561412b57600080fd5b50604051908082528060200260200182016040528015614155578160200160208202803683370190505b50905060005b828110156141a55761418685828151811061417257fe5b602002602001015187838151811061185a57fe5b82828151811061419257fe5b602090810291909101015260010161415b565b50949350505050565b600060016141bc8484613e6a565b11159392505050565b600080600060606141d68987613ee5565b905080518860ff1610614230576040805162461bcd60e51b815260206004820152601860248201527f546f6b656e20696e646578206f7574206f662072616e67650000000000000000604482015290519081900360640190fd5b614238614a2d565b6040518060c00160405280600081526020016000815260200160008152602001600081526020016142688c61367c565b815260200160008152509050614282828260800151613c4e565b8082526142a29061429a908890610afe908c90613562565b825190613411565b60208201528151829060ff8b169081106142b857fe5b6020026020010151881115614314576040805162461bcd60e51b815260206004820152601a60248201527f5769746864726177206578636565647320617661696c61626c65000000000000604482015290519081900360640190fd5b61432881608001518a84846020015161458c565b6040820152815160609067ffffffffffffffff8111801561434857600080fd5b50604051908082528060200260200182016040528015614372578160200160208202803683370190505b5090506143848b600401548451613e4b565b606083015260005b835181101561445b578381815181106143a157fe5b60200260200101518360a001818152505061443c6144316402540be400610afe86606001518f60ff168614614406576144016143f68960000151610afe8b602001518c60a0015161356290919063ffffffff16565b60a08a015190613411565b6113dc565b6113dc8860400151610b658a60000151610afe8c602001518d60a0015161356290919063ffffffff16565b60a085015190613411565b82828151811061444857fe5b602090810291909101015260010161438c565b50600061448461447584608001518d85876020015161458c565b838d60ff1681518110610b4f57fe5b8451909150614494906001613411565b8b60ff16141561451d576144b489610afe83670de0b6b3a7640000613562565b90506144d989610afe670de0b6b3a7640000866040015161356290919063ffffffff16565b83604001818152505061450189610afe670de0b6b3a7640000878f60ff168151811061185a57fe5b848c60ff168151811061451057fe5b6020026020010181815250505b6145498c6008018c60ff168154811061453257fe5b600091825260209091200154610afe836001613411565b9050808360400151858d60ff168151811061456057fe5b602002602001015196509650965050505050955095509592505050565b6060611b9584846000856146f9565b815160009060ff851681116145e8576040805162461bcd60e51b815260206004820152600f60248201527f546f6b656e206e6f7420666f756e640000000000000000000000000000000000604482015290519081900360640190fd5b826000806145f68985613562565b905060005b8481101561465d578860ff1681146146555761463388828151811061461c57fe5b6020026020010151846135bb90919063ffffffff16565b9250614652614648868a848151811061185a57fe5b610afe868a613562565b93505b6001016145fb565b5061467a61466b8286613562565b610afe60646113dc878b613562565b9250600061469761469083610afe8a6064613562565b84906135bb565b9050600087815b6101008110156139095790915081906146d16146c38b610b6587610b04876002613562565b610afe89610b048680613562565b91506146dd82846141ae565b156146f157509650611b9595505050505050565b60010161469e565b60608247101561473a5760405162461bcd60e51b8152600401808060200182810382526026815260200180614a796026913960400191505060405180910390fd5b61474385614873565b614794576040805162461bcd60e51b815260206004820152601d60248201527f416464726573733a2063616c6c20746f206e6f6e2d636f6e7472616374000000604482015290519081900360640190fd5b60006060866001600160a01b031685876040518082805190602001908083835b602083106147f157805182527fffffffffffffffffffffffffffffffffffffffffffffffffffffffffffffffe090920191602091820191016147b4565b6001836020036101000a03801982511681845116808217855250505050505090500191505060006040518083038185875af1925050503d8060008114614853576040519150601f19603f3d011682016040523d82523d6000602084013e614858565b606091505b5091509150614868828286614879565b979650505050505050565b3b151590565b6060831561488857508161355b565b8251156148985782518084602001fd5b60405162461bcd60e51b8152602060048201818152845160248401528451859391928392604401919085019080838360008315613e08578181015183820152602001613df0565b60405180610160016040528060008152602001600081526020016000815260200160608152602001606081526020016060815260200160006001600160a01b03168152602001600060ff16815260200160006001600160a01b03168152602001600060ff168152602001600081525090565b60405180610120016040528060008152602001600081526020016000815260200160006001600160a01b0316815260200160008152602001600081526020016000815260200160608152602001606081525090565b8280548282559060005260206000209081019282156149e1579160200282015b828111156149e15782518255916020019190600101906149c6565b506149ed929150614a63565b5090565b6040805160e081018252600080825260208201819052918101829052606081018290526080810182905260a0810182905260c081019190915290565b6040518060c001604052806000815260200160008152602001600081526020016000815260200160008152602001600081525090565b5b808211156149ed5760008155600101614a6456fe416464726573733a20696e73756666696369656e742062616c616e636520666f722063616c6c536166654d6174683a206d756c7469706c69636174696f6e206f766572666c6f775361666545524332303a204552433230206f7065726174696f6e20646964206e6f74207375636365656443616e6e6f74207769746864726177206d6f7265207468616e20617661696c61626c65a2646970667358221220c6c59fced5b50e03eabbcaebe09d0fe28b2eb40b64bc1ffeb9eede3ce635c94764736f6c634300060c0033",
  "devdoc": {
    "details": "Contracts relying on this library must initialize SwapUtils.Swap struct then use this library for SwapUtils.Swap struct. Note that this library contains both functions called by users and admins. Admin functions should be protected within contracts using this library.",
    "kind": "dev",
    "methods": {
      "addLiquidity(SwapUtils.Swap storage,MetaSwapUtils.MetaSwap storage,uint256[],uint256)": {
        "params": {
          "amounts": "the amounts of each token to add, in their native precision",
          "metaSwapStorage": "MetaSwap struct to read from and write to",
          "minToMint": "the minimum LP tokens adding this amount of liquidity should mint, otherwise revert. Handy for front-running mitigation allowed addresses. If the pool is not in the guarded launch phase, this parameter will be ignored.",
          "self": "Swap struct to read from and write to"
        },
        "returns": {
          "_0": "amount of LP token user received"
        }
      },
      "calculateSwap(SwapUtils.Swap storage,MetaSwapUtils.MetaSwap storage,uint8,uint8,uint256)": {
        "params": {
          "dx": "the number of tokens to sell. If the token charges a fee on transfers, use the amount that gets transferred after the fee.",
          "metaSwapStorage": "MetaSwap struct from the same contract",
          "self": "Swap struct to read from",
          "tokenIndexFrom": "the token to sell",
          "tokenIndexTo": "the token to buy"
        },
        "returns": {
          "dy": "the number of tokens the user will get"
        }
      },
      "calculateSwapUnderlying(SwapUtils.Swap storage,MetaSwapUtils.MetaSwap storage,uint8,uint8,uint256)": {
        "params": {
          "dx": "the number of tokens to sell. If the token charges a fee on transfers, use the amount that gets transferred after the fee.",
          "metaSwapStorage": "MetaSwap struct from the same contract",
          "self": "Swap struct to read from",
          "tokenIndexFrom": "the token to sell",
          "tokenIndexTo": "the token to buy"
        },
        "returns": {
          "_0": "dy the number of tokens the user will get"
        }
      },
      "calculateTokenAmount(SwapUtils.Swap storage,MetaSwapUtils.MetaSwap storage,uint256[],bool)": {
        "details": "This shouldn't be used outside frontends for user estimates.",
        "params": {
          "amounts": "an array of token amounts to deposit or withdrawal, corresponding to pooledTokens. The amount should be in each pooled token's native precision. If a token charges a fee on transfers, use the amount that gets transferred after the fee.",
          "deposit": "whether this is a deposit or a withdrawal",
          "metaSwapStorage": "MetaSwap struct to read from",
          "self": "Swap struct to read from"
        },
        "returns": {
          "_0": "if deposit was true, total amount of lp token that will be minted and if deposit was false, total amount of lp token that will be burned"
        }
      },
      "calculateWithdrawOneToken(SwapUtils.Swap storage,MetaSwapUtils.MetaSwap storage,uint256,uint8)": {
        "params": {
          "metaSwapStorage": "MetaSwap struct to read from",
          "self": "Swap struct to read from",
          "tokenAmount": "the amount to withdraw in the pool's precision",
          "tokenIndex": "which token will be withdrawn"
        },
        "returns": {
          "dy": "the amount of token user will receive"
        }
      },
      "getVirtualPrice(SwapUtils.Swap storage,MetaSwapUtils.MetaSwap storage)": {
        "params": {
          "metaSwapStorage": "MetaSwap struct to read from",
          "self": "Swap struct to read from"
        },
        "returns": {
          "_0": "the virtual price, scaled to precision of BASE_VIRTUAL_PRICE_PRECISION"
        }
      },
      "removeLiquidityImbalance(SwapUtils.Swap storage,MetaSwapUtils.MetaSwap storage,uint256[],uint256)": {
        "params": {
          "amounts": "how much of each token to withdraw",
          "maxBurnAmount": "the max LP token provider is willing to pay to remove liquidity. Useful as a front-running mitigation.",
          "metaSwapStorage": "MetaSwap struct to read from and write to",
          "self": "Swap struct to read from and write to"
        },
        "returns": {
          "_0": "actual amount of LP tokens burned in the withdrawal"
        }
      },
      "removeLiquidityOneToken(SwapUtils.Swap storage,MetaSwapUtils.MetaSwap storage,uint256,uint8,uint256)": {
        "params": {
          "metaSwapStorage": "MetaSwap struct to read from and write to",
          "minAmount": "the minimum amount to withdraw, otherwise revert",
          "self": "Swap struct to read from and write to",
          "tokenAmount": "the amount of the lp tokens to burn",
          "tokenIndex": "the index of the token you want to receive"
        },
        "returns": {
          "_0": "amount chosen token that user received"
        }
      },
      "swap(SwapUtils.Swap storage,MetaSwapUtils.MetaSwap storage,uint8,uint8,uint256,uint256)": {
        "params": {
          "dx": "the amount of tokens the user wants to sell",
          "metaSwapStorage": "MetaSwap struct to read from and write to",
          "minDy": "the min amount the user would like to receive, or revert.",
          "self": "Swap struct to read from and write to",
          "tokenIndexFrom": "the token the user wants to sell",
          "tokenIndexTo": "the token the user wants to buy"
        },
        "returns": {
          "_0": "amount of token user received on swap"
        }
      },
      "swapUnderlying(SwapUtils.Swap storage,MetaSwapUtils.MetaSwap storage,uint8,uint8,uint256,uint256)": {
        "details": "Since this calls multiple external functions during the execution, it is recommended to protect any function that depends on this with reentrancy guards.",
        "params": {
          "dx": "the amount of tokens the user wants to sell",
          "metaSwapStorage": "MetaSwap struct to read from and write to",
          "minDy": "the min amount the user would like to receive, or revert.",
          "self": "Swap struct to read from and write to",
          "tokenIndexFrom": "the token the user wants to sell",
          "tokenIndexTo": "the token the user wants to buy"
        },
        "returns": {
          "_0": "amount of token user received on swap"
        }
      }
    },
    "title": "MetaSwapUtils library",
    "version": 1
  },
  "userdoc": {
    "kind": "user",
    "methods": {
      "addLiquidity(SwapUtils.Swap storage,MetaSwapUtils.MetaSwap storage,uint256[],uint256)": {
        "notice": "Add liquidity to the pool"
      },
      "calculateSwap(SwapUtils.Swap storage,MetaSwapUtils.MetaSwap storage,uint8,uint8,uint256)": {
        "notice": "Externally calculates a swap between two tokens. The SwapUtils.Swap storage and MetaSwap storage should be from the same MetaSwap contract."
      },
      "calculateSwapUnderlying(SwapUtils.Swap storage,MetaSwapUtils.MetaSwap storage,uint8,uint8,uint256)": {
        "notice": "Calculates the expected return amount from swapping between the pooled tokens and the underlying tokens of the base Swap pool."
      },
      "calculateTokenAmount(SwapUtils.Swap storage,MetaSwapUtils.MetaSwap storage,uint256[],bool)": {
        "notice": "A simple method to calculate prices from deposits or withdrawals, excluding fees but including slippage. This is helpful as an input into the various \"min\" parameters on calls to fight front-running"
      },
      "calculateWithdrawOneToken(SwapUtils.Swap storage,MetaSwapUtils.MetaSwap storage,uint256,uint8)": {
        "notice": "Calculate how much the user would receive when withdrawing via single token"
      },
      "getVirtualPrice(SwapUtils.Swap storage,MetaSwapUtils.MetaSwap storage)": {
        "notice": "Get the virtual price, to help calculate profit"
      },
      "removeLiquidityImbalance(SwapUtils.Swap storage,MetaSwapUtils.MetaSwap storage,uint256[],uint256)": {
        "notice": "Remove liquidity from the pool, weighted differently than the pool's current balances."
      },
      "removeLiquidityOneToken(SwapUtils.Swap storage,MetaSwapUtils.MetaSwap storage,uint256,uint8,uint256)": {
        "notice": "Remove liquidity from the pool all in one token."
      },
      "swap(SwapUtils.Swap storage,MetaSwapUtils.MetaSwap storage,uint8,uint8,uint256,uint256)": {
        "notice": "swap two tokens in the pool"
      },
      "swapUnderlying(SwapUtils.Swap storage,MetaSwapUtils.MetaSwap storage,uint8,uint8,uint256,uint256)": {
        "notice": "Swaps with the underlying tokens of the base Swap pool. For this function, the token indices are flattened out so that underlying tokens are represented in the indices."
      }
    },
    "notice": "A library to be used within MetaSwap.sol. Contains functions responsible for custody and AMM functionalities. MetaSwap is a modified version of Swap that allows Swap's LP token to be utilized in pooling with other tokens. As an example, if there is a Swap pool consisting of [DAI, USDC, USDT]. Then a MetaSwap pool can be created with [sUSD, BaseSwapLPToken] to allow trades between either the LP token or the underlying tokens and sUSD.",
    "version": 1
  },
  "storageLayout": {
    "storage": [],
    "types": null
  }
}
